unique_id,asin,product_name,product_type,helpful,rating,title,date,reviewer,reviewer_location,review_text
"B000CEQILO:great_slacks:deborah_blackwell_""celeste""",B000CEQILO,Haggar Men's Cool 18 Pleated Pant - 21114457486: Apparel,apparel,,5.0,Great slacks,"February 16, 2007","Deborah Blackwell ""Celeste""",Mountain Home AR USA,"The fabric in these slacks allow you to sit for hours and then stand knowing your slacks look neat and freshly pressed. They wash beautifully and require little or no ironing. My husband wishes all of his slacks wore this well. The hidden elastic makes the slacks just as comfortable when you are sitting down or bending down as they are when you are standing.
Frankly I wish I could find slacks for women that were this well made especially at the price Hagaar offers.
Haagar has done a terrific job again"
"B00008RS9E:comfortable,_practical:billacorn",B00008RS9E,Calvin Klein End on End Boxer Underwear: Apparel,apparel,1 of 1,4.0,"Comfortable, practical","July 27, 2006",BillAcorn,,"I have owned a pair of these a year or more and have probably laundered them 30-40 times.  They are very comfortable for me, though comfort is highly variable for each person.  The material is light weight but appears of good quality and I do not detect any deterioriation. At first I was concerned about the elastic which appeared narrow and weak, but it still feels as strong as when new and holds fine.  I will purchase more of these to have in a mix of styles.

About the same time as I purchased these boxers I purchased a couple pair of Faconnable boxers at about twice the price with similarly light weight material.  One pair of these ripped recently. My experience is the CK material is holding up better than the Facconable that costs twice as much.

I doubt these will elicit much commentary from significant or potentially significant others"
"B0007MCQAS:great_shoes!:todd_h._koss_""dealmaker""",B0007MCQAS,Bostonian Men's Canton Oxford: Apparel,apparel,3 of 5,5.0,Great shoes!,"July 6, 2006","Todd H. Koss ""Dealmaker""","Fond du Lac, WI  USA","I have a wide, relatively short foot with a high arch and have lots of problems finding high quality dress shoes that fit.  Bostonians are the only quality shoes that fit me, so I have been loyal for the last decade.  I can't find them in my area, so Amazon is the only channel I use to get them"
"B000AICTWE:oooo,_do_i_really_like_these_stripy_stripes:ophella_paige",B000AICTWE,Shadow Stripe 3-pc. Set: Apparel,apparel,12 of 12,5.0,"Oooo, Do I Really Like These Stripy Stripes","October 23, 2005",Ophella Paige,"Reno, Nevada","You can kind of see through them, kind of not. The skirt is like a nifty mini, the G-string is not uncomfortable. This outfit looks good on my girlfriends, looks good on me and it'll look good on you too"
"B000FPH6ZM:fine_shoes!!!!:a._white_""cassandra_wyatt""",B000FPH6ZM,Carlos by Carlos Santana Women's Fierce Pump: Apparel,apparel,,5.0,FINE SHOES!!!!,"March 19, 2007","A. white ""Cassandra wyatt""",alabama,When I bought these shoes I didn't know they would look so pretty. I am glad I bought these shoes
B0007OW804:t_shirts:claire_e._giordano,B0007OW804,Russell Athletic Men's Big & Tall Basic Short Sleeve Solid Crew Neck T-Shirt: Apparel,apparel,,5.0,T Shirts,"January 15, 2007",Claire E. Giordano,,  Purchased for our 6 ft 7 son and he is very pleased with them. They fit very comfortable and are long enough so that they do not come out of his belt line
"B0007OW804:5-star_russell_t-shirts:marti_eastman_""ssavvystuff""",B0007OW804,Russell Athletic Men's Big & Tall Basic Short Sleeve Solid Crew Neck T-Shirt: Apparel,apparel,,5.0,5-star Russell T-Shirts,"March 16, 2006","Marti Eastman ""SsavvyStuff""",Oregon USA,"Russell!  I really wouldn't buy any other kind.  Too bad they don't make concert T-shirts!  Great material, long-lasting.  The best"
B000AKXABG:beauty_and_comfort:fun_to_learn,B000AKXABG,Touch Ups Molly: Apparel,apparel,,5.0,beauty AND comfort,"February 11, 2007",fun to learn,,These are very pretty without too much fluff. The leather bottoms are padded which helps your feet especially if your home is on concrete slab. I love them
B000BWKUF2:not_your_fathers_jockstrap_(or_yours_from_high_school)!:crichards_in_nyc,B000BWKUF2,Bike White Performance Cotton Jockstrap: Apparel,apparel,1 of 1,5.0,Not your Fathers Jockstrap (or yours from High School)!,"January 4, 2007",CRichards in NYC,"Brooklyn, NY United States","This is the standard style from the new line of Performance jocks from Bike. This waistband is slightly smaller than the traditional 3 inch, but very comfortable. The pouch fits nice and snug giving you perfect support and the leg straps don't twist or bind. Easy to launder and pretty inexpensive. I got rid of my old worn-out jocks and bought a few of these new ones. They're masculine, modern and comfortable, but not something that would be embarassing putting on or taking off at the gym (like an orange or blue jock). A good buy.  Comes in a black version, that is also great.  I've worn for working out, and just around town - good for both."
B0007XVUHM:awesome_and_comfortable!!:brant_voigt,B0007XVUHM,C-IN2 Sling Support Lo No Show Profile Brief 1036: Apparel,apparel,5 of 6,5.0,AWESOME and comfortable!!,"July 23, 2006",Brant Voigt,New York,"i'm 19 years old and saw these at bloomingdales the other day and decided to buy them. i took them home, tried them on, and i was absolutely amazed. They are a bit of a low rise, but that only adds to the flattery. and i like my underwear that way. There are a bunch of different sizes you can button the sling to, and once you find the perfect fit, you can hardly even feel that it's there. I give it a perfect score, and i am definatley going to buy more of these"
B0002GYQY8:andrew_christian_rocks!:k_and_j's_mom,B0002GYQY8,KIDS Authentic Looking G.I. Style Camouflage Tank Top / Camo Tank Top: Apparel,apparel,,5.0,Andrew Christian rocks!,"July 24, 2006",k and j's mom,,Good quality for the great price.  Bought for my 10 year old son and should fit perfect.  Item was on backorder but still received in less than a week
B000JJJDFA:men's_black_dress_vest_necktie_set_for_suit_or_tuxedo_xxxl:barbara_fischer,B000JJJDFA,Men's BLACK Dress Vest and NeckTie Set for Suit or Tuxedo: Apparel,apparel,1 of 1,4.0,Men's BLACK Dress Vest NeckTie Set for Suit or Tuxedo XXXL,"March 12, 2007",Barbara Fischer,"Indianapolis, IN","This item was as I expected as far as the description, it is the quality I expected and I am pleased with it.  However, I bought it one size too large to be safe and it was so small it barely fit (It fit the way I feared the 2-X would fit that's why I bought the 3-X).  Don't know if it was mis-sized or what"
"B0007XPV8G:clark's_sunbeat_sandals_are_tops!:kathleen_m._bystrek_""bargain_hunter""",B0007XPV8G,Clarks Women's Sunbeat Adjustable Sandal: Apparel,apparel,1 of 1,5.0,Clark's Sunbeat Sandals are tops!,"August 29, 2005","Kathleen M. Bystrek ""bargain hunter""","Barrington, NH USA","I bought another of Clark's sandals a few years ago, which is why I ordered them again. These sandals were even more comfortable than the last pair! There was no break-in period with these shoes..I just put them on and spent the day in them without pressure points or blisters. I will buy more in other colors I'm sure. You can't go wrong with Clark's"
"B000IX6FOE:shoe_review:holly_p._mendes_""hocks""",B000IX6FOE,Steve Madden Violit Black pumps: Apparel,apparel,,4.0,shoe review,"January 9, 2007","Holly P. Mendes ""Hocks""",Barrington,"nice shoes, cut a bit high in the back so I got blisters at first- love the fabric and color-prompt shipping and nice bo"
B000GFIO6G:bears_game_day_sweatshirt:daibhidh_ceannaideach,B000GFIO6G,Chicago Bears Game Day Classic Crewneck Sweatshirt: Apparel,apparel,,4.0,Bears Game Day Sweatshirt,"February 10, 2007",Daibhidh Ceannaideach,,"This is a quality sweatshirt that I am enjoying wearing during the cold winter weather. I have had trouble, in the past , with other brands with the arms being too short or the body length being too short but that is not the case with this product . The only problem with the product is that it could stand to have more elastic at the bottom but this is a minor problem . The service was excellent and I will return for more BEARS gear"
B000HM9A2A:price_price_price:sarah_wilson,B000HM9A2A,Creative Lab Vision:M Zen Video 30GB Premium Silicone Skin Kit - Bundled with 12v Rapid Car Charger and Home Travel AC Adapter Wall Charger: Apparel,apparel,,5.0,price price price,"March 6, 2007",Sarah Wilson,"Lake Worth, FL USA","the price for the bundle is the best part of the whole thing. [...] doesnt carry these products. they sell an adapter and then a usb cord. which is what apple does for their ipods and is a rip off for money.
i like not having to worry with an annoying adapter when i want to charge my Zen. just plug in and walk away, not fiddle with the adapter to make sure it is inserted properly.
the case is abit annoying. it catches lint like you wouldnt believe. but i'm not getting scratches and I HAVE A KICK STAND! i use that kick stand the most - its actually the main reason i bought this set.
the bundle actually also arrived a few days before the Zen actually did, so it was sent FAST.
i love this.
get it"
B000E19P4M:10_stars:j._horn,B000E19P4M,Bay Studio Taylor II: Apparel,apparel,0 of 1,5.0,10 stars,"August 25, 2006",J. Horn,"Woodbury, NY USA",I love these shoes...in fact I ordered another pair in black.  They are very comfortable and look cute.  Hey...can't beat that
B0001HLTLG:top-grain_leather_portfolio_:callie,B0001HLTLG,Top-grain Leather Portfolio: Apparel,apparel,3 of 3,5.0,Top-grain Leather Portfolio ,"December 2, 2006",Callie,"Tampa, Florida","I was looking for an inexpensive but functional leather briefcase and this was exactly what I was looking for.  I have more than three electronic devices that I need easy access to - and the case has three outside pockets big enough to hold my devices.  The only thing missing is an outside place to put a pen or pencil.  I don't know how durable it will be, but I'm hoping, very!!

For the price, this is a good buy"
"B0002OQGAM:comfy_and_sleek_pajamas!:e._christie_""-ed.""",B0002OQGAM,Intimo Men's Classic Silk Pajamas: Apparel,apparel,4 of 4,5.0,Comfy and sleek pajamas!,"December 7, 2005","E. Christie ""-Ed.""","Marina, CA USA","What a great pair of pajamas these are.  So soft, non-binding, roomy, and great for lounging.  I've already decided to get another pair in a different color after the holidays.  Very good quality silk, well sewn and tailored.  I'm normally an XL tall but the regular XL fit fine"
B000ARL19C:great_purchase._best_value_and_very_comfortable:arun_hariharan,B000ARL19C,Skechers Men's Examiner Bicycle Toe Slip-on Oxford: Apparel,apparel,,5.0,Great Purchase. Best value and very comfortable,"January 22, 2007",Arun Hariharan,"Columbus, OH","I purchased a pair and have been using it everyday from the past six months. The shoes are very comfortable and look very professional. Love them. 

Strong and tough.
Not to heavy. Has good grip on snow."
B0007VS6N0:best_ever:recovering_couch_potato,B0007VS6N0,Maidenform Micro Boy Shorts: Apparel,apparel,5 of 5,5.0,best ever,"November 2, 2006",Recovering Couch Potato,"PUYALLUP, WA United States","These are without question, the best panties for wearing with slacks.  No line at the leg, no line accross the middle of your behind, and no riding up.  They are also cut low enough to not show in a moderately low rise pant.  Sizing runs true to any other Maidenform pantie you've ever bought. Can be had cheaper at a Maidenform outlet store, but still well worth the price on Amazon.  Buy lots of them"
"B000AI0UGQ:great_umbrella_for_wind_&_rain:just_a_cool_""x-box_mom""",B000AI0UGQ,ShedRain WindPro&reg; Stick Umbrella: Apparel,apparel,,5.0,Great Umbrella for Wind & Rain,"January 9, 2007","Just a cool ""X-BOX MOM""",CA,Got this for my father.  He loves it.  Great coverage.  Easy to use
B000AI0UGQ:wind_proof_umbrella.:ha,B000AI0UGQ,ShedRain WindPro&reg; Stick Umbrella: Apparel,apparel,7 of 7,5.0,Wind proof umbrella.,"March 19, 2006",HA,"Portland ,OR","      Was shipped very promptly.
     Not the largest man's umbrella but well designed.
Looks like someone really studied how umbrellas can wreck themselves by blowing inside out. So that this one won't"
B0001YR1VG:great_pants:g._bishop,B0001YR1VG,Dickies 85-283 Double Knee Work Pant: Apparel,apparel,,5.0,Great pants,"February 19, 2007",G. Bishop,Chicago,Great pants. I bought these in a variety of colors and I am very satisfied
"B000FEDCGU:american_apparel_infant_baby_rib_hat:elizabeth_mcwhorter_""emw""",B000FEDCGU,American Apparel Infant Baby Rib Hat: Apparel,apparel,1 of 1,4.0,American Apparel Infant baby rib hat,"January 20, 2007","Elizabeth McWhorter ""EMW""","Ashland, OR United States","My baby is large for her age and wears 6-9 month sized clothes even though she is only 3 months old.  I ordered two of these hats sized 6-12 months.  They are way too big for my baby but will probably fit her when she is actually 6 months. Hats are made of t-shirt fabric and look just like the picture. You do have to tie your own knot on the top. Andrew Christian sent each hat in a separate envelope and they arrived on different days, but within the shipping time specified"
"B0006M4L5M:leather_front_id_wallet_with_money_clip._:j._parnicky_""j_walker""",B0006M4L5M,DOPP ID Money Clip/Card Holder by Buxton: Apparel,apparel,2 of 2,5.0,Leather front ID wallet with money clip. ,"July 31, 2006","J. Parnicky ""J Walker""","Cordova, TN USA",The leather was good quality.  The wallet was well constructed.  I gave it as a gift and it turned out better than I it looked on the internet.  Grade A product
"B000JZOCZA:good_times!:andrew_rosett_""realize_your_dreams""",B000JZOCZA,American Apparel TR456 Tri-Blend Short Sleeve Deep V-Neck: Apparel,apparel,,5.0,Good times!,"February 9, 2007","Andrew Rosett ""Realize your dreams""","Las Vegas, NV","Whoever said the 80's are making a comeback wasn't lying!  I love American Apparel clothing especially this deep V-neck shirt.  Just know that it really is deep!  I'm only in my twenties but I almost feel like an older man when I wear this shirt; cut lower than other V-necks your chest hair is bound to hang out!  If your cool with that then go buy the shirt cause it can't get any more comfortable than it already is!  Honestly, I probably won't wear it anywhere other than the gym and home, but I still love it"
"B000NA0G2E:please_read_the_description_before_ordering!:julianna_j._white_""allotheist""",B000NA0G2E,Mesh embroidered dress: Apparel,apparel,3 of 3,5.0,Please read the description before ordering!,"March 31, 2007","Julianna J. White ""allotheist""",Seattle,"It clearly says it is a MESH dress! I wore this for my wedding, outside in bright sunlight, and it certainly did not show everything, but do not expect it to be completely opaque, as it is a MESH dress with delicate lining.

As for the quality, it wore well, and the frayed edges are intentional and part of the design. Very fairy-like and pretty, and I was pleased to wear it"
"B000C18JCI:american_apparel_fine_jersey_tee,_xl,_red:rachel_and_jeff",B000C18JCI,"American Apparel Fine Jersey Tee, (A-21020): Apparel",apparel,1 of 1,4.0,"American Apparel Fine Jersey Tee, XL, Red","January 3, 2007",Rachel and Jeff,"Baltimore, MD","These t-shirts fit on the small side, for women (not Juniors) but are soft, comfortable, and well made.  I have bought 4"
"B0000733CY:great_suitcase_for_the_cost:morgan_giddings_""tempest_and_fury""",B0000733CY,"Samsonite F'Lite 31"" Hardside Upright: Apparel",apparel,1 of 1,4.0,Great suitcase for the cost,"April 11, 2007","Morgan Giddings ""tempest and fury""","Chapel Hill, NC United States","This is a great hard-side suitcase for the price.  It is basic and simple, but seems quite durable and functional.  I use it for taking my folding bicycle with me when travelling, and it is big enough that the bike fits in, but small enough that the airlines don't charge a premium for checking it.  It rolls very well on the built-in wheels, and unlike it's smaller cousin the Oyster, this rolls with much more stability due to the wide stance. The only reasons I didn't give it 5 stars are: 1) Sometimes the wide rolling stance is a hassle, e.g. going through narrow gates on a subway or similar, and 2) the built-in locks are not ""TSA"" locks, so in other words, they are useless for air flight.

I would buy this suitcase again"
B0000733CY:awesome_colors:dorz_critique,B0000733CY,"Samsonite F'Lite 31"" Hardside Upright: Apparel",apparel,0 of 1,5.0,awesome colors,"July 15, 2006",dorz critique,"san pablo, ca","great value! have always wanted a samsonite brand, but in brighter colors. i finally purchased the single upright suitcase(s)and fell in-love.i bought the pink and red. my kids and i will be vacationing over seas,and i wanted a better quality, more spacious luggage.this is perfect!the delivery turn-around time was impeccable! we'll be leaving in a few days to visit southeast asia. and we got our suitcases this early moning. continue the excellent customer-service"
B000J3AF5S:bearpaw_boots:lisa_o'brien,B000J3AF5S,"Bearpaw Womens Suede & Shearling 8"" Boots - Style 405 Dream: Apparel",apparel,,4.0,Bearpaw boots,"April 10, 2007",Lisa O'brien,"Mission Viejo, Ca.","Boots are warm & Cozy. However, the color was much lighter than pictured...not the end of the world. Also, the shipping took longer than expected"
B000J3AF5S:great.:r._tamoro,B000J3AF5S,"Bearpaw Womens Suede & Shearling 8"" Boots - Style 405 Dream: Apparel",apparel,,5.0,Great.,"March 15, 2007",R. Tamoro,,I purchased these boots for my daughter.  I bought two pairs for her younger sister and she fell in love with the look.  She tried them on at a local sporting store and just loved how they hugged and felt on her feet.  I would buy all colors of the rainbow if she asked
B0008FV1NM:nursing_pajamas:k._korn,B0008FV1NM,wrap nursing top set: Apparel,apparel,,4.0,Nursing Pajamas,"March 8, 2007",K. Korn,,I used these Pajamas in the hospital after I delivered my baby and for the first 3 months of breast feeding.  You can wear them without a nursing bra since there is a way to to keep the nursing pads in. They are also very comfortable.  I wore them some days all day because they really don't look like pajamas.  I got them in blac
B000IQCELY:reliable_product:chef's_mom,B000IQCELY,Dickies 874 Original Work Pants in Many Colors: Apparel,apparel,2 of 2,5.0,Reliable product,"January 6, 2007",chef's mom,"Ithaca, NY USA",Reliable brand of work pants in a good selection of colors is all we're asking for
"B0009W6H9W:very_good_merchandise:russell_young_""mrs._russell_young""",B0009W6H9W,Vanity Fair Sleeveless V-neck Gown: Apparel,apparel,,5.0,very good merchandise,"March 29, 2007","Russell Young ""Mrs. Russell Young""","LUBBOCK, TEXAS United States",This is very comfy and pretty and a great price . Try it you will be sold. I am glad I did
B000J4JWWE:sansa_skin:s._r._sullivan,B000J4JWWE,SanDisk Sansa e250 e260 e270 e280 Premium Silicone Skin Kit - Belt Clip - Sports Armband - LCD Screen Shield - 8 Color Options: Apparel,apparel,,5.0,Sansa skin,"April 2, 2007",S. R. Sullivan,"Wichita, Kansas USA","This product is really GREAT for this Sansa e260 I purchased. Strongly recommend it this Mp3 player. It helps grip, bottons work better, and looks ""cool"""
B000H6F2C8:great_for_cold_winter_days:iiibobs,B000H6F2C8,Russell Athletic Men's Dri-Power Hooded Pullover Fleece Sweatshirt: Apparel,apparel,2 of 3,5.0,great for cold winter days,"December 14, 2006",IIIBobs,"Okinawa, Japan","I bought this sweatshirt last year and it is one of the most comfortable articles of clothing I own. I am a little ashamed to admit that I don't use it when exercising, its so comfortable I use it to lounge around the house."
B0006VN9EW:a_steal_of_a_dres:alica_f._hall,B0006VN9EW,50's Strapless Satin Formal Bridesmaid Prom Dress: Apparel,apparel,4 of 4,5.0,A Steal of a Dres,"March 6, 2007",Alica F. Hall,"Alva, OK USA","I purchased this dress to be the maid of honor in my best friends wedding.  It arrived quickly, looked great, and was an awesome price.  It would be hard to beat this great deal"
B000BOQWJ8:they've_changed...:b._kemp,B000BOQWJ8,Dr. Martens Unisex Original 10 Eye Steel Toe Boot: Apparel,apparel,2 of 2,4.0,They've changed...,"February 14, 2007",B. Kemp,"AR, United States","I bought these to replace an identical pair that I've been wearing for ten years. I got the old ones in London, and they were made in England. This new pair was made in China.  They have changed...some for the good and some for the bad.  There is now more toe room, which I like. However, both heel pads were ill fitted and loose. I had to trim them and stick them back in with super glue. I'm starting to really break them in now and I think I'll love them for years to come. They provide good ankle support and keep my feet warm. Buyer beware that these boots come very very stiff, and will take time to break in.  When I first get them, I just wear them around the house occasionally until I can actually wear them out for a bit. If you try to wear them too long when you first get them, they will most definitely wear blisters on your feet. Break them in slowly and you'll have a wonderfully comfortable pair of boots to last a long time."
"B000078R4J:garment_bag:j._kennedy_""best_value_shopper""",B000078R4J,"Wally Bags 42"" Suit Bag w/ Exterior Pocket: Apparel",apparel,0 of 1,4.0,Garment Bag,"January 19, 2007","J. Kennedy ""Best Value Shopper""","Camarillo, CA USA",Good quality. Beautiful color. However had a side zipper which my husband didn't like as much as a top zipper
"B0006H0PLG:just_fine:isabelle_herbert_""essex_girl""",B0006H0PLG,Cotton Spandex Boot Pant: Apparel,apparel,2 of 2,4.0,Just fine,"August 4, 2006","Isabelle Herbert ""Essex Girl""","Aptos, CA USA","These are basically plain black yoga pants but they fit fine, are good quality and have washed fine without shrinking.  It's hard to rhapsodise about them but they are more than adequate."
"B0006A7Y8A:nice_quality_-_runs_small.:d._furlong_""dustygirl""",B0006A7Y8A,Athletic Camisole Tank w/ built-in bra top: Apparel,apparel,4 of 4,5.0,Nice quality - runs small.,"November 2, 2006","D. Furlong ""Dustygirl""",Florida,"I own this halter top in black & white.  The colors are vibrant & the fabric quality is very good.  This style runs small, so order 1 size up for a comfy fit. This company's customer service rocks"
B000I5HPS2:comfortable:mrs._t,B000I5HPS2,Columbia Sportswear Women's Wapato GTX Boot: Apparel,apparel,4 of 4,4.0,Comfortable,"November 23, 2006",Mrs. T,"Seattle, WA","The shoe is very comfortable along the insole with lots of cushioning - you can walk for hours without your feet feeling the stress.  However, there seems to be some inflexibility across the top of the shoe that can make pushing off when climbing inclines a slightly uncomfortable process.  I haven't owned the shoes very long so this may be a result of having to break them in. I do appreciate the covered toe which I feel is a very big bonus for this shoe - it's not obtrusive and doesn't ruin the look of the shoe at all, but definitely helps during the aforementioned pushing off during inclines in that the front of the shoe stays relatively undamaged.  The ankle support is good and hits right at the ankle bone so flexibility isn't impeded.  I live in a wet climate and have never had any issues with leaking, so the waterproof claim is reliable. Overall, for the price I'm very happy with the shoe and consider it a solid purchase"
"B0007DAH7G:love_them:hillary_g._durant_""ilikecomfyshoes""",B0007DAH7G,Original Dr. Scholl's Women's Original Exercise Sandal: Apparel,apparel,,5.0,LOVE THEM,"April 10, 2007","Hillary G. Durant ""ilikecomfyshoes""","rochester, NY USA",my fav shoes- I can wear them to dress up or to dress down... the review about how to adjust the slasp was very helpful to
"B0007DAH7G:dr._scholl's_original_:crystol_l._hiserman_""hlotsyrc""",B0007DAH7G,Original Dr. Scholl's Women's Original Exercise Sandal: Apparel,apparel,,5.0,Dr. Scholl's ORIGINAL ,"April 2, 2007","Crystol L. Hiserman ""hlotsyrc""",Front Royal VA,I've been buying these sandals for 30 years.  I just love them
"B000F34FXA:comfort_with_height,_finally!:h._sorensen_""sorencj""",B000F34FXA,Tsubo Women's Hypo Wedge Mary Jane: Apparel,apparel,4 of 4,4.0,"Comfort with height, finally!","October 2, 2006","H. Sorensen ""sorencj""","Ft Stewart, GA USA","Awesome shoe!! Very comfortable on my feet. Even though it's high healed sneacker you really don't fee too much of height and none of it's negetive side affects. I can actually run in this. Only thing is that it looks little too casual and your feet can get really HOT wearing it. I would recommend wearing thin sox. I originaly brought Dark Brown in size 7 (normally wear 6 or 6 1/2 size shoe) but had to return it to get 6. way too big. It's  wider than I'm used to even though I have wide feet; offers plenty of toe room.  If they offer 6 1/2 size , it would have been perfect wearing my thick sox in winter. Unfortunetely there are no half sizes offered. I wanted to buy Black in 6 also, but 7 is too big and  smaller sizes tend to go fast and there are no more option for me now"
"B000AI4BRU:case_logic_compact_camera_case:h._morales_""hank""",B000AI4BRU,Case Logic Compact Camera Case: Apparel,apparel,1 of 1,4.0,Case Logic Compact Camera Case,"January 11, 2007","H. Morales ""Hank""","San Jose, CA",Great little case we have two. I like the inside pocket for extra memory/battery.  
