unique_id,asin,product_name,product_type,helpful,rating,title,date,reviewer,reviewer_location,review_text
B0001XVN8E:great_but_not_exactly_like_the_picture!:kat,B0001XVN8E,"Hungry Hip Scarves, Deluxe: Apparel",apparel,3 of 3,4.0,Great but not exactly like the picture!,"August 11, 2006",Kat,"Miami, FL United States","It's nice and has yet to fall apart in 10 belly dancing classes.  The only thing is that every other triangle does not have coins, so you are only getting half as many coins as pictured.  However, for the price I would rather that than have it full of coins and falling apart. "
"B000E1VHBQ:to_nice_to_live_for!!!!!!!:pc_klue_""742617000027""",B000E1VHBQ,Military Style Combat Boots: Apparel,apparel,,5.0,To Nice To Live For!!!!!!!,"February 27, 2007","PC Klue ""742617000027""",South-Africa,"Now this Military Style Combat Boot is one of a kind! It takes a while to break it in but after, you will enjoy it! It looks so cool just looking at it, never mind wearing it! its leather is tops! And it WILL last a life time! Not water proof, but great for jungle trekking! Shines easy"
"B000KK4GUU:nice_suprise.:s.wall_""spooky""",B000KK4GUU,Leg Avenue Two Piece Slinky Halter Ruched Mini Dress with Leg Slit: Apparel,apparel,1 of 1,5.0,Nice suprise.,"February 26, 2007","S.Wall ""Spooky""",,"I bought this for my wife as a ""throw in"" with more expensive items because it was so cheap.I actualy forgot I even ordered it until it came in. I was pleasantly surprised when she modeled it for me. Unlike a lot of stuff it looks exactly like the picture. She is a size small and it fit perfect. This not something most would wear out however as its insanly short which is great for me. The only thing that could improve this piece is a matching thong which is hard to find in lime green so maybe black would be a better choice if your trying to match things up"
"B000BTPTGU:what_a_great_swaddle_item:jw_""jw""",B000BTPTGU,Halo Newborn Cotton SleepSack &#45; Blue Print Swaddle: Apparel,apparel,5 of 5,5.0,what a great swaddle item,"April 19, 2006","jw ""jw""",Warwick RI,"This is an amazing product. I bought one of these along with another swaddle product that did not have the sleepsack feature. believe me, there is no comparison. not only is the Halo product made better, and is more durable and holds the baby better, but it is a 2 in 1 so that you can use it as a sleepsack by itself too. I trust this company because the product is recommended by the SIDS society. I don't have to worry that my baby is going to wriggle out of the swaddle, because he is so secure in it."
B0009LB43M:perfect:t._kerns,B0009LB43M,Women's Willits Soft Saddle: Apparel,apparel,3 of 3,5.0,Perfect,"January 3, 2007",T. Kerns,"Section, AL United States",These shoes are great!  My daughter tried to talk me into giving them to her.  Quick Delivery.  Good Quality
"B0009LB43M:great__quality_will_use_again:peter_graham_""justabouttim""",B0009LB43M,Women's Willits Soft Saddle: Apparel,apparel,3 of 3,5.0,great  quality will use again,"January 3, 2007","Peter Graham ""justabouttim""",PHX AZ,Great delivery & of a quality product and the speedy service is one reason i still use amazon today is b/c of sellers and products like this 2 thumbs up !
B000FSAGWY:awesome_boots!:a._garcia,B000FSAGWY,Kenneth Cole Reaction Men's Street Smart Boot: Apparel,apparel,1 of 1,5.0,Awesome Boots!,"December 9, 2006",A. Garcia,"Lafayette, IN","Just got them in the mail today. As other kenneth cole reaction shoes, it runs one size larger. I'm usually a 12 but I ordered an 11 and they fit just right. These boots look great with jeans. The color is a bit darker than the one shown in the photograph."
B000AKZC4O:can_you_guess_what_my_hubby_couldn't_take_his_eyes_away_from?:danielle_lane,B000AKZC4O,Sneak Peek 2-pc. Set: Apparel,apparel,11 of 11,5.0,Can You Guess What My Hubby Couldn't Take His Eyes Away From?,"January 15, 2007",Danielle Lane,"Horseshoe, North Carolina","I had the opportunity of wearing these for my husband before I left for the west coast and my annual visit with my friends and our second annual lingerie party. My hubby couldn't believe I'd wear something like this, but boy oh boy, he didn't object. He couldn't take his eyes off my, well you can just imagine what it was he couldn't take his eyes off of"
"B000IEKFVC:great_item:gb_""gb""",B000IEKFVC,New Airform EVA Carrying Case for Nintendo Ds Lite NDS Lite: Apparel,apparel,,5.0,Great Item,"March 12, 2007","GB ""GB""",IN,"I purchased one of these cases for my sister-in-law, and she liked it so much, that I bought one for me too.  I really like it and would recommend it to anyone wanting a great carrying case for their DS Lite.

The vendor that shipped both of the cases did a great job of a quick shipment of a case that met all expectations.  I would purchase from them again without hesitation"
B000G1VACK:great_commuter_bag:m._g._hufford,B000G1VACK,Samsonite Sling: Apparel,apparel,,5.0,great commuter bag,"April 11, 2007",M. G. Hufford,"Kansas City, MO United States","This bag is perfect as a commuter bag on my bike.  The cell phone pocket is very accessible and the bag is large enough to hold a change of clothes, but not so large everything gets lost inside"
B000JDGCW8:love_them!:sarah_tsang_chase,B000JDGCW8,Robeez Infant/Toddlers' Penguin Slip On: Apparel,apparel,,5.0,love them!,"April 4, 2007",Sarah Tsang Chase,NJ United States,"these are so great, and keep my baby's feet warm.  She even slept with them on with no problem.  She's been a master at getting her socks off up until now.  They also protect her feet as she is starting to stand and was breaking toenails.  She's chewing on the toes but I haven't seen any scuff marks yet, so they are holding up very well"
"B000JDGCW8:the_best_shoes:a._anderfuren_""journalist_turned_stay_at_home_mom""",B000JDGCW8,Robeez Infant/Toddlers' Penguin Slip On: Apparel,apparel,3 of 3,5.0,the best shoes,"January 9, 2007","A. Anderfuren ""journalist turned stay at home mom""",The Mountains,"robeez are the only brand of shoes we even bother to use. they are well made and do not come off by accident or when baby tries to get them off! we've tried all of the other generic brands and they all come off, but not these. its worth it to spend the extra $$ on these shoes. and they're so well made they'll last for baby #2"
B000AYJFQQ:love_it!:ng_soong_mei,B000AYJFQQ,Chinese Laundry Women's Foxy Wedge: Apparel,apparel,,4.0,Love it!,"November 3, 2006",Ng Soong Mei,,I love the look. Even my friends complement it. And the wedges are so LIGHT! But you got to stick to your size. I couldn't find size 8.5 so I bought size 9 instead which was a big mistake.
B000M9T6A4:very_cute:l._howard,B000M9T6A4,Disney Eeyore Womens 2-Pc. Skirted Tankini Swimsuit: Apparel,apparel,1 of 1,4.0,Very Cute,"February 24, 2007",L. Howard,,Swimsuit very cute - size as stated (16 = 20/22)  Bra did not have enough support for me so I wear a matching sports bra with it and it works very well.  I love it
B000A1DIHG:love_em:amy_schlimgen,B000A1DIHG,Blue Patterned Silk Mary Jane Chinese Shoes: Apparel,apparel,,4.0,love em,"March 9, 2007",Amy Schlimgen,Texas,"i love these shoes, they are totally cute. the only draw back is they are kinda like satin over paper. they aren't as soft as i thought they would be, but i great buy none the less. "
"B000GZ2VUG:the_cutest_thing:p._henderson_""movie_buff''""",B000GZ2VUG,"12 Washcloths in Bag, Bonus Toy!: Apparel",apparel,,5.0,The cutest thing,"March 16, 2007","P. Henderson ""movie buff''""","(Balto,Md.",I just love different and odd things. I love to give people gifts that no one else have.Thanks
"B0000C2M1Y:like_the_waste_band:justmyluckfor2_""buster""",B0000C2M1Y,Lightweight Short Solid Pajamas: Apparel,apparel,,5.0,LIKE THE WASTE BAND,"December 11, 2006","justmyluckfor2 ""buster""",Idaho,I GOT THESE CAUSE I AM PREGNANT AND TRYING TO FIND CLOTHS THAT FIT IS KINDA HARD BUT WITH THESE I DON'T HAVE A PROBLEM BECAUSE IT HAS ADJUSTABLE SNAPS FOR THE WAST
B000E18CEQ:perfect_snow_boot:ariana_ward,B000E18CEQ,Ziggy After Ski Boot for Ladies: Apparel,apparel,,5.0,Perfect snow boot,"March 22, 2007",Ariana Ward,"Arlington, TX USA","This item was durable, warm, the right size as advertised and the right price."
"B000074RL3:best_i've_ever_owned:jennifer_m._""amazon_junkie""",B000074RL3,Enell Women's Sports Bra: Apparel,apparel,2 of 2,5.0,Best I've Ever Owned,"January 24, 2007","Jennifer M. ""Amazon Junkie""",CA USA,"I didn't want to pay over $50 for a sports bra, but I really wanted a good product and the reviews promised that. So I shelled out the dough for one and they were right! It fits snug so there's no unwanted bouncing and it also prevents uni-boob. I ordered a different sports bra from Champion and this is by far my favorite of the two. The Champion one pushed my boobs in so much it made that ugly boob bump above the bra line that's visible in light t-shirts - ew - and they're supposed to be the same bra size so go figure.  More positives: this one also fastens securely (just start from the bottom and work your way up, it will fit!) and is super, super comfortable. I do wish the price were less so I could buy a second, but I'll have to put that in my budget.  Nevertheless, as a wannabe runner with a large chest, it was worth the investment in comfort and security"
B00013PI4Y:good_overall:k._lovan,B00013PI4Y,TYR Discontinued Jammer: Apparel,apparel,1 of 1,4.0,Good Overall,"April 10, 2007",K. Lovan,,"Pros:
Ultra Fast delivery w/package tracking. Item was shipped within a few hours of order. Suit is in great condition and I like the color.
Cons:
When they say grab bag...that means the suit may or may not look like the picture. Mine turned out to be a blue stripped jammer...which is cool with me cause I actually wanted a blue jammer. Just be prepared"
B000AZCI1Y:quick_service:bklyn_diva,B000AZCI1Y,RYK&#196; Women's N-Gage Studio Mid: Apparel,apparel,,4.0,Quick Service,"February 6, 2007",Bklyn Diva,"Laurel, MD",Quick service for a shoe that has been discontinued and hard to find in a size 8/black.  No complaints.. great service.  great price
"B000AZCI1Y:delivery_time_and_price_fantastic:anastasia_""gadgetqueen""",B000AZCI1Y,RYK&#196; Women's N-Gage Studio Mid: Apparel,apparel,1 of 1,5.0,Delivery time and price fantastic,"January 9, 2007","Anastasia ""Gadgetqueen""",Virginia,"This is the only shoe I wear for High Impact Jazzercise classes four+ times per week.  I have a wide, flat foot and this shoes fit me perfectly.  And with boot cut jazz pants, they look great! "
B000JZ8YSG:heelys_rule!:,B000JZ8YSG,Heelys Boys' Slide Skate Shoes: Apparel,apparel,,5.0,Heelys rule!,"March 22, 2007",,,"A very cool product, it got me a lot of attention on 3/22/07 at the OU student Union. At first, it was hard to work. but now, I can even spin!!!
I always wear them to my mom's office"
"B000HPG1Z6:my_favorite_bluejeans:c._smith_""dealfinder""",B000HPG1Z6,"DKNY Jeans Stretch Soho Jean, Masquerade Blasted Wash: Apparel",apparel,1 of 1,5.0,My favorite bluejeans,"January 3, 2007","C. Smith ""Dealfinder""",Baltimore MD,"These are hands down my favorite pair of jeans. I'm 5'5"" and they are just the right length to wear with tennis shoes and midheight heels.  The stretch fabric hugs in all the right places, and the cut is slimming. "
B000E1FHA8:good_one:amardeep_dabass,B000E1FHA8,adidas Men's Barricade IV: Apparel,apparel,,4.0,good one,"November 10, 2006",Amardeep Dabass,,"well i bought these shoes after reading the good reviews it had got. And i was not to be disappointed. They are really awesome!! They are real comfy and fit perfectly for every sport i play. I even wear them to office sometimes ;) Though after wearing them for a long stretch of time, i did feel something in my right ankle but it was temporary and maybe that is why i dont want to rate it full 5 star. But they are worth every single penny i spent on them.

If you want to get good shoes which not only feel great but look good too, look no furthe"
B000EVKO8I:extremely_soft_and_comfortable!:lena_h._chou,B000EVKO8I,"Plush Microfiber Bathrobe - 100% Plush Microfiber - Soft, Warm, and Lightweight: Apparel",apparel,8 of 9,5.0,Extremely soft and comfortable!,"April 26, 2006",Lena H. Chou,"Fullerton, CA, U.S.A.","I LOVE my soft and comfortable green robe that I received last year for Mother's Day! Whenever I wear it, I want to just relax with a magazine or watch TV, and then fall asleep in it. The matching green slippers complete the feel, and I really feel pampered. I never knew I could feel SO good wearing a robe, especially since I was not really a robe wearer before receiving this wonderful plush robe! This is such an excellent product and great gift!"
B000KKWSJ6:best_running_shoes_ever!:tessa_d,B000KKWSJ6,Saucony Women's ProGrid Triumph 4: Apparel,apparel,,5.0,Best Running Shoes EVER!,"April 10, 2007",Tessa D,TX,"I absolutely love these shoes.  I have a very high arch and I am a hard heel-striker.  Needless to say that finding a comfortable shoe for my difficult feet has been a real chore.  These shoes have plenty of cushion in the heel and yet also support my arches.  However, I did put an extra arch support insert in (did I mention I have really high arches?) but didn't get the usual ""crowding"" effect which was wonderful. I've bought lots of shoes that were supposed to be right for my type of foot but after running in them had to eventually give them away.  These shoes were honestly perfect right out of the box, I've been walking/jogging/running in these babies for over a month now with no problems whatsoever. I plan on buying several pairs of these before somebody decides to ""improve"" them and changes something.  Boy do I hate it when I finally find a shoe I like and then the company decides to 'improve it' and screw up a really great shoe (bitter much? gee not me)  
I also received the shoes in less than a week and that is a miracle where I live.  Good service all around.  Hope this helps someone else."
"B00008MN6M:it_may_sound_boring_to_hear_it_again...:b._sanchez_""bsama""",B00008MN6M,Champion Action-Shape Full Figure Sports Bra: Apparel,apparel,2 of 2,5.0,It may sound Boring to hear it again...,"October 16, 2005","B. Sanchez ""bsama""",California,This is the absolute best sport bra made. I have been running 5 miles or more 5 times a week for over 20 years and once I discovered this particular model I have never switched back. The Champion also lasts wash after wash without losing it's shape. Unfortunately these great bras never seem to go on sale
"B000IGXLZW:to_alter_the_words_of_ben_franklin...:sabrina_grubidge_""sabrina""",B000IGXLZW,Steve Madden Women's Loucee Mary Jane Pump: Apparel,apparel,,5.0,To alter the words of Ben Franklin...,"February 22, 2007","Sabrina Grubidge ""Sabrina""","Osseo, MN",These shoes are proof that God loves us and wants us to be happy
B000IGXLZW:great_shoe_with_an_updated_look:samantha,B000IGXLZW,Steve Madden Women's Loucee Mary Jane Pump: Apparel,apparel,1 of 1,4.0,Great shoe with an updated look,"January 25, 2007",Samantha,"Montgomery, NY","I had been on the look out for a Mary Jane pump that I could wear to work with pants and skirts. I finally found this shoe online and decided to give it a try. Usually Steve Madden's run big on me, so I got a size smaller, and surprisingly, it was actually too small. A half size up did the trick, however.

I love that it comes in patent leather because it really adds a kick to your feet. They're also very comfortable for a high-heeled shoe.

My only complaint is that the show is actually very deep on the top, and there's quite a bit of toe cleavage. I guess this isn't necessarily a bad thing, it just didn't look like that at all in the picture. Also, the strap that goes across the top of the foot is very low, and if you have wide feet, it could make your feet look even wider (or fatter). 

Despite those two small flaws, I really like this shoe and find that I can wear it with almost anything (they look especially cute with skirts)"
"B000GRNV8A:adorable:k._larmer_""mom_of_5""",B000GRNV8A,Baby Gund My First Purse PNK/MULTI: Apparel,apparel,,5.0,Adorable,"January 16, 2007","K. Larmer ""mom of 5""","Valley Forge, PA",We bought this for our 13 month old for Christmas and she loves it. It is extremely soft. Her favorite part is the cell phone that rings. The compact also squeaks. I love that it is all soft so that she cannot hurt herself with it. This is a perfect gift for a 1-year-old girl
B000JGJ3YE:very_good_product:karen_m,B000JGJ3YE,Reebok Men's Chicago White Sox MLB Slippers: Apparel,apparel,,5.0,Very Good Product,"February 7, 2007",Karen M,"Chicago, il","These are very good quality slippers, comfortable & well worth the price."
"B000CMFJ7U:better_fit,_better_shoe:not_a_liberal",B000CMFJ7U,Mens New Balance 992 Running Shoe: Apparel,apparel,1 of 1,5.0,"Better Fit, Better Shoe","March 11, 2007",Not_a_Liberal,Indiana,"These shoes are durable, comfortable, and most importantly come in different widths.  Most other athletic shoe manufacturers apprarently don't make anything but D width.  New Balance does.

For those of you complaining about width, my guess is that if you size your feet correctly, that problem will go away.  I had always worn a 12D width, until some gentleman at a mom and pop store sized my feet correctly for the first time in my life I found out I need a 13B. You may think you know your feet, but you may not.

As to comfort, I can't complain.  As to durability, maybe they are a little stiffer, but if that is what extends the life of these shoes over the others, that is well worth it in my book"
B000K53QOC:the_coolest_henley_shirt_:judy_r._mesccon,B000K53QOC,Signature Henley Shirt with Buck Logo: Apparel,apparel,,5.0,The Coolest Henley Shirt ,"April 6, 2007",Judy R. Mesccon,"Palm Beach, Florida","This is a fabulous find! My husband loves henley shirts...but, they have to be just the right fabric weight and sleeve length. After many failed attempts, I finally found the perfect shirt. Great look, great feel and most importantly my husband likes it too"
B000J196CI:nice_and_comfortable:simon_botton,B000J196CI,"Slipper Socks (ONE SIZE FITS ALL, BLACK) 3 Pairs: Apparel",apparel,2 of 2,5.0,Nice and Comfortable,"January 18, 2007",Simon Botton,,Nice to put on after a long day of work or after being outside shoveling the snow .Do reccomend
B000M0MRKE:good_quality_and_value:michaelm,B000M0MRKE,Hanes Classic Men's Flannel Pajamas: Apparel,apparel,1 of 1,4.0,good quality and value,"February 16, 2007",michaelm,silicon valley,"Comfortable. If elastic waist degrades over time (not known yet, but has happened to other pajamas), there is no back-up draw-string. As with all flannel PJs, easily tangles with flannel sheets"
"B0008172I4:zipper_wallet_,_a_great_product__,_in_great_demand_:j._alvarez",B0008172I4,Zippered Wallet: Apparel,apparel,1 of 1,5.0,"Zipper wallet , a great product  , in great demand ","March 9, 2007",J. Alvarez,,"The zipper wallet is a product with a practical idea that is long overdue . It is a known fact tha all leather wallets stretch resulting in important items such as credit cards and drivers lisence, etc. slipping out, making identity  theft a serious possibilty.

 The zipper wallet avoids this from happening. Ironicly, this item is not available at local stores.I encourage everyone to try this product and see for yourself how useful it is in the everyday world  

                                  Yours Truly ; Joe Alvare"
"B000FK9Q8W:very_cute_for_the_price._._._:allison_m._koontz_""oceanalli""",B000FK9Q8W,Oversized In-fashion Austrian Crystal Rhinestone Sunglasses - New !!: Apparel,apparel,,5.0,very cute for the price. . . ,"April 24, 2007","Allison M. Koontz ""oceanalli""","Schenectady, NY","I bought a pair of these in tortoise and really love them!  They fit great, they arrived in great condition and very quickly.  The rhinestones are really blingy in the sun!  I am buying a pair in black for my best friend who is in love with them also.  Very cute for the price"
"B0002OQLDE:nice_and_sexy:luis_p._fernandez_""bookiewookie""",B0002OQLDE,Intimo Men's Classic Silk Knit Tank Top: Apparel,apparel,,5.0,Nice and sexy,"May 11, 2006","Luis P. Fernandez ""Bookiewookie""","Cambridge, MA","If you have the body to show for it, by all means wear it alone"
"B000HXYDQW:great_shoes_for_toddler!:denise_fanning_""purplefinch""",B000HXYDQW,Komfort Kidz 'Happy Feet' Shoes: Apparel,apparel,,5.0,Great shoes for toddler!,"March 27, 2007","Denise Fanning ""purplefinch""",michigan,"I bought these shoes for my 23 month old son. We needed something comfortable with a flexible sole, but with enough thickness in the sole to stand up outside and provide traction. They are excellent shoes and he loves them. He won't wear anything else and the shoes receive many compliments"
B000HXYDQW:smiles_all_around!:c._hodge,B000HXYDQW,Komfort Kidz 'Happy Feet' Shoes: Apparel,apparel,,5.0,Smiles All Around!,"March 22, 2007",C. Hodge,,We just had our son in January and we couldn't resist these cute little shoes. Even though he's only 3 months old we can't wait to see our little guy in them. What a well made product!
"B000GF7CAK:beautiful_stunning_shoes:jonas_ekebom_""ioz""",B000GF7CAK,Kenneth Cole New York Men's As U R Wingtip Loafer: Apparel,apparel,,5.0,Beautiful stunning Shoes,"March 18, 2007","Jonas Ekebom ""IoZ""","New York, NY United States","These shoes are stunning, original and over-the-top beautiful. I just can't understand the review regarding the point of the shoe being too pointy?? Square-toe shoes are soooo late 90-s and these shoes are anything, but ""mosquito hunters"". They have a perfect narrow shape, with an interesting mix of fabrics and a PERFECT toe for the current late decade of 2000. Trust me, with 117 pairs in my exploding New York closet these have ended up at the front. I'm picking up the black ones as I'm writing this. Enjoy them....I know you as well as your better half will!"
B000CPNBO0:fairly_vibrant...:borisse,B000CPNBO0,Port & Company - Knit Cap (CP90): Apparel,apparel,,4.0,Fairly Vibrant...,"February 18, 2007",Borisse,Not from here!,"Good color visibility; nicely structured with warmth applicable to the unspeakable and inhuman frigidites of the amerikan North.
The hat fits snugly and will evoke a positive commentary now and again. 
I have ordered Maroon but will likely add some other color choice, as the array is rather impressive. For an 100 % acrylic knit, this is not a bad hat; the only problem perhaps being that it sucks up hairs very easily, almost as if it were a hair-vacuum machine."
"B0002Y2F3Y:the_best:dr._h.w._""princesswallace""",B0002Y2F3Y,Fairytale Princess Silver/Clear Heel Sandals w/ Rhinestones: Apparel,apparel,1 of 1,5.0,The best,"July 25, 2005","Dr. H.W. ""princesswallace""",PA,"They shipped these almost overnight. My daughter was a perfect little flower girl; No trips, no blisters, and they've held up great over the past 9-10 months with great durability for dance and lots of play. She was a size 10 at the time of the wedding, but the shoes were a 9? Her feet were fine. She can still squeeze into them now, and she's an 11. Very pleased. Good value. These are the exact shoes"
B000FOU2WW:jansport_ftw!:evertired,B000FOU2WW,JanSport Hellcat Backpack: Apparel,apparel,,5.0,Jansport FTW!,"March 7, 2007",evertired,LA,"Now, I'm a pretty picky guy when it comes to certain things in life and one of those items just happens to be Backpacks. I spent about two months searching for a new one until I finally came across this particular model. I'll start with by saying that I love this damn thing. It has plenty of space, a whole bunch of extra cords that I suppose a hiker would use but I think just look nice, and its very durable (which is a must for me since everything I own will take a beating). I'm telling you straight from the horse's mouth, this Backpack is worth the money. Now if it only came as an 18 slot.."
"B000LU6L66:love_it!:a._motley_""amot""",B000LU6L66,Burberry Cashmere Classic Plaid Scarf: Apparel,apparel,,5.0,love it!,"April 5, 2007","A. Motley ""amot""","Columbus, OH",It is exactly what I was looking for. I had no problems ordering or receiving it. I got to my house quickly. Nothing is wrong with it
"B000FLAAUO:soft,_but_small:shopgirlva",B000FLAAUO,Happy Bunny Boys are Funny Lounge Pants for women: Apparel,apparel,,4.0,"Soft, but small","January 21, 2007",ShopGirlVA,"Springfield, VA","The PJ bottoms were soft and of good quality material. However, I ordered the extra large, and they were very small for that size.  It seemed as though the XL was more a Med/Large.  I would also think that ""lounge pants"" or ""PJ bottoms"" would be a bit bigger as you wouldn't want these types of pants too tight.  They were a gift, so I just hope they don't shrink after washing! "
