unique_id,asin,product_name,product_type,helpful,rating,title,date,reviewer,reviewer_location,review_text
B000LHMNVQ:women's_under_armour_tech_tee_:tiffany,B000LHMNVQ,Under Armour Heat Gear Tech Tee Womens: Apparel,apparel,,4.0,Women's Under Armour Tech Tee ,"March 18, 2007",Tiffany,"Santa Cruz, CA United States","This tee-shirt is my first Under Armour purchase, and I took a chance by ordering it without ever trying on any Under Armour before.  I'm not dissatisfied, but it isn't my favorite tee-shirt.  On the positive side:  the weight of the fabric is good for exercising, especially for the gym, and it would be a good single layer for outside/warm temperatures.   The fit is pretty good (I am average sized and wear sizes 8-10); I don't like really tight clothing and this shirt is loose enough to be comfortable but fitted enough so that it doesn't look like I'm wearing a bag.  On the negative side: I am a little short-waisted, and the shirt is long for me and bunches at the top of my hips, which I don't like but accept.  Also, the vee-neck is not a very strong vee (pictures of this shirt are true in that respect).  A lot of technical tees are like this -- designed more for function than for style maybe -- and vee-necks are essentially a crew x vee hybrid.  I prefer a true vee-neck.  Lastly, the fabric has a slightly rough, scratchy feel, which seems characteristic of today's technical fabrics.  It's not clear to me that the cost in ""hand"" is worth the added function of ""wicking"" in this instance.  Overall, I consider this shirt fine for the gym or for an hour-long run, but I wouldn't want to spend a lot of extended time in it."
"B000LHMNVQ:excellent_condition_and_prompt_delivery:musicrules_""music_fanatic""",B000LHMNVQ,Under Armour Heat Gear Tech Tee Womens: Apparel,apparel,,4.0,Excellent condition and prompt delivery,"March 9, 2007","MusicRules ""music fanatic""",USA,"This is ideal for wearing layers of clothing or if you're dressed in a short sleeve over this one.  However, I personally prefer the long sleeved version by the same company. "
B0002NJ862:hush_puppies_shoes:carol_a._robinson,B0002NJ862,Hush Puppies Women's Angel Lo Pump: Apparel,apparel,,4.0,Hush Puppies Shoes,"January 15, 2007",Carol A. Robinson,,Love Hush Puppies.  They are comfortable and I can get a heel low enough for me to be comfortable
B000H8BGO4:why:john_orliski,B000H8BGO4,Tamarac by Slippers International Men's Canoe Moccasin: Apparel,apparel,,4.0,Why,"February 17, 2007",John Orliski,,"The slippers are what I expected. With only a month, I can only say they do the job "
B000HDEJFM:red_sox_nation!:m._c._morton,B000HDEJFM,Boston Red Sox For The Team Long Sleeve T-Shirt: Apparel,apparel,,5.0,Red Sox Nation!,"January 18, 2007",M. C. Morton,North Carolina,"Great overall shirt.  Good quality, wears well.  Wear it proudly"
"B000ME8D44:very_cute:r._hepler_""web_shopper""",B000ME8D44,Elbow Sleeve Knit Shrug Sweater: Apparel,apparel,1 of 1,5.0,Very cute,"March 9, 2007","R. Hepler ""web shopper""",,This sweater fits perfect - exactly what I was looking for and I coudn't go wrong with this fabulous price.  My husband liked it as well
"B000COU9AK:a_great_gift_for_the_busy_professional_woman:w._stultz_""attorney/passion_consultant""",B000COU9AK,Business/Computer Cases Samsonite Ladies Leather Topzip Computer Tote: Apparel,apparel,,4.0,A Great Gift for the Busy Professional Woman,"January 9, 2007","W. Stultz ""attorney/Passion Consultant""",Northern CA United States,"I bought this bag as a gift for a lawyer friend. She loves it, and has told everyone about it. The color allows her to express her personailty while remaining professional, and the size and durability of the bag allow her to eliminate a separate purse, lunchbag, and carryall"
B000A8B8UI:great_casual_pants_for_mud_or_movies.:techdaddy,B000A8B8UI,"Wrangler Rugged Wear Men's Angler Jean, Relaxed Fit, Khaki: Apparel",apparel,,5.0,Great casual pants for mud or movies.,"January 3, 2007",Techdaddy,California USA,"Comfy, tough, lightweight, wrinkly (like me). Surprisingly durable considering how thin the fabric is. Good stitching. Velcro® back pockets will save your wallet! Doesn't offer lots of stupid exterior loops and gear-freak cargo pockets. Not for the tidy country-club set who need creases on everything, but just perfect for active soccer Dads or when the family hound insists on playing Fetch with muddy logs and the like"
"B000EXW10K:exceptionally_comfortable.:i._david_""noodle""",B000EXW10K,Rockport Men's Fast Approach Driving Shoe: Apparel,apparel,1 of 1,5.0,Exceptionally comfortable.,"February 24, 2007","I. David ""noodle""",SoCal,"Like wearing a moccasin only with more support. More supple than most Driving Shoes, and light weight too. Soles wear very well, as do uppers. A Great looking shoe that has become my favorite knocking around shoe, yet plenty dressy for evenings eating out in Southern Cal"
"B0007IQF8G:you_can_have_it_all..:dough_ray__me_""savvy_shopper""",B0007IQF8G,Ladies Leather Credit Card Holder Womens Wallets: Apparel,apparel,6 of 7,5.0,You can have it all..,"February 27, 2006","dough ray  me ""savvy shopper""",Canada,"So glad I didn't have to choose between the convenience of carrying all my cards and the bulkyness of a holder big enough to accommodate them. This wallet is slimline and holds all my cards.
It's been 6 months since I wrote this review, and I only become more satisfied with this wallet. All my cards are easily accessed, viewed and I know immediately if one is missing. The leather is silky soft and durable. People have been asking where I found this item. I think it's the best I've ever purchased"
"B000FS0STA:great_case!:m._l._caron_""gamer_mom""",B000FS0STA,Kroo Forza Creative Labs Zen Vision M Accessory Case: Apparel,apparel,2 of 2,5.0,Great case!,"September 5, 2006","M. L. Caron ""Gamer Mom""","Bucks Co, PA USA","We ordered this case for our son's Creative player, and it's a hit. It fits snuggly, he can access all the functions with no problems, and the loup allows him to attach it to a variety of cords and ""leashes"" during different activities. 

A great value for the money!"
"B000H98VH8:best_shoe_ever:maine_coon_mama_""mcm""",B000H98VH8,"Women's ""Cayman"" Crocs: Apparel",apparel,1 of 1,5.0,Best Shoe Ever,"March 12, 2007","Maine Coon Mama ""MCM""",Texas,"I just don't know where to start.  There just doesn't seem to be a way to describe the comfort.  You will just have to try them on to believe it.  My neighbor, mother, husband and I all swear by this product.  Accept no substitutions.   Attractive...no, but the comfort will blow you away"
B000H98VH8:best_ever_-_don't_buy_imitations:c._lawler,B000H98VH8,"Women's ""Cayman"" Crocs: Apparel",apparel,,5.0,Best Ever - Don't Buy Imitations,"February 18, 2007",C. Lawler,"Whidbey Island, WA","These are the best ever!  I bought these for my daughter and at first was nervous about ordering something like this online and because I had seen similar 'crocs' at local stores for far less.  Well, these are worth every cent!  My daughter and I went to a local store and she compared the way these felt to the local brand...no comparison!  These are the best"
B000H98VH8:health_benefits:cheri_read,B000H98VH8,"Women's ""Cayman"" Crocs: Apparel",apparel,4 of 4,4.0,Health Benefits,"January 7, 2007",Cheri Read,Eastern PA,"I wore these shoes when I worked on my feet all day and they really helped with pain in my feet, ankles, knees and hips. I could really feel the difference from my other work shoes and the ""teeth"" in the shoes on the soles of my feet really felt good. Being diabetic, I am very concerned about circulation and I believe this was a good purchase. A little expensive, but well worth it in the end. I plan on buying more"
B000HQMXCU:great_boots:j._paupaw,B000HQMXCU,Jacques Levine Women's Tammy Suede/Shearling Boot Slipper: Apparel,apparel,,4.0,Great Boots,"March 23, 2007",J. Paupaw,,Soo comfortable and soo warm.  The only thing that sucks about them is that they aren't waterproof
B000HQMXCU:perfect:t._atkinson,B000HQMXCU,Jacques Levine Women's Tammy Suede/Shearling Boot Slipper: Apparel,apparel,,5.0,Perfect,"March 8, 2007",T. Atkinson,"Anytown, USA","I bought these boots just in time before the crazy weather started.  Let me tell you,these boots are great!!!!!!  I read all the reviews and bought them a half size bigger and now they're a little big, regardless, I love them and another thing, they keep my feet very warm and cozy"
B000HQMXCU:size_is_what_it_should_be.:laura_s._bourbin,B000HQMXCU,Jacques Levine Women's Tammy Suede/Shearling Boot Slipper: Apparel,apparel,,4.0,Size is what it should be.,"February 26, 2007",Laura S. Bourbin,,I read the reviews and alot of people said they run 1 to 2 sizes to big. So I always wear a eight and I ordered a 9. They were huge on me. I sold them to a friend. also the ankle part was really wide for my foot when it was in the boot. I'll stick to my Ugg's
B000HQMXCU:fits_perfect_warm_and_comfy:tina_davis,B000HQMXCU,Jacques Levine Women's Tammy Suede/Shearling Boot Slipper: Apparel,apparel,,5.0,Fits perfect warm and comfy,"February 22, 2007",Tina Davis,"Alexandria, VA","Please note, I did not find the need to order up many sizes.  I only ordered a half size up from my normal shoe size and they fit perfectly.  Nice quality boot slippers with excellent traction, nice arch support and a just little lift in the heel which relieves pressure from the low back.  I loves these boots and at a great price too.  Fast efficent shipping as well.  I should say that I bought a pair of White Mountain Suede Shearling boots and I was disappointed with the sizing as well as the quality"
B00008ID1O:excellent_quality_and_value_!:jasonm0817,B00008ID1O,Jockey Elance Bikini 3-Pack Panty: Apparel,apparel,1 of 1,5.0,Excellent quality and value !,"November 5, 2006",jasonm0817,,Purchased this for my girlfriend.  Told me that fits well and was very happy with this.  I am glad to get such a good price on them too
B000147M4C:best_sport_bra_for_larger_bust:l._boone,B000147M4C,Champion Underwire Comfort Strap Bra 161: Apparel,apparel,,5.0,Best Sport bra for larger bust,"February 18, 2007",L. Boone,,I have tried many different sports bras and this one is truly wonderful
B000FIB8AI:i_order_two_of_these_shirts......:kat,B000FIB8AI,Jonden Women's 3/4 Sleeve V-Neck Tee: Apparel,apparel,4 of 4,4.0,I order two of these shirts......,"September 5, 2006",Kat,S.C.,and I am very pleased with them.  They are very comfortable!!  My sugguestion is to order a size larger if you have a little extra weight because the material can be a little clingy
B0002M0APG:my_husband's_favorite_dress_shirt:caren_goldfeld,B0002M0APG,Van Heusen Poplin Dress Shirt: Apparel,apparel,3 of 3,5.0,My Husband's favorite dress shirt,"August 18, 2006",Caren Goldfeld,"Coral Springs, Florida USA",This is my husband's favorite shirt because it's light and comfortable. It is my favorite shirt for him because it needs no ironing and always looks crisp and neat
B0006HTWQK:none_better:richard_l._steinick,B0006HTWQK,"2(x)ist Men's Cotton Brief, 3-Pack: Apparel",apparel,2 of 2,5.0,None better,"October 22, 2005",Richard L. Steinick,,"These are the most comfortable briefs I have ever worn.  They are worth every penny, in my opinion.  They are designed for a man, plus they seem to not gather moisture, as some fabrics do"
"B00080L006:small,_lightweight,_and_beautiful:john_seybold",B00080L006,DOPP Front Pocket Getaway: Apparel,apparel,8 of 8,5.0,"Small, lightweight, and beautiful","March 6, 2006",John Seybold,"Palo Alto, CA","I was looking for the lightest, slimmest possible wallet, and the Dopp Getaway is just about perfect.  For the first couple of weeks I kept sticking my hand in my pocket to make sure it was still there - it's that unobtrusive.  It's made out of soft, thin leather (so thin, actually, that the embossed lettering on my credit cards shows through the surface).  That might affect the durability, but it certainly keeps the overall bulk of the wallet down.  The illustration shows a large embossed crest, but mine arrived with only discreet lettering saying ""Dopp"" at the bottom - a significant improvement, in my mind.  The wallet has pockets for 3 credit cards and a little pouch, open on the top and one side, to hold your cash.    There's also one additional pocket that's ideal for other documents you just have to carry.  The only slight negative for me was the caramel-colored vinyl lining of the cash pocket.  I don't know why they used such a low-class material there.  It's invisible from the outside, and not really offensive, but if I could change one thing, that would be it.  I debated knocking off a star for it, but the overall function and appearance of the wallet is so excellent that I thought it deserved the full five stars.

Overall, if you're disciplined about what you carry, you'll love the small size and low bulk of this wallet."
"B0002PDPEG:romance_in_a_bag.:r._galloway_""whiteboy_bob""",B0002PDPEG,Intimo Men's Classic Stretch Silk Boxers: Apparel,apparel,,5.0,Romance in a bag.,"November 10, 2006","R. Galloway ""Whiteboy Bob""","Los Angeles, CA",It will definitely get her attention in the best possible way
"B000I6ZV50:very_elegant!:sara_mencia_abre_""just_me""",B000I6ZV50,Charles by Charles David Women's Mischief Open Toe Slingback: Apparel,apparel,,4.0,Very elegant!,"March 12, 2007","Sara Mencia Abre ""Just Me""","Santo Domingo, Dominican Republic","This is my first Charles by Charles David shoe.  The material is good, the size too. The only uncomfortable issue was the open toe side, but it after 3 days using them it was ok.

Very nice shoe but definetly it is not a $100 dollars one, if you pay less than $50 will be fair"
B000EBL6J4:stylish_and_comfortable_heels!:riani_townshend,B000EBL6J4,Steve Madden Women's Kisses Thong: Apparel,apparel,1 of 1,5.0,Stylish and Comfortable heels!,"July 30, 2006",Riani Townshend,"Seattle, WA","My twin sister bought these for me, and initially I thought they were too tall and they would never be comfortable. 

Breaking them in wasn't so hard - although the little 'ball' part made the top of my foot hurt at first. 

But now, they feel stable, comfortable and easy to walk it. They feel perfectly balanced and I've never experiance blisters in these shoes. 

Two thumbs up"
"B000ANQXDU:strong_and_durable:nina_r._williams_""lovelybrowngirl""",B000ANQXDU,Harriton Contrast Tote Bag: Apparel,apparel,,4.0,Strong and durable,"March 8, 2007","Nina R. Williams ""lovelybrowngirl""","Baton Rouge, LA","I really liked my tote bag.  What I liked most was the variety of colors and the size of the bag which is pretty durable considering that I use mine to tote my books in college.  The only thing that i didnt like was the outrageous amount for shipping.  Let me tell you when I say the company sent the bag ""stuffed"" in a small manilla envelope but yet charged me what almost 6 or 7 dollars in shipping when in fact the enevelope probably costed about 50 cents to ship.  That was foul!  Despite everything about the shipping cost the bag is a good bag and I guess I shouldnt complain as much"
B000ANQXDU:great_gifts_for_bridemaids!:mmmpal,B000ANQXDU,Harriton Contrast Tote Bag: Apparel,apparel,,5.0,Great gifts for bridemaids!,"January 5, 2007",Mmmpal,New Jersey,"For the price, these bags cannot be beat!  There aren't terribly large, but they are just the right size to fit the goodies that I purchased for my girls.  I am having them personalized and they will be ready to give"
"B000ANQXDU:nice_tote:nymoviegirl_""nymoviegirl""",B000ANQXDU,Harriton Contrast Tote Bag: Apparel,apparel,56 of 56,4.0,Nice Tote,"July 30, 2006","NYMovieGirl ""NYMovieGirl""",NY,"I am happy with this bag (I got the pink and white one). It is a lovely color, nice size, durable and good price. It comes with an outside pocket and I received it quickly. My only complaint is that almost $7 in shipping is being charged for a light tote that was $3.99, otherwise I highly recommend this bag."
"B000ANQXDU:great_value!:morgaine_swann,_h.ps._""morgan""",B000ANQXDU,Harriton Contrast Tote Bag: Apparel,apparel,11 of 11,5.0,Great Value!,"June 7, 2006","Morgaine Swann, H.Ps. ""Morgan""",Eastern KY United States,"I wasn't expecting much based on the price, so I was pleasantly surprised when I received my order. The tote is a nice size, made of relatively heavy fabric and seems to be well-sewn. I've paid a lot more for a lot less. This was a great buy"
B000G33AL2:wide_dress_shoe_:m._elfer,B000G33AL2,LifeStride Women's Shelley Dress Shoe: Apparel,apparel,,5.0,Wide Dress Shoe ,"March 23, 2007",M. Elfer,,"I have wide feet and getting comfortable shoes expecially dress shoes has been a problem for me.  Once again LifeStride does know the meaning of wide shoe sizes.  It fits me very well, looks great, and is comfortable.  The color, Wild Rice is a medium dark tan and is as shown. I do recommend the shoe, and of course it is available in other widths-so it is not just for wide feet"
"B000BX2YAU:under_where?:b._valentine_""i_am_out_to_prove_i_have_nothing_to_prove!""",B000BX2YAU,Jockey® Classic 3 Pack Boxer Brief: Apparel,apparel,1 of 2,5.0,Under where?,"February 17, 2007","B. Valentine ""I am out to prove I have nothing to prove!""","Seattle, WA","Look what I found?  Where?  Under  there!  Under wear? ... Right there! It says, ""Be the first person to write a review""  for Jockey Boxer Briefs.  Hmmmm...  no wonder no one has  reviewed these  yet -- who writes a review for men's underwear?  

Ok, fine, I'll do it.  I love these, my preferred brand and style. Your brand and your style may vary as this category of apparel tends to be a personal preference item.

I only buy these in black as I am a firm believer that underwear (men's especially) should not be white -- as by the time the end of the day rolls around and it's time to change them  -- it's better to be left  wondering  what might be there as opposed to seeing it so prominently displayed on a white background!

These hold up well for the price.  Nothing lasts forever. The elastic band is usually the first to go (after many repeated washings) before the material gives out.  i.e. they will fall off before they rot off. 

Finally, so I can feel like I have done a complete job in reviewing these, I had a buddy of mine help with the ultimate test - the Weggie test - and these shorts handled it well...  extreme pain was reached well before the structure and/or material of the boxer short failed.  I give these a ""ten tippy toes"" rating for how well they performed in the test."
"B0000AH1N5:very_comfortable_shoe:debra_keais_""debbie_keais""",B0000AH1N5,Reebok Women's Freestyle High: Apparel,apparel,2 of 2,5.0,Very comfortable shoe,"April 23, 2005","Debra Keais ""Debbie Keais""","San Diego, CA USA","This is one of the most comfortable shoes I have ever worn. The high top really supports your ankle and the shoe itself is form fitting and not one of those big bulkly tennis shoes.  It's light weight and flexilble, but still supportive. Well worth $30."
B000HARD58:cute:marietta,B000HARD58,Clarks Artisan Women's Sago Wedge: Apparel,apparel,,5.0,Cute,"April 11, 2007",Marietta,Ohio,I love these shoes and they are so cute and comfortable.  The heel is not so tall that you feel like you can't walk.  Customer service and shipping was excellent.  Best price I could find.  Don't hesitate on this purchase.  You'll love them
B000JZDKWQ:zenvision_m_silicon_case_is_nice:lance_buerke,B000JZDKWQ,Silicone Case for Creative Zen Vision M 30GB Deluxe Package Sillicon Skin Cover comes with Armband/Screen Protector / Belt Clip / Film Screen Protector / View Stand: Apparel,apparel,,4.0,ZenVision M Silicon Case is nice,"April 5, 2007",Lance Buerke,"Montgomery, IL",Protects the Vision M without restricting it's use or synch connection. Flip screen provides extra protection but doesn't always stay in place. Shipping took a little longer than expected (more than a week) but was reasonable
B000JZDKWQ:a_great_case_at_a_great_price:mark_hecht,B000JZDKWQ,Silicone Case for Creative Zen Vision M 30GB Deluxe Package Sillicon Skin Cover comes with Armband/Screen Protector / Belt Clip / Film Screen Protector / View Stand: Apparel,apparel,1 of 1,4.0,A great case at a great price,"March 22, 2007",Mark Hecht,,"After having purchased the DLO sports case for my Creative Zen Vision M, I read horror story after horror story about the case being too tight, scratching the unit, and even leaving a sticky residue on your valuable player. I looked around for a while before going with this package deal and I'm happy I took the time to do so. 

The case is snug enough so your Zen won't move around in it but it doesn't button mash either. The download/charging port on the bottom is large enough to allow the adapter to plug in easily - so once the case goes on you never really have to take it off. The power switch, headphone jack, and microphone all have openings that are completely functional. The belt clip, kick stand and arm band are all bonus add-ons that can be used or not depending on your needs. And finally the flip screen helps protect your valuable screen which is the main reason I bought this. 

The film screen protector is difficult to put on without leaving any air bubbles underneath so I took mine off in the end. Fortunately, these can be found almost anywhere unlike this case and package that comes with it. And all of this for under $10??? A great deal on an excellent product. Highly recommended"
B000CKXFDM:very_comfortable:tabitha_peters,B000CKXFDM,Crocs Cayman Clog - Women's: Apparel,apparel,11 of 11,5.0,Very Comfortable,"July 15, 2006",Tabitha Peters,Ozark Alabama,"Not very pretty but the comfort makes up for that.  I am on my feet all day and used to wear reeboks, nike etc, I decided to try the Crocs and have not gone back !!! Its like walking with slippers on. I have been wearing them for about 7 months or so and just recently tried my tennis shoes again and barely made it through the day. By that night my feet and back were hurting so bad I didnt want to do much but sit down. Right then and there I made up my mind to never go back to tennis shoes again !!!  I do wish they were a little cheaper so I could add all the colors to my wardrobe. Buy them you wont be sorry !! Stay away from the look a likes they are nothing like the original crocs in comfort !"
B000BP7XUE:great_underwear:brian_l.,B000BP7XUE,2xist Contrast No-Show Trunk 3133C: Apparel,apparel,1 of 1,5.0,Great underwear,"October 12, 2006",Brian L.,"Chicago, IL USA","I wouldn't say they're my favorite pair, but I definitely like them.  Soft, Comfortable, Sexy"
"B00074USK6:good_purchase:d._mcbride_""hd4dmtn""",B00074USK6,Speedo Speed Socket Swim Goggle: Apparel,apparel,,5.0,Good purchase,"December 11, 2005","D. McBride ""hd4dmtn""","Houston, TX USA",These are great goggles they are as good as sweeds but don't leave marks.  they stick to your head the same way.  I have used mine in several Triathlons and they are so easy to use and adjust if needed. 
"B000IG2GUI:black_tuxedo_outfit:mease_""mease""",B000IG2GUI,Value Priced Boys Black Tuxedo Outfit with Vest in Infants and Toddler Sizes: Apparel,apparel,,5.0,Black Tuxedo Outfit,"March 13, 2007","Mease ""Mease""",Virginia,"I really liked the Black Tuxedo Outfit, my son wore it in a pageant and won, so I am very very happy about that. The tuxedo fit nicely and looked very nice on him"
B000IG2GUI:great_tuxedo:s._kunz,B000IG2GUI,Value Priced Boys Black Tuxedo Outfit with Vest in Infants and Toddler Sizes: Apparel,apparel,2 of 2,5.0,Great Tuxedo,"January 3, 2007",S. Kunz,"Snohomish, WA",I purchased this tuxedo outfit w/vest for my son who was in his aunt's wedding.  He was 18mos. at the time.  It looked wonderful on him and fit nicely.  The pants were a little long but other than that it fit very nicely on him.  The tuxedo was true to size of my child.  Fast shipping from retailer as well.  I was very impressed overall
"B0001EKZ1Y:very_nice_leather_backpack_at_a_very_good_price:arthur_s._lake_""a.lake""",B0001EKZ1Y,All-purpose Leather Backpack: Apparel,apparel,6 of 6,5.0,Very nice leather backpack at a very good price,"November 2, 2006","Arthur S. Lake ""A.Lake""","Framingham, MA","This backpack is sturdy, good looking, very functional and at at least a third of the price of other similar backpacks I looked at, I'm completely satisfied with this purchase"
B000K3LREK:the_lady_loves_her_hello_kitty!:d._freitas,B000K3LREK,Hello Kitty Black and White Cami/Panty set for women: Apparel,apparel,1 of 1,5.0,The lady loves her hello kitty!,"January 18, 2007",D. Freitas,"Brockton, MA USA",If your girlfriend is a fan of hello kitty then you can't go wrong with the cami/panty combo. Its cute but sexy. Very nice
"B000CH8PH6:never_buy_just_one:tracie_hall_""star_spotter""",B000CH8PH6,Gildan - Ultra Cotton Heavyweight Tee (G200): Apparel,apparel,,5.0,Never buy just one,"March 25, 2007","Tracie Hall ""Star Spotter""",Hunt. Beach Cal.,"I made a bone head move and just bought one. It cost as much to send it as it did for one shirt. These people have areally good t-shirts. Not thin, and they are stiched well"
"B0000861GT:best_i've_ever_owned...:a._paziora_""ap""",B0000861GT,Champion Maximum Support Sport Top: Apparel,apparel,,5.0,Best I've ever owned...,"February 28, 2007","A. Paziora ""AP""","Phila, PA",This is the the most comfortable and motion limiting sports bra ever.  I highly recommend it
