unique_id,asin,product_name,product_type,helpful,rating,title,date,reviewer,reviewer_location,review_text
"B000FH65DE:glamorous,_mysterious,_seductive:gail_cooke",B000FH65DE,Armani Code by Giorgio Armani for Women 1.7 oz Eau de Parfum Spray: Beauty,beauty,7 of 8,5.0,"GLAMOROUS, MYSTERIOUS, SEDUCTIVE","July 23, 2006",Gail Cooke,"TX, USA","       Glamorous, mysterious, seductive all describe Armani Code, a captivating orange blossom based scent from Giorgio Armani Fragrance.

	As one would expect from this master couturier the bottle itself is a gem.  Tapering from a weighted base the slim flacon seems to glow as lacquered shades of blue sweep from an early dawn at the bottom of the sleek holder to midnight nearing the top.  Adding to the fragrance's intrigue is an oriental effect achieved by  lace embroidery on the glass.

	The scent  is sweet yet sensuous with a sparkle provided by orange zest.  With orange blossom at its heart Armani Code is enhanced by Sambac jasmine, Madagascan vanilla and honey.  The man in my life called it ""delicious,"" and I do, too.  It's now high on my list of favorite fragrances.

        - Gail Cook"
B000FH65DE:a_staple_scent:nikita_jolie,B000FH65DE,Armani Code by Giorgio Armani for Women 1.7 oz Eau de Parfum Spray: Beauty,beauty,4 of 5,5.0,A staple scent,"July 21, 2006",Nikita Jolie,,"This one could appeal to a variety of fragrance lovers as it seems to find that middle ground in preferences. It's not too spicy, not sickeningly sweet. It's not trying to do too much. Just effortless. One thing I like about this, you're not at risk at dousing yourself and offending other noses. I hate smelling or leaving a trail of perfume in the air. This one has restraint. Staying power is debatable but it's such a wonderful, confident woman scent, I gave it 5 stars"
B000FH65DE:absolutely_delicious...for_the_1_hour_it_stays_on_your_skin:zengrrl,B000FH65DE,Armani Code by Giorgio Armani for Women 1.7 oz Eau de Parfum Spray: Beauty,beauty,2 of 3,4.0,Absolutely delicious...for the 1 hour it stays on your skin,"May 19, 2006",Zengrrl,"Denver, CO","This is one of the most beautiful, sexy scents currently on the market.  If you are a gourmand/oriental fragrance lover (examples of which include Thierry Mugler's Angel or Angel Innocent, Bvlgari's Omnia, Calvin Klein's Euphoria, or Burberry's Brit - all of which I own and wear regularly without longevity issues - see next paragraph) then I would highly recommend this fragrance.  Sweet, but in a sexy, subtle musky way.  

I would bathe myself in this fragrance if I could.  And I should.  As noted by the previous reviewer, this fragrance is gone in flash.  I give myself about 5 hearty sprays of this in the morning, including two directly misted onto my clothing in an effort to extend the fragrance, but it is gone by noon.  This is truly perplexing.  Every other Giorgio Armani frangrance that I own, including Sensi, Emporio She, and Armani Code for Men (also great for women), can go the distance.  

This is supposed to be Eau de Parfum, but wears very much like Eau de Toilette.  Someone seriously skimped on the oil base.  It that doesn't trouble you terribly, pick this one up.  If you want something similar that will last through the entire day and most of the night, and particularly love the musk component of this fragrance, then I would wholeheartedly recommend checking out Narciso Rodriguez's ""For Her"" or ""Musc for Her"" instead"
"B000ILPLT6:great_for_travel_hygiene:k._ward_""lvngrndma""",B000ILPLT6,The Body Shop Vitamin E Gentle Cleansing Wipes: Beauty,beauty,,5.0,Great for Travel Hygiene,"March 28, 2007","K. Ward ""Lvngrndma""",,This is really a nice product for staying fresh and clean-feeling during long flights
B000ALY3Z2:great_stuff:h._ashasian,B000ALY3Z2,Clinique Quickliner for Lips: Beauty,beauty,,5.0,Great Stuff,"December 21, 2005",H. Ashasian,CA USA,"Personally I love it, I use the lipblush as liner and lipstick for daytime.  Can't live without it"
"B0006DS3KU:absolutely_the_greatest_hair_product_ever:elke_hinze_""web_dev_girl""",B0006DS3KU,Ojon Restorative Hair Treatment: Beauty,beauty,1 of 1,5.0,Absolutely the Greatest Hair Product Ever,"April 3, 2007","Elke Hinze ""web dev girl""","Two Rivers, WI United States","After seeing this in a magazine, I decided I had to try it so I ordered a small sized tub from Sephora.  OMG what an amazing change to my hair.

I am a perpetual hair dyer and last year had a perm that I then straightened because I hated it.  Top that off with living in Hawaii prior to that, and between the color, sun, and perm my hair was getting a little sad.

This stuff is amazing. From the first time I used it, my hair was shiny and very soft.  

I call it the ""dirty hippy hair stuff"" since it smells like incense.

I would definitely recommend this product to anyone.

If you don't want to pay the Sephora or QVC prices, buy it on ebay.  I have a found a seller there that sells the large tub for $20 cheaper than what you buy it at Sephora for"
B0006DS3KU:smell_washes_out:misskris28,B0006DS3KU,Ojon Restorative Hair Treatment: Beauty,beauty,1 of 1,5.0,smell washes out,"March 19, 2007",misskris28,"kingston, PA","i've been using ojon for a year or so, and my hair has never been healthier.  i have long, fine, wavy hair which i flat iron about 5 times a week; this product definitely keeps your hair shiny and protected from heat damge and split ends.  hair stylists are always amazed at the great condition my hair is in being that i heat treat it so often, and i get comments all the time from friends, family, and just people i encounter about how shiny and pretty my hair looks.  the smell is distinctive (not offensive in my opinion), but you wash the product out out!  my hair smells like my shampoo/conditioner, so i really don't understand what the other posts about the smell are trying to say.  i definitely reccomend this product and do so often.  "
B0006DS3KU:i_love_it_and_will_never_be_without_it:j.s.l.w.,B0006DS3KU,Ojon Restorative Hair Treatment: Beauty,beauty,13 of 13,5.0,I Love It and Will Never Be Without It,"March 11, 2006",J.S.L.W.,"North Dallas, Texas","I have thick, coarse, african-american hair that is relaxed (permed straight). I usually use this product on wet hair (after a shampoo)when blow-drying my hair straight. It makes it really smooth and shiny. I have received a lot of compliments on my hair since I have started using it. In warm temperatures it does melt down but in my opinion it makes it easier to use. When it is a solid you are supposed to rub it in the palm of your hands to liquify it and then put it in your hair. It does have a smokey scent to it but no one pays attention to that...they are looking at how great my hair is. I love Ojon's conditioner (it is the very best I have ever used)but the shampoo in my opinion seems to dry my hair. "
"B0006DS3KU:it_saved_my_hair...:pamela_ferrer_""eyesonly1031""",B0006DS3KU,Ojon Restorative Hair Treatment: Beauty,beauty,5 of 5,5.0,it saved my hair...,"December 17, 2005","Pamela Ferrer ""eyesonly1031""","Flushing, NY","I don't know about the people who gave 1 or 2 star reviews but this product is the ONLY thing that saved my hair. I did everything from getting a curly perm to stripping the color. I used coconut oil, frequent trims, keratin treatments and NOTHING worked. My hair still kept breaking and splitting like clockwork. When I used the product, 3 treatments later and it's never been healthier. The product is very oily, so USE SPARINGLY when you use it as a gloss or leave in conditioner!

P.S. People with healthy, not-so-damaged, and normal hair do not need to use this stuff. Because if you do, you'll get silly comments from a tree-hugger that has nothing to do with the product. This product is only for heavy duty damage! By the way, the ONLY thing good from John Frieda is Frizz-Ease..."
"B00021BHYK:by_far,_the_best:amazon-aholic",B00021BHYK,Benefit Cosmetics Play Sticks: Beauty,beauty,,5.0,"By far, THE BEST","December 5, 2006",Amazon-aholic,MN United States,"This is absolutely the best concealer EVER. I have skin that is very sensitive and prone to breakouts with face makeup - this stuff hasn't been a problem! It stays put all day long, and does not shine"
B000HGHGQS:sensitive_skin:sarah_johnson,B000HGHGQS,The Body Shop Tea Tree Oil Face Mask: Beauty,beauty,,5.0,Sensitive Skin,"April 24, 2007",Sarah Johnson,England,"Almost immediately after using this face mask the redness in my face was gone.  It helps with a number or skin problems, and I have sensitive skin so it's hard to find a product that won't hurt me.  Most facial masks cause a minor chemical burn, this left my face beautifully soft.  If you're unsure of this product, or wavering at all, let me tell you that you should buy it, it's amazing."
B000BIPK4C:no_more_eyeshadow_creases!:lynn_s,B000BIPK4C,Guerlain Divinora Protective Base For The Eyelids: Beauty,beauty,1 of 1,5.0,No more eyeshadow creases!,"November 3, 2006",Lynn S,"San Francisco, CA","This is a life-changing product if you have any issues with eye shadow creasing.  You just smooth a little of this product on your eyelids before applying eye shadow, and it provides a perfect base.  Twelve hours later, the shadow is still perfectly in place.  I bought this at a Neiman Marcus store, but the product is so good I wanted to make sure I rated it online so others would know how great it is!"
B000EOXQOE:good_lip_gloss:cheryl_havanac,B000EOXQOE,Bobbi Brown Lip Gloss: Beauty,beauty,5 of 5,5.0,Good Lip Gloss,"March 17, 2006",Cheryl Havanac,"Minneapolis, MN","I am very impressed with the whole Bobbi Brown line.  This lip gloss is no exception.  These lip glosses come in tubes with wands that have a small lip brush on the end.  The colors are fantastic.  These glosses are all very neutral, and natural looking colors.  None of these glosses are going to make you look too made up; just make you look finished.  The texture is not too tacky or sticky.  And it has a light scent, not very strong and overall its a very good lip gloss.  I highly recommend these lip glosses and will continue to purchase them.  "
"B00021DARW:great_for_thick,_coarse_hair:annie",B00021DARW,Frederic Fekkai Hair Mask with Shea Butter: Beauty,beauty,2 of 2,5.0,"Great for thick, coarse hair","September 29, 2005",Annie,HI,"I have thick and very coarse hair (as you read in the title) that I am trying to grow out, and I have tried everything before to help tame the mane.  I always look for a product that not only puts back moisture into my hair, but something that can fortify it as well to prevent more damage.  I've tried almost every single intensive conditioner in the stores and tried a lot in the salons as well, however this one I came across by accident.

My aunty had gone to a Frederic Fekkai promo sale and bought a WHOLE bunch of stuff.  It didn't really do much for her hair, so she passed them on to me to try.  Some of the stuff I wasn't too impressed with, but this hair mask did wonders for my hair!

After just one use, I could totally tell a difference in the feel and texture of my hair.  Usually, I have to straighten or blow dry my hair when its wet to tame it, however this product I didn't have to do too much after.  I let my hair air dry and just put in a anti-frizz cream after, and that was good.

The mask washes out clean (no greasy residue), so this product is really good for weekly restoration.  But from what it seems like, this hair mask (along with all products, I suppose) work for some people and not for others.  Your best bet is to get your hands on a sample size before you shell out the money for a full tube, since it can be kind of expensive"
B00021DHSE:wonderful!:debbie,B00021DHSE,Frederic Fekkai Luscious Curls Cream: Beauty,beauty,2 of 2,5.0,Wonderful!,"June 12, 2006",Debbie,"Maryland, U.S.","I got a free sample of this product at a Nordstroms trend show and decided to use it the other day. My hair is pretty course and frizzy and long, but it is also more kinky curls instead of big, round, ringlets. Well, I let my hair air dry then applied a serum to take care of the frizz. Then I put some in my hair (you don't need much) and scrunched and twisted my hair. It worked wonderfully! My hair was bouncy and had lots of volume and was very shiny and curly, the best i have ever seen it! I got a lot of compliments on it too. The only thing is that if you use too much your hair gets too shiny and looks oily, also it doesnt have much hold at all, so a good hair spray really does the trick with this. Besides that, it is a wonderful curl enhancer"
"B00021DHSE:one_step_to_achieving_great_curls!:emma_callahan_""product_junky!""",B00021DHSE,Frederic Fekkai Luscious Curls Cream: Beauty,beauty,3 of 4,4.0,one step to achieving great curls!,"March 27, 2006","Emma Callahan ""Product Junky!""","Boston, MA","Anyone who gave this lotion a low rating simply did so because they don't realize achieving GREAT curly hair is a process. There is no ONE product that can do all the work.

I have thick, frizzy, DAMAGED, curly hair. I use this lotion after using my favorite shine serum, then after letting air dry for a few minutes finish with gel or mousse for hold.

The curl enhancing lotion really REALLY improves the look of my curls - from uneven ringlets and loose waves, to an almost universal loose big curl - it's beautiful!

The only downside is the TINY bottle for such a high price. It should be at least 8oz"
B00021DHSE:awesome_curl_enhancer!:s._newnham,B00021DHSE,Frederic Fekkai Luscious Curls Cream: Beauty,beauty,12 of 12,5.0,Awesome Curl Enhancer!,"December 10, 2004",S. Newnham,,"I love this light curing lotion! It smells like orange/vanilla creamsicle. It enhances the curls in my naturally curly hair, makes it more moisturized, and smells great! It has no hold, so if you need hold you'll need to use a gel over it. Love it, and worth the $s"
B0002JBQS4:i_will_buy_again!!!:sadie_shine,B0002JBQS4,Shiseido Pureness Oil-Blotting Paper 100 Sheets: Beauty,beauty,,5.0,I Will Buy Again!!!,"February 11, 2007",Sadie Shine,,Wow!  Shesheido has done it again!  I love thier products!  I have oily skin...so I like to blot my face once a day.  The papers are awesome...very soft.  They soak up the oil and I can tell after I throw the paper away.  Usually 1 sheet a day is all I need and my face is shine-free!  I love them!  I also like this product becuase you get 100 sheets which is the most I have seen so far.  I love this product and will buy again
B0002JBQS4:cool_stuff:sara_burnett,B0002JBQS4,Shiseido Pureness Oil-Blotting Paper 100 Sheets: Beauty,beauty,11 of 14,5.0,Cool stuff,"August 15, 2005",Sara Burnett,,"It's interesting to see all of the oil that this takes from your face. It really shows on the paper and it does it's job. Not as cheap as washing your face, but more fun"
"B000IEMGF0:very_good_bronzer:iliette_a._cabrera_""riddlerette""",B000IEMGF0,Laura Geller Balance - N - Bronze: Beauty,beauty,,5.0,Very Good Bronzer,"March 8, 2007","Iliette A. Cabrera ""Riddlerette""",,I really enjoyed that this powder let your face looking clean and matte finished instead for shine with glitter like some other bronzers do
B00021DE6E:clearly_one_of_the_best:giovanna_armas,B00021DE6E,Burberry Burberry Classic: Beauty,beauty,1 of 2,5.0,clearly one of the best,"March 24, 2006",Giovanna Armas,,"I love this smell- its sweet yet warm- not too sweet though, just right.  Very inviting, and you can wear with anything anywhere.  ALOT of compliments! with this one.... Will buy again! and again"
"B00021DE6E:mmmm,_dreamy_nights.:afaf_bouardi_""hair_and_glamor_product_aficionado""",B00021DE6E,Burberry Burberry Classic: Beauty,beauty,5 of 5,5.0,"Mmmm, dreamy nights.","November 28, 2005","Afaf Bouardi ""hair and glamor product aficionado""",Texas and Middle East,"I first got a whiff of this from a magazine enclosure.  It got me curious, as they rarely do.  Passing Sephora, I went in for a test...and felt seduced by the classy charm of the scent.  It seemed to have a rich sophistication which goes with horseback riding or polo.  After a few days, I still couldn't get the scent out of my head so I went back to grab it up.  I've only had this experience with a few other fragrences...but they were of a totally different style...Angel by Thierry Mugler and Flower by Kenzo"
"B00021DE6E:this_perfume_is_fantastic._not_pungent_or_overpowering.:s._bussard_""slave_to_fashion""",B00021DE6E,Burberry Burberry Classic: Beauty,beauty,5 of 5,5.0,This perfume is fantastic. Not pungent or overpowering.,"February 13, 2005","S. Bussard ""slave to fashion""","Baltimore, MD","The perfume is very subtle with a little hint of sweetness.  It's not overpowering or musky. Don't try to sniff the bottle or a sample...it won't do it justice.  You have to try it on your skin to know how great it smells.  I've had other designer frangrances, but this is by far my favorite and I've received a lot of compliments"
"B000FLUDA6:best_looking_eyes!!:andrew_j._eisemann_""linda_s.""",B000FLUDA6,Bare Escentuals Essential Brow Color: Beauty,beauty,1 of 1,5.0,Best Looking Eyes!!,"November 9, 2006","Andrew J. Eisemann ""Linda S.""",,All of the bBare Escentuals are great!  They make you look so young and fresh. I am 61 and people say I look 40! Even my daugther like it! She is very hard to please. Great buy and last a Long long time. Thanks!!!!
"B000FLUDA6:color_is_true_to_description:t._l._bowness_""new_grandma""",B000FLUDA6,Bare Escentuals Essential Brow Color: Beauty,beauty,1 of 1,5.0,Color is true to description,"September 17, 2006","T. L. Bowness ""new grandma""","Santa Maria, CA United States","I order the ash color for blondes and found that it is just the right color.  I also purchased the Anastasia brow stensils with this item and finally seem to have found a solution for my thin, mismatched brow problem.  I have ordered many Bare Escentuals products and love all of them"
B000EMW88G:wow!:a._wiggins,B000EMW88G,philosophy amazing grace 4 piece pampering gift set: Beauty,beauty,14 of 19,5.0,Wow!,"March 7, 2006",A. Wiggins,"Columbus, Ohio","I was pleasantly suprised when I received this gift set.  The bottles are much larger than I had anticipated.  Also, the bag is super cute. "
"B000MUZA1W:plump_those_lips:silvia_bridger_""truth_about_caffeine.com""",B000MUZA1W,Bare Escentuals Buxom Lips: Beauty,beauty,1 of 1,5.0,Plump Those Lips,"April 16, 2007","Silvia Bridger ""Truth About Caffeine.com""",SCR Books,"Feel sexy and tingly without the burn of most lip plumping products.  Your lips will be glossy, shiny and soft when you use this product"
"B000MUZA1W:the_best!:mel_mac_the_mad_scientist_""mel_mac""",B000MUZA1W,Bare Escentuals Buxom Lips: Beauty,beauty,1 of 1,5.0,The Best!,"March 20, 2007","Mel Mac the Mad Scientist ""Mel Mac""",USA,"I have tried every lip plumper on the market (no joke) and this is the best (besides pure cinnamon leaf oil, which burns like hell).  I use B.E. products and I bought a couple of these bc I liked the colors.  I was not expecting it to work as well as it did.  Now it is all I use on my lips! It makes your lips feel cool, not burning"
B000MUZA1W:yummy:geekitty,B000MUZA1W,Bare Escentuals Buxom Lips: Beauty,beauty,1 of 1,4.0,Yummy,"March 6, 2007",geekitty,"Chicago, IL",I am new to the world of gloss and haven't tried that many brands but this is definitely on my keeper list. If you want something that plumps I would look elsewhere but if your looking for a subtle gloss that smells great and gives your lips a nice chilled feeling this is the gloss for you.
B000MUZA1W:love_this_lip_gloss!:kristen_bogren,B000MUZA1W,Bare Escentuals Buxom Lips: Beauty,beauty,1 of 1,5.0,Love this Lip Gloss!,"February 2, 2007",Kristen Bogren,"Los Lunas, NM USA",I am so happy they are selling this now outside the gift set.. I have never had a lip gloss that tastes and looks and feels as great as this does! I have Amber and Dolly and plan to try a few other of the colors as its the best I have ever tried!
"B000ILNSKA:can't_live_without_this!:janelle_i._ruff_""janelle""",B000ILNSKA,The Body Shop Lip Scuff: Beauty,beauty,,5.0,Can't Live Without This!,"February 23, 2007","Janelle I. Ruff ""Janelle""","Michigan, USA",I LOVE this stuff. I ordered it at a friends Body Shop party a while back. I use it each moring after I shower and it keeps my lips soft all day! I tried to find something like this in the stores but NOTHING even came close to being as good as this!!! I highly reccomend it
"B000B9NA8O:great_poduct,_great_smell:ptitange98_""laura.""",B000B9NA8O,Kerastase Nutritive Soin Elasto-Curl Rinse Out Conditioner - 6.8 oz. 200 ml: Beauty,beauty,,5.0,"great poduct, great smell","January 15, 2006","ptitange98 ""laura.""",minneapolis,"Very good product and great kind of fruity smell. leave hair soft and full of ""bounce"". Easy to comb hair after using this product but might be combine with Kerastase conditionner for very dry and damage hair if your hair are very long. The price here is still more expensive than in Europe: around 22 euros"
"B00021E9AY:the_best_colors_ever!:nina_soto-cooperman_""nina""",B00021E9AY,LORAC Eye & Lip Pencils: Beauty,beauty,,5.0,The best colors ever!,"April 5, 2007","Nina Soto-Cooperman ""Nina""",New York City,These pencils are the best!They are the perfect texture and they last a long time
B000EOWXUW:easier_than_foundation_-_very_natural_looking:emma_antunes,B000EOWXUW,Bobbi Brown Extra Tinted Moisturizing Balm SPF 25: Beauty,beauty,1 of 1,5.0,Easier than foundation - very natural looking,"November 18, 2006",Emma Antunes,"Maryland, USA","I love this product - it's a lot more natural looking than foundation, and saves a step in the morning. It does a good job evening out skin tone, and it feels good on my dry skin. As someone who doesn't wear a lot of makeup, it adds that extra bit of ""polish"" that makes for a more professional appearance, without looking too made up"
B000DZM9XS:simply_wonderful!:~_m,B000DZM9XS,DHT Shampoo Cleansing System 8.5oz: Beauty,beauty,1 of 1,5.0,Simply wonderful!,"January 26, 2007",~ M,"New York, NY","I try a lot of products and this is simply my favorite.  Not only do they feel luxurious, they look amazing in my bathroom.  I sent my mom a set and she loves it too"
B000DZM9XS:won't_use_another_shampoo:david_m._bensimon,B000DZM9XS,DHT Shampoo Cleansing System 8.5oz: Beauty,beauty,4 of 4,5.0,won't use another Shampoo,"September 28, 2006",David M. Bensimon,"Los Angeles, CA, USA","hey,

I have been using Min shampoo on/off for about six months, and can no longer go off the stuff because when I do there is  dramtic difference. As far as the smell goes, I don't need to smell like a coconut or a Bloomingsdale, just make it pleasant or oderless and give texture and fullness to my hair. I don't think it smells medicated, (unlike reviogen) but just doesn't have too strong of an oder. If more people knew of this product more people would be happier with their hair."
B000B6A2E2:the_most_incredible_cream_out_there_:-):little_miss_cutey,B000B6A2E2,NeoStrata Ultra Skin Smoothing Cream AHA 10 1.75 oz: Beauty,beauty,6 of 6,5.0,The most incredible cream out there :-),"May 2, 2006",Little Miss Cutey,"Melbourne,  Australia","Let me say that this is the best skin care cream I have ever used and I know for a fact that it works because so many dermatologists stand behind it.  
I've used it for a little over a year now and I won't use anything else.  I don't know the last time I ever had to use an exfoliating scrub because what this does, is an automatic scrub.  It is gradually sloughing off dead skin cells for you and rendering the use of exfoliaters useless. 
I must say, it has a natural funky smell but you do adapt to that very quickly and won't notice it after a while.  You use it once a day for the first two weeks (while your skin gets used to it) and then twice a day thereafter if you want.  I only use it at night and a sunscreen throughout the day because the skin is a little more sensitive to the sun.
Caution - this is an acid cream.  I once had a minor paper cut on my finger (the same that I use to dip into the pot) and I still get tears in my eyes thinking of the pain I was in.  
This is an excellent cream and I strongly recommend it.  It won't get rid of wrinkles (you have to know that there is practically NOTHING on the market that will get rid of them) but it will soften the look of wrinkles and it will give your skin a beautiful softness and glow.  It's an amazing cream with true genuine results"
"B00062A7LY:great_fall_lip_color:s._paterson_""miss_ney_ney""",B00062A7LY,Laura Mercier Lip Colour - Shimmer: Beauty,beauty,3 of 3,5.0,Great Fall lip color,"November 1, 2005","S. Paterson ""Miss Ney Ney""",Philadelphia PA,"Laura Mercier is, by far and away, my very very favorite line of lip color.  Over the years, I have tried hundreds of lipsticks, glosses, pots, pencils, you name it.  Laura's are the best. Here's why I like them:
1. Color is natural and semi-sheer so it looks light-weight, no matter what the shade
2. Colors are not garish - you won't be throwing them out next season.  Not to say that they are boring, just timeless and well thought out.
3. They last a long time.  Not all day, but I really hate those ""all day"" lip colors.  By mid-day, my lips are so dry and gross-flakey.  I've thrown away more of those cruddy ""all day"" lip colors than I care to remember.  Back to the point, my Laura lipstick easily lasts me through a 2-hour presentation to a client.
4. I only wear the Shimmer line in Fall, and guess what? Metallics are so ""IN"" for Fall 2005"
B0002MNXSW:fabulous!:lucretia_nightshade,B0002MNXSW,Benefit Cosmetics Bathina Gettin' Steamy: Beauty,beauty,4 of 4,5.0,Fabulous!,"May 27, 2005",Lucretia Nightshade,"Sonoma County, California","It smells as pretty and pink as it looks. It's not to gooey like other shower gels, and I will definately repurchase it when I run out"
