unique_id,asin,product_name,product_type,helpful,rating,title,date,reviewer,reviewer_location,review_text
B0002DP5A0:amazing:,B0002DP5A0,Komenuka Bijin All-Natural Face Care Set: Cleansing Foam & Moisture Cream: Beauty,beauty,1 of 1,5.0,Amazing,"June 22, 2004",,,"Used the cleansing foam, then bought the moisture cream.  Whatever is in rice bran is truly wonderful, it cleanses without any dryness and a rosy glow has returned to my skin. Have stopped using my old department store stuff, replacing 4 of those products with just these 2 with better results. Good value on both, they should offer a deal on the shampoo and conditioner too"
"B000BLGVBK:philosophy_falling_in_love:j._holowaty_""jenna""",B000BLGVBK,philosophy falling in love perfumed fragrance solid: Beauty,beauty,,5.0,philosophy falling in love,"February 18, 2007","J. Holowaty ""Jenna""",Connecticut,I love the smell ... and I much prefer the solid perfume to the spray ... just subtle enough ....
B000BLGVBK:subtle_and_warm:finsupwi,B000BLGVBK,philosophy falling in love perfumed fragrance solid: Beauty,beauty,1 of 1,5.0,Subtle and Warm,"June 6, 2006",FinsUpWI,,"I absolutely love this fragrance.  When I put this on, I get a warm musky scent that lasts for hours.  I put the spray cologne version of Falling in Love on top to brighten it up a bit when I feel like it.  It is subtle, but I think it is a very sexy and warm scent and not at all overpowering.  Definitely something my husband wants to be near"
"B0002260MI:pleasantly_surprised...:s._chin_""dark_star""",B0002260MI,Hot Milk? BUBBLE BAR slice by LUSH: Beauty,beauty,1 of 1,4.0,Pleasantly Surprised...,"January 3, 2006","S. Chin ""dark star""",WA United States,"I was unsure about this item in the store- but took a gamble. I cut 1/3 of the bar up and crumbled it and I wasn't particularly impressed with the smell of it dry. So I grabbed the rest and tossed it all in. Wow! It was so silky and smooth against the skin, I jumped out and grabbed my husband to join me! With some nice classical music on in the background and a Tahitian Vanilla candle- you'll think your back in the womb- all safe and warm. The bubbles didn't last very long, but it leaves the skin silky and comfortable with out a perfumey scent"
"B0002260MI:non-floral_option,_plus_it_smells_like_kids_bubble_bath.:ilex_q._""songstress,_piano_technician,_and_espresso_junkie_extraordinairre""",B0002260MI,Hot Milk? BUBBLE BAR slice by LUSH: Beauty,beauty,1 of 1,5.0,"non-floral option, plus it smells like kids bubble bath.","September 11, 2005","ilex q. ""songstress, piano technician, and espresso junkie extraordinairre""",lust comes into phaze,"my first thought on crumbling some of this into my running bath was that it reminded me of bubble baths from when i was kid. there's this really nice subtle clean smell to this bubble bar. i really like that it's not an overpoweringly smelly bubble bar. it's great for those who don't want a flowery bath, but who can't tolerate the overwhelming patchouli in the blue skies bar. i wish i'd bought two of these instead of one of this and one of the blue skies. plus, this is a good bar for mixing with a bath bomb. really probably any bomb would do. good stuff"
B0002260MI:wonderful_bedtime_bath:a_houston_mommy,B0002260MI,Hot Milk? BUBBLE BAR slice by LUSH: Beauty,beauty,5 of 5,5.0,Wonderful bedtime bath,"May 5, 2005",A Houston Mommy,Texas,"This was my first Lush experience and now I am hooked. Something about the scent of this bubble bar relaxes me like nothing else. It didn't smell like hot (coconut) milk to me - it has a warm, spicy, pleasant scent - but it definitely had that ""warm milk before bedtime"" effect. And it works miracles on my rambunctious two-year-old daughter. Not only does it produce LOADS of bubbles (fwiw we have an oversized clawfoot tub, and a third of a bar filled it to the top w/bubbles) but the scent seems to calm and relax her as much as me. Warning: don't take this bath if you're planning an evening out! You'll just want to snuggle into bed afterwards"
B0002260MI:decent:lush_princess,B0002260MI,Hot Milk? BUBBLE BAR slice by LUSH: Beauty,beauty,2 of 3,4.0,Decent,"August 6, 2004",Lush Princess,,"Bubbles nicely but does not smell like ""hot milk"". I've never tried milky bar so I have no idea if the two compare. Hot Milk? IS comforting though. Its like being wrapped in warm fluffy towels straight from the dryer"
B00022612C:calling_all_lavender_lovers:monica_s._jones,B00022612C,Ooh La La Natural Soap by LUSH: Beauty,beauty,5 of 7,5.0,Calling all Lavender Lovers,"May 12, 2004",MONICA S. JONES,Plattsmouth NE USA,This is the one for you. I love love love lavender.  And this soap is it.  Concentrated lavender goodness. Very dark purple in color and complex in scent layering.  Wonderful light texture to soap
"B000CDMA30:acne_suffers_must_get_this_:m._horvath_""shortcake""",B000CDMA30,Philosophy Oxygen Peel Kit Kit: Beauty,beauty,2 of 2,5.0,ACNE SUFFERS MUST GET THIS ,"May 30, 2006","M. Horvath ""shortcake""","Vancouver, WA","I developed acne after I turned 23 and have had limited success using over the counter products. I purchased the acne kit and it began to clear up my skin, but I would still get the cysts that took for ever to go away or they would never get to the surface. I starting using the oxygen peel one a week and found that it wasn't doing much and that there was a lot of extra get that I had made that was wasted. I talked to the girl at the counter several days ago about this and I had a huge cyst that was very painful. She told my to use the oxygen peel 3 times in a row and that should help. I would be using all the extra gel that was made and would see more results. 
I went home that night and did just as she said. I was amazed to see that the painful cyst had risen to the surface and I was able to relieve the pressure. This is a truely amazing product and would recommend it to anyone who has this same proble"
B0007WBPE6:for_a_natural_glow:gail_cooke,B0007WBPE6,Laura Mercier Illuminating Stick: Beauty,beauty,13 of 14,5.0,FOR A NATURAL GLOW,"June 22, 2005",Gail Cooke,"TX, USA","	For a touch of the sun without risking  skin damage the always innovative and practical  Laura Mercier came up with the ""Solar Flair"" Collection.

	One of my favorites in this line is the Illuminating Stick, an easy way to achieve an instant glow.  The stick is available in two shades, Golden Honey Glow, which provides a subtle bronze luster, and Golden Rose Glow, which very much resembles a natural blush.

	With earth minerals for a lovely luster and shine, the color is applied directly to the skin with fingertips or brush.  It blends smoothly and leaves a soft, velvety texture.

	There's no limit to where it can be used - as a blush on the apple of the cheeks or across forehead, brow bone or chin for a ""just in from a day at the beach"" look.  For evening my preference is the Honey Glow applied across shoulders as well.

	Key ingredients include Vitamin E, Vitamin C, Vitamin A, and Bismuth Oxychoride, which acts as a light reflector by sun or moonlight"
B000A0QQRQ:all-around_best_razor:joseph_dipietro,B000A0QQRQ,Merkur Progress Double Edge Safety Razor: Beauty,beauty,2 of 2,5.0,All-around best razor,"December 21, 2006",Joseph Dipietro,"Philadelphia, PA","Having shaved with everything from cheapo disposables to Thiers-Issard straight razors, I have to say that the Merkur Progress is probably the best all-around razor available today. It has excellent heft and balance, and the adjustment feature is simple and straightforward. (Although I do agree that the numbered adjustment seems to perform a little differently depending on the blade used.) It is easy to keep clean--assuming you don't mind unscrewing it and taking the blade out to wipe off the head and frame. Having also used a venerable old Gillette ""fat boy"" from the 1950s, I'd still have to rate the Progress as a better razor; the screw operated adjustment makes it constantly adjustable, not just in steps. 

Since this is a safety razor, its performance is significantly dependent on the blades used. I've tried both the Merkur blades and the Japanese ""Feather"" blades, and would say that it's a toss-up. 

And since it is an adjustable safety razor, it is perfectly suited to two-pass close shaving. A higher setting is excellent on the first pass with the grain of the beard, and a lower setting for the pass against the grain. The adjustment also allows you to adjust the razor to the conditions of your skin and beard. If you've let yourself get a day's worth of stubble (c'mon--don't we all?) you can set the blade high to mow that hedge. If you need a quick clean-up before a night on the town, you can set it lower for a ""Once lightly, James.""

So if you want a really well-made, no-nonsense but very versatile razor that will last for a good long time, this is a good bet. The only problem might be preventing pals from swiping it, or reminding your wife/significant other to take it apart to clean it after she smooths up those pretty pins you love so well.

One recommendation: Shop around. You can get these for under $40.00 if you bargain-hunt, likewise full 20-count boxes of carded Merkur 10-blade refill sets"
B0006NIW0G:this_stuff_smells_great!:computer_chick,B0006NIW0G,Fantastic Four Bath Bomb Gift Set by LUSH: Beauty,beauty,2 of 2,4.0,This stuff smells great!,"June 30, 2006",Computer Chick,"Slidell, LA USA",I bought this on a whim because I just remodeled my house after Hurricane Katrina and now have a huge jacuzzi tub...nice to take long baths in so of course I needed some bubble stuff.  The bath bombs smell wonderful.  My whole bathroom smelled of the bath bombs until I used them all.  I even put the box they came in into my closet and it made my closet smell wonderful (for about a week)!  The bombs each have something special inside of them that you find out about when they dissolve.  The fizzing is fun and the smell lingered on my skin until the next day.  I loved them and will definitely buy more
"B000HH6LB8:my_lip_fix_for_sweet,_kissable_lips:kiss_+_makeup_""makeup_junkie""",B000HH6LB8,Tarte FRXtion: Beauty,beauty,,4.0,"My Lip Fix for Sweet, Kissable Lips","April 23, 2007","Kiss + Makeup ""Makeup Junkie""","Los Angeles, CA","This was my fisrt foray into lip scrubs.  I like the dual concept, with a scrub on one side and a lip balm on the other.  I also like the fact, this slips into you purse or pocket easily, so it's convenient for those on the go.  I took mine skiing in Vail, and it was the first time I didn't come home with chapped lips. 

The textures are good.  The scrub side is slightly grainy, more of a polish than a scrub.  I would not recommend it for heavily chapped lips, but it works well for weekly maintenance. The lip balm side is a little waxy, but moisturizing with vityamin e.  It's quite long-lasting and provides a sweet, natural shine.  This smells of spun vanilla, sweet and sugary. 

Why only 4 stars?  I think Tarte should have added SPF 15 sun protection.  Doing so would provide sweet, kissable lips and the protection you need"
"B000HH6LB8:love_the_scrub,_and_the_balm_is_great,_too.:shintojuunana",B000HH6LB8,Tarte FRXtion: Beauty,beauty,,5.0,"Love the scrub, and the balm is great, too.","March 30, 2007",shintojuunana,,"I got this as a present, when it finally came back in stock.

The scrub part of the stick does a great job, but you need to have lips that aren't in dire need of help for it to really work.  To do that, just use a moist, soft toothbrush, and gently scrub.  The scrub side will sometimes leave a little sugar behind, so you might have to wipe your lips off a little after you use it, but I found that this doesn't happen all the time.

The balm side goes on smoothly, and feels great.  It's silky feeling, but does not provide a lot of moisture, so, if you lips are on the dryer side,  this is not going to replace your regular gloss.

This stuff is great for on the go, and I will be buying it again when mine runs out"
B00023IXUO:happy_for_men_smells_good!:a._cordell,B00023IXUO,HAPPY For Men By CLINIQUE cologne: Beauty: Clinique,beauty,0 of 1,5.0,Happy for Men smells good!,"January 9, 2007",A. Cordell,"Ohio, United States","Forget all those other so-called good colognes out there. Happy for Men is the best smelling one of them all! It may be expensive, but it is well worth it. Example: I sprayed down a shirt with it and send it home with my girlfriend at her request! She requested this because she wanted have something of mine that she could sleep with it while we are apart. That is how good it is! Enjoy"
"B00023IXUO:a_distinct_scent...:s._hebbron_""s_b_h.""",B00023IXUO,HAPPY For Men By CLINIQUE cologne: Beauty: Clinique,beauty,1 of 1,5.0,A distinct scent...,"August 4, 2006","S. Hebbron ""S B H.""",Leicester UK,"for me, Happy has a subtley orange undertone and evokes a sense of vibrancy and youth. As with the signature female clinique scents, you don't need much to cause a stir and it always leaves a lingering, subtle trail of sophistication"
"B000B9PSCK:worth_every_penny_-_your_hair_will_fell_like_silk_&_smell_great!:maria_bacarisa_""honest_opinionated_filipina""",B000B9PSCK,Kerastase Masquintense for Very Dry and Fine Hair - 16.7 oz 500 ml: Beauty,beauty,1 of 1,5.0,Worth every penny - your hair will fell like silk & smell great!,"December 7, 2005","Maria Bacarisa ""honest opinionated filipina""","Jacksonville, FL","I'm not kidding, it's worth every penny (though I must admit that I get it at a lower price from a secret supplier in Asia). After using this, you'll swear that you just got a hot oil/deep treatment done from a professional salon. 

I have chemically treated hair (relaxed, double process - colored & fine hair equals damaged hair), and this is the only conditioner that works for me. Another plus is, this is the only conditioner that elicits ""your hair smells sooooo good"" reaction from my boyfriend & daughter.

Surprisingly, even if it moisturizes my hair excellently, it still leaves it bouncy & with enough volume.

This lasts about 6 months if you use it once a week, so it's really not that expensive, especially if you substitute this for your regular deep conditioning treatment at the salon.

If you're still wary, try a smaller bottle"
"B0002260DC:luminous_green:rebecca_johnson_""the_rebecca_review,_finding_beauty_in_the_world_-_www.seasonedwithlove.com""",B0002260DC,Avobath Bath Bomb by LUSH: Beauty,beauty,2 of 2,5.0,Luminous Green,"February 1, 2007","Rebecca Johnson ""The Rebecca Review, finding beauty in the world - www.SeasonedwithLove.com""",Washington State,"The Avobath bath bomb turns water a lovely luminous pale green. Avocado, olive oil, lemongrass, bergamot, rosewood oil, gardenia extract makes this a skin calming, soothing, moisturizing dream. The ""green luster"" makes this bath especially beautiful and gives it a mermaid mood. I loved this one so much, I'm ordering two the next time. 

The scent is lemon/lime, but by the time you get in the tub, the floral scents are more prominent. You can add in some bubbles, but they don't seem to last very long - well, I was using a bath gel. 

So, you may want to find a bubble bar because the olive oil seems to make them disappear pretty fast. At least, that is my theory because I've noticed bath oil does the same thing. Avobath goes well with Whoosh products or the Happy Hippy Shower gel. If you are in the mood, you might want the amazing ""Godiva"" shampoo and conditioner 2 in 1 bar (has a magical quality - makes hair super shiny) or the ""I love Juicy"" shampoo and ""Veganese"" conditioner. The last two also have a citrus scent and are especially delicious. 

When I use Lush products, I'm in a good mood all week long. It is truly amazing how happy and content I am as long as I have some Lush products around. :)

~The Rebecca Review "
B0002260DC:an_uplifting_lemongrass_fizzer!:gensparkie,B0002260DC,Avobath Bath Bomb by LUSH: Beauty,beauty,7 of 7,5.0,An uplifting lemongrass fizzer!,"February 16, 2006",gensparkie,California,"This cheery green bomb releases the uplifting scent of lemongrass blended with some other elements that make it well-rounded and fruity - the reviewer who likened it to Froot Loops cereal wasn't too far off base! Add a sizzling lemony-herbal top note to Froot Loops and you have this bomb's scent.

Since lemongrass oil is good for uplifting the spirits, this is a great bomb for those tired or grumpy days we all have sometimes.

There is the mildest shimmer to it, that you really have to look for in the water itself, and it gives the lime-green water a lovely depth and sparkle. But it isn't glittery and you won't end up with anything you can see on your skin. It is more an in-bath pony trick!

This is a great bomb for cheering you up on a wintry day, and one I keep a small supply of and use often"
"B0002260DC:it's_not_easy_being_green,_unless.....:gail_cooke",B0002260DC,Avobath Bath Bomb by LUSH: Beauty,beauty,15 of 15,5.0,"IT'S NOT EASY BEING GREEN, UNLESS.....","December 13, 2005",Gail Cooke,"TX, USA","     As we've heard, it's not easy being green.  It's more than easy, it's delightful if you're an Avobath Bath Ballistic.  Infused with avocado (hence the name) and olive oil it moisturizes skin.

     The fragrance is fresh,  rather citrusy, thanks to lemongrass and rosewood.  Bath water is a lovely shade of green, rather like new spring grass.

      If there's glitter in it I didn't find any, which was as I wished.  It's suggested for morning - I'd relax with an Avobath any time of day"
"B0002260DC:sparkly_citrus:bunny_mcginley_""pink_fluffy_girly_girl""",B0002260DC,Avobath Bath Bomb by LUSH: Beauty,beauty,7 of 8,5.0,Sparkly citrus,"August 7, 2004","Bunny McGinley ""Pink Fluffy Girly Girl""","Key West, FL USA","I love the fresh scent of the Avobath, there's just nothing like it. It smells like springtime to me. I have yet to notice any glitter in an Avobath bath (and I've taken about 10) so if you're glitter shy, don't let that stop you from trying this one"
B0002260DC:avocado_bath_heaven:valerie,B0002260DC,Avobath Bath Bomb by LUSH: Beauty,beauty,3 of 3,5.0,Avocado Bath Heaven,"May 5, 2004",valerie,WA,"I like to eat avocados, I like avocado face masks, and now I can bathe in eau de avocado!  This bath bomb is possibly my favorite - very softening, great color (turns your tub into a nice green lagoon), and great lemony scent.  I didn't find the glitter to be very noticeable, so don't worry about that.  Stock up on this one"
"B0009RTOQK:heaven_full_of_beautiful_flowers:myra_g._williams_""muffins_mother""",B0009RTOQK,Kai Gift Set: Beauty,beauty,1 of 1,5.0,Heaven full of Beautiful Flowers,"December 22, 2006","Myra G. Williams ""muffins mother""","atlanta,ga"," Kai is like lying in a meadow in the warmth of the sun, with a gentle breeze, and the aroma of a million sweet flowers embracing you. Oh, how I love it"
"B00021BV1O:sweet!^_-:louisa_ifer_""black_ivy""",B00021BV1O,Sugar Cosmetics I Scream 4 Sugar Mini Lip Gloss Set: Beauty,beauty,1 of 1,4.0,Sweet!^_-,"March 13, 2006","Louisa Ifer ""Black Ivy""",Lestat's arms,"O.k,these glosses are just plain yummy!

Actually,they don't taste like lipglosses at all,which is a good thing.No one wants waxy or 
chemical flavored gloss that 
makes you want to throw up,right?

All the flavors are amazingly delicious.Each one tastes just like sweets.

The colors are sheer and radiant without looking cheap or tacky.

They go with any eyeshadow or blush color and make your lips sparkle.

I wish the  tubes were just a bit bigger and the glosses were less sticky.

Overall,nice glosses but a bit overpriced for such lil tubes"
"B00021BV1O:yum!:k._parsons_""k.p.""",B00021BV1O,Sugar Cosmetics I Scream 4 Sugar Mini Lip Gloss Set: Beauty,beauty,10 of 10,5.0,Yum!,"May 30, 2004","K. Parsons ""K.P.""",Vegas,"I am absolutely addicted to this lip gloss. I own over 300 different brands of gloss, and this is by far one of my favorites. It's a pretty good deal, at only $28 for so many colors. I like the small size because it easily fits into any evening bag or pocket. It's fun to layer the different colors as well, and there are an infinate amount of combonations between all of the different colors and flavors. They also taste amazing, each embodying a yummy taste exactly like sugar. It goes especially well with the Aquolina Pink Sugar fragrance, for a sugar-themed cosmetic experience"
B0007GHH8K:i_love_it:viktoria_sandridge,B0007GHH8K,Lancome Primordiale Optimum Eye 15ml/0.5oz: Beauty,beauty,,5.0,i love it,"April 25, 2007",Viktoria Sandridge,Colorado,"I bought this cream after I tried about a dozen other brands and I loved it. It a bit pricy but it worth every penny. I am 24, so I bought it to smooth out starting lines that i had and prevent new ones. It worked! Now I look like I am 20 again"
B000EGWL0M:burberry_london-_i'm_a_convert:shoshanna,B000EGWL0M,Burberry Burberry London: Beauty,beauty,1 of 1,5.0,Burberry London- I'm a Convert,"December 29, 2006",Shoshanna,OH United States,"Was using philosophy's various light scents, discovered this Burberry London sample in my last Sephora shipment. Went to Macy's and bought the set for under $77-lotion, shower gel and 3.3 oz fragrance. Fretted over price until I actually used the products-layering them. Recieved SO many compliments! Not ""an old lady's perfume""- not strong nor weak- it has an elegant floral fragrance. 
top notes: rose, clementine and honeysuckle.
heart notes: tiare flower, jasmine and peony.
dry down notes: sandalwood, veil of musk and patchouli. All my favorites"
B000EGWL0M:light_and_fabulous:young_banker,B000EGWL0M,Burberry Burberry London: Beauty,beauty,2 of 3,5.0,Light and Fabulous,"June 12, 2006",young banker,"Minneapolis, MN",One of the best perfumes I have tried in a long time... my boyfriend goes crazy over it
B0002260QY:amazing!:shannon_giel,B0002260QY,Reincarnate Solid Shampoo Bar by LUSH: Beauty,beauty,7 of 7,5.0,Amazing!,"January 22, 2006",Shannon Giel,Japan,"I've tried several shampoo bars and had finally given up hope that I could ever use them - they had always left my hair feeling gross and gummy - no matter how much I rinsed or tried vinegar/water mix rinses after (as was suggested).
But - this one had had some good reviews so I gave it a go. It was awesome! It lathered rather well, and rinsed out very easily. I used it in conjunction with the american cream conditioner - and my hair's very very silky and soft right now. (it had gotten very course over the period of a week with using avalon organics shampoo and conditioner)
I'm excited - now that I've finally found a shampoo bar that works, I can finally say goodbye to bulky shampoo bottles and same some space"
"B0002260QY:smells_/so/_good.:j._klumpp_""footnotegirl""",B0002260QY,Reincarnate Solid Shampoo Bar by LUSH: Beauty,beauty,11 of 11,4.0,Smells /so/ good.,"October 1, 2004","J. Klumpp ""Footnotegirl""","Eden Prairie, MN United States","Reincarnate can be a hard shampoo to get used to, especially if you're not already using LUSH products. It doesn't 'sud up' much, and feels a little bit muddy and grainy. Don't fret though! It will certainly clean your hair, and will also leave it smelling like wonderful spices (almost as good as ""Arabian Bright""). The highlights are not something that come with one or two washings, but with many many washings, and they are /very/ subtle but there. The only reason I don't give this product five stars is that it was not as conditioning as it states it is, and I needed to use another conditioning product with it"
B00021A71Y:so_soft:elizabeth_a._borst,B00021A71Y,Bliss Glamour Gloves: Beauty,beauty,12 of 12,5.0,So Soft,"February 7, 2005",Elizabeth A. Borst,Miami Beach,"I bought these with the also great socks and was completely pleased by the way they left my hands, hydrated and soft. After leaving them on for half an hour with the Glamour Gloves Gel my hands felt reborn. I couldn't get over how the moisturizers had penetrated. I've had these for a couple years and was almost sure they would stop working but they're still doing the job. I've recently seen less expensive gloves on the market and don't know how well they work but these are very high quality"
"B00021E34Q:awesome_sensual_fragrance:j._g._peterson_""dance_music_lover""",B00021E34Q,Comptoir Sud Pacifique Vanille Abricot: Beauty,beauty,,5.0,Awesome Sensual Fragrance,"May 30, 2005","J. G. Peterson ""Dance Music LOVER""","Raleigh, NC","I first caught a waft of this fragrance in a magazine as a tester. I fell in love with the sweet, sugary light smell of it and so did my husband. It's perfect for all seasons since it's light and it definitely makes people ask you what you're wearing. I've been told it smells everything from edible to kissably sweet. Now I want to try some of their other fragrances. If they are half as good as this, they win in my book"
"B000B7TKK8:awesome_stuff:a._hathaway_""no_more_dark_circles!""",B000B7TKK8,Hylexin (Serious Dark Circles?) .78oz: Beauty,beauty,3 of 4,5.0,Awesome stuff,"May 9, 2006","A. Hathaway ""No more dark circles!""",USA,"I have been using this product for about 3 months.  It is great!  Not only have I noticed a difference, but I get comments from people all the time about how refreshed I look.  I had a baby about 5 months ago and decided that I need to pamper myself a little.  I came across this product in January and was very cautious about purchasing another eye cream.  Nothing has worked in the past.  However, I decided to give it a try.  I noticed changes after a couple of weeks, but wasn't sure if it was just me wanting it to work or it actually working.  Well, now after 3 months, I can totally tell the difference.  I look so much better even without makeup.  I don't even need to put concealor under my eyes any more!!!  Plus, I receive so many great comments from people.

Thank you Hylexin.  Finally something that worked for me"
