unique_id,asin,product_name,product_type,helpful,rating,title,date,reviewer,reviewer_location,review_text
B000CDRB7U:finally!:j._provost,B000CDRB7U,Philosophy Hope In A Jar For Dry/Sensitive Skin 2oz: Beauty,beauty,3 of 3,5.0,FINALLY!,"February 8, 2006",J. Provost,"Portland, OR United States","I have suffered from rosacia for the past nine years. As I was fairly young to be starting through a change of life, I had no idea what was causing my complexion problems. Not understanding (or expecting)what was happening to my skin, I made many many mistakes during the first year or so, trying to remedy the symptoms with countless products formulated more for adult acne or aging tired skin, bad idea. If you have rosacea or very sensitive skin, you know that sometimes it seems that all you need do is touch your skin the wrong way and you break out, let alone slathering some chemically based, perfumed, or exfoliating (ground pits and the like) product on your face. This becomes especially discouraging when you are also beginning to see the normal signs of aging but sensitivities won't allow you to take advantage of some of the great treatments out there to nourish your skin and stay a step ahead of the wrinkles, not to mention feeling starved for the moisture which is the real key to younger, healthy looking skin. After awhile I was afraid to try anything else, so I just stopped. I washed my face gently and left it at that. Well it only got worse and I felt like a dried up prune. Enter Philosophy hope in a jar for dry sensitive skin. It's as if this product was made just for me. Now instead of people asking me ""what's wrong with your face?"" they ask, ""what type of skincare do you use?"" Since I've been using The Philosophy skin care line, I find I guite often feel comfortable going out without makeup, something I had rarely done since my twenties. Since sun protection is so important, Philosophy offers a product called, When hope is not enough with spf 20 for daytime which comes in a bottle, but I have found that my skin responds much better to the Hope in a jar-dry sensitive formula, then followed by Philosophy's seperate sunsreen called Shelter-spf 15. This is because ""Shelter"" does not contain vitamin C or peptides and has a slightly lower concentration of sunscreens, contrary to the spf-20 moisurizer combo. You may be able to get by with the combination product and save a few bucks, but the aforementioned ingredients in it do not agree with my sensitivities, especially the vitamin C. As for the much needed exfoliation dilemma, try philosophy's, Micro-delivery peel pads or their ""Peel kit"" both are soothing and non-abrasive. Hope this helps and enjoy your new skin!"
"B0009YYJDQ:sheer__indulgence!!!!:ezia_m._leach_""z""",B0009YYJDQ,Pre de provence Gift Box with nine 25g Assorted Soaps: Beauty,beauty,8 of 8,5.0,SHEER  INDULGENCE!!!!,"August 8, 2006","Ezia M. Leach ""Z""","madison, ct. usa","I LOVE everything about these sops!!!  They are luxurious and delicious at the same time......one thing I need to indulge in.
The scents last for days after you've used them.....my bathroom still smells like a mix of verbena and honey-almond!!!! Just scrumptious!!!!!!!!!!!!!!!! Not to mention how your skin smells and feels afterwards!
These are amazing soaps that EVERYONE should use.  I feel exquisite using them and the gift sets are a fabulous thing to give to friends or even aquaintences.  They are sure to think of how thoughtful you were to give it to them everytime they use this wonderful soap!!!!!! "
"B00021COT2:wonderful_lip_balm!:bookratt_""bookratt""",B00021COT2,Philosophy Kiss Me: Beauty,beauty,11 of 11,5.0,Wonderful Lip Balm!,"April 4, 2005","Bookratt ""bookratt""",,"With just a hint of sheer red color, this lip balm in a tube is one of the best I've tried. The smell is intoxicating, the feel divine. What's best to me: 1) the subtle shade of red color, sheer but sexy, moisturizing but not greasy or gloppy and 2) it lasts FOREVER. I have never before paid $10 for a tube of lip balm, but I will gladly do it again. For those that wonder who it looks good on: my opinion is everybody! I am a dark-brown haired, light skinned, brown-eyed girl, with no pink or rosy color to my natural dead-white skin color/coloring. I burn easily and freckle, too. My sister has brownish-auburn-hair, medium-toned beige skin color with hazel-brown eyes and it looks great on her, too. She tans easily. My niece is blondish-brown haired, has light brown eyes and fair skin with a bit of pink in it and tans easily. It looked great on her, too. 

Buy it and enjoy it"
"B00027OR0A:a_wake-up_call_for_your_eyes:john_whitcomb_""jwhit""",B00027OR0A,ZIRH RESTORE Herbal Eye Cream: Beauty,beauty,3 of 3,5.0,a wake-up call for your eyes,"September 27, 2005","John Whitcomb ""JWhit""","Knoxville, TN","someone turned me on to this eye cream and it's been like getting an extra hour of sleep a night ever since. The best trick? keep it in the FRIDGE. Apply after you shower - you can feel it ""tightening"" away"
B00068O74Q:amazing!:karen_curtis,B00068O74Q,philosophy amazing grace gift set (2 piece): Beauty,beauty,,5.0,AMAZING!,"March 15, 2007",Karen Curtis,"Rhinebeck, NY United States","Wonderfully light and clean scent!  Both men and women have asked me what I was wearing hours after I thought the scent was gone. It does not overpower when layering lotion and spray.  It's a beautiful fragrance, I love it"
B00021AUVG:sweet_smell:agie,B00021AUVG,Lolita Lempicka Lolita Lempicka: Beauty,beauty,,5.0,Sweet smell,"April 6, 2007",Agie,"Hoboken, NJ","This is one of my favorite perfumes.  I love anything vanilla and this has a great combination of it with violets, musk and iris.  It is a strong smell, so go easy on it. One spray lasts all day."
B00021AUVG:lovely_scent:c._sabin,B00021AUVG,Lolita Lempicka Lolita Lempicka: Beauty,beauty,,5.0,Lovely scent,"January 24, 2007",C. Sabin,,"I have had this for many years, lasts a long time and doesnt seem to get that old smell even after five years.  It is very unique and the scent has a 'rich quality' to it.  The scent seems to change as the day goes on, I really like it"
B00021AUVG:ethereal_and_sensual:iris,B00021AUVG,Lolita Lempicka Lolita Lempicka: Beauty,beauty,1 of 2,5.0,Ethereal and sensual,"January 2, 2007",Iris,,"This has been my everyday scent for the last six years. The predominent note is a sparkling anise, an anise that affects a cold, even metallic, chemic artifice. Swirling about this shivery base note are hints of moss, violet, and vanilla-like tonka, lending an aura of both forest and fantasy. 

Though this is a relatively popular scent, Lolita eschews convention. There are no white flowers, no rose, no peach, none of the banal and cloying sweetness that plagues so many scents. This perfume is instead sensual yet apart, not at all come-hither but insinuating and dark as a Grimm's tale. The tonka is sweet and powdery, gently seductive, while the more prominent anise intoxicates.

The bottle is stunning; I never throw out a spent one. "
"B00021AUVG:like_nothing_else!:emma_callahan_""product_junky!""",B00021AUVG,Lolita Lempicka Lolita Lempicka: Beauty,beauty,4 of 4,5.0,Like nothing else!,"March 27, 2006","Emma Callahan ""Product Junky!""","Boston, MA","This perfume isn't comparible to anything - finally a totally unique scent! It's sweet and sexy, and the scent changes with you. I'm addicted to it. So are the men! ;"
B00021E1IY:brilliant_mascara:dm_fan,B00021E1IY,Bourjois Pump Up The Volume Mascara: Beauty,beauty,2 of 2,5.0,Brilliant mascara,"March 15, 2006",Dm Fan,,"I used the same mascara for years, i came across bourjois pump up the volume on an internet site so i thought i'd give it a go, it really does pump up those lashes and it stays put for most of the day too, i use this mascara all the time now, i think its great"
"B000B7MCQW:smells_good_and_lasts.:rosie_""dominiangel2k""",B000B7MCQW,CURIOUS For Women By BRITNEY SPEARS eau de parfum: Beauty: Britney Spears,beauty,2 of 3,5.0,SMELLS GOOD AND LASTS.,"January 15, 2006","Rosie ""dominiangel2k""",ny,I got this as a gift last christmas and I loved it. The scent is very nice and actually lasts. I give britney credit for this one. I need to replace it already thats how much ive used it its almost gone. I recommend this one.
B0002DO1QY:the_best_ever!:brandi,B0002DO1QY,MAC Studio Fix Powder Plus Foundation NC30: Beauty,beauty,,5.0,The BEST ever!,"January 10, 2007",Brandi,"Vinita, Ok",I LOVE LOVE LOVE this product!  This powder/foundation has THE best coverage out there!  I don't like to wear liqued foundation because it makes my skin feel real oily.  This powder foundation is better than any out there
B000225ZVA:make_charming_little_gifts:l._taylor,B000225ZVA,Tisty Tosty Bath Bomb by LUSH: Beauty,beauty,1 of 1,5.0,Make charming little gifts,"April 18, 2007",L. Taylor,Philadelphia,I love to include one of these with gifts......people love them.....makes a bath really special.....little rosebuds floating in the water.....just charming
"B000225ZVA:calming_violet/rose_bath:rebecca_johnson_""the_rebecca_review,_finding_beauty_in_the_world_-_www.seasonedwithlove.com""",B000225ZVA,Tisty Tosty Bath Bomb by LUSH: Beauty,beauty,2 of 2,5.0,Calming Violet/Rose Bath,"January 23, 2007","Rebecca Johnson ""The Rebecca Review, finding beauty in the world - www.SeasonedwithLove.com""",Washington State,"Orris Root powder has a scent similar to violets although in this Tisty Tosty bath bomb, even with the addition of rose oil, it is not an overpowering fragrance. I think they could add double the rose oil, but you can add in rose and ylang ylang if you are in the mood. The Tisty Tosty heart-shaped bath bomb is perfect if you enjoy blending your own essential oils or prefer a mild/calming bathing experience. 

I'd suggest using this one for skin calming and also adding in a ""Romance In a Stone,"" ""Sex Bomb"" or ""Chelsea Garden"" bath bomb to add a little more romance to the bath. 

I did feel emotionally calm (rose balances the emotions) and my skin loved this bath bomb, but it was not as sensory as I'd hoped. Following this bath with the ""It's A Pleasure Treasure Massage Bar"" is fun, also heart-shaped. 

You may want to try the ""Violet"" soap with this bathing experience. The next time I try this, I might mix it with an ""Elixir"" bath melt and a bit of the ""Bathos"" bubble bar, also scented with violet. 

As far as this being a magic spell, you just never know who might call you when you use this bath. Probably right when you are in the bath. So, if you think this will work instantly, you might want to keep the phone by the tub. It was funny, but when I was in the bath, my husband was trying to call me and said he let the phone ring and ring. Did he really think I would leave the pleasure of a Lush bath to answer the phone? 

Personally, I think they should scent this bath bomb like the It's a Pleasure Treasure Massage Bar. It is blissfully delicious and almost seems edible - looks like white chocolate (it is mostly cocoa butter) and has a heady scent of orange blossom honey and neroli. 

~The Rebecca Review"
"B000225ZVA:good:j._whiston_""jhwhiston""",B000225ZVA,Tisty Tosty Bath Bomb by LUSH: Beauty,beauty,0 of 1,4.0,Good,"October 20, 2006","J. Whiston ""jhwhiston""","Chicago, IL United States","This smells good and the heart shape is cute. But, it lost it's scent when it dissolved which was dissipointing and the flowers turned the water darkish. I liked it but it's not one of my favorites."
B000225ZVA:isn't_it_romantic?:joanna_daneman,B000225ZVA,Tisty Tosty Bath Bomb by LUSH: Beauty,beauty,1 of 1,5.0,Isn't it romantic?,"September 14, 2006",Joanna Daneman,"Middletown, DE USA","If you love roses, this is a romantic bath luxury, with seven rose buds for your bathing delight. For a candlelit bath with romance, let it dissolve unencumbered. For scent but no mess, put it in a mesh bag first, because little flower bits will be all over the tub. At least it has no glitter. The scent is not particularly strong, but it is full of a natural rose scent that smells wonderful"
B000225ZVA:bath_time_rituals~:angela_white,B000225ZVA,Tisty Tosty Bath Bomb by LUSH: Beauty,beauty,6 of 7,5.0,Bath Time Rituals~,"October 22, 2005",Angela White,Connecticut,"I have been using Lush products for a few years now. First introduced to them when I was in Australia.
I always keep some in my linen closet as it gives a faint wonderful scent to all the sheets and pillowcases.

Try all of the bath bombs. I use the Tisty Tosty whenever I need an evening of self indulgence. Put the water on and watch the heart-shaped bomb fizzle and send hundreds of rose petals floating to the top of the tub.
Put some fluffy bath towels to warm on a rail.
Place some Dr Haushka's oil to heat by a radiator.
Pour a glass of champagne.
Surround the tub with lots of  tea lights.
Put on some Rahman music.
Get in and imagine a private Ganges.
When you get out its very eassy to scoop up the petals- take the pre-warmed towels and wrap yourself in one.

 By then the oils will be warm and pour in palm of hand and rub on body. 
I also like to put some  bath bombs in guest bedrooms with the towels- 
If you haven't tried the Karma soap do try it ......alone or with someone special.."
B000225ZVA:lovely_and_romantic:susie_q.,B000225ZVA,Tisty Tosty Bath Bomb by LUSH: Beauty,beauty,2 of 2,5.0,lovely and romantic,"January 25, 2005",Susie Q.,,"This is the one you give to someone you love. The wonderful rose scent is very light, not overpowering at all. And the pretty little dried rosebuds are so charming. I love lying in the tub with those rosebuds floating around me. It makes me feel like I'm lying in a beautiful garden"
"B00021AS9K:hugo_get_it!!!!!!!!!!!:brett_c._bowen_""bigtime""",B00021AS9K,Hugo Boss Hugo: Beauty,beauty,0 of 1,5.0,HUGO GET IT!!!!!!!!!!!,"July 13, 2006","Brett C. Bowen ""bigtime""","riverton, UT USA","Well for startes this is one of the best cologes out there.  The smell is chrisp and will last a long time.  It is a great cologne for any acasion.  I have many colognes and this one is on the top of my list, very masculine but girls love it!!!!"
B00062A3CC:absolutely_fabulous:holly_paige,B00062A3CC,Laura Mercier Metallic Creme Eye Colour: Beauty,beauty,3 of 3,5.0,Absolutely Fabulous,"March 7, 2005",Holly Paige,"NY, NY","I had read about these new creme eyeshadows in one of the magazines within the last few months. I decided to go to the counter at the Bloomingdale's near my house. The SA at the counter said she thought based on my coloring and eyes that the rose gold would be a good choice for me. I was looking for a shadow that could be good for daytime and also nighttime. I took home the rose gold and it was really really beautiful on. Not only that, but it is long-lasting and doesn't crease. I may have to invest in one or more of the other colors available. Definitely a worthwhile purchase and the tube will last you a long time."
B000BNZZNI:excellent_product!:renee_e._layman,B000BNZZNI,Olivella Virgin Olive Oil Liquid Face & Body Soap: Beauty,beauty,,5.0,excellent product!,"January 10, 2007",Renee E. Layman,california,I love this soap! It smells so fresh and my skin feels great after I wash with it! I am definetely ordering more of this soap
"B00021D10S:bless_this_product!_relief_finally!!:g._bhatty_""manni's_mommy""",B00021D10S,Mustela Stretch Marks Double Action: Beauty,beauty,7 of 7,5.0,Bless this product! Relief finally!!,"September 12, 2005","G. Bhatty ""Manni's Mommy""",,"This product is great! I had always been a non believer but in the eight month with my second pregnancy when I could not take the strecth marks, the itching the pain the red skin, I used it and it was like magic. Three days of use and I am a new person with soooo much better skin, getting better everyday"
B00021D10S:it_really_works!:bekka,B00021D10S,Mustela Stretch Marks Double Action: Beauty,beauty,12 of 12,5.0,It Really Works!,"July 1, 2005",Bekka,"San Francisco, CA","I am 5'11"" tall, and have stretchmarks everywhere from growing 8 inches in one year as an adolescent.  So I thought I'd get even more of them during my pregnancy and 40 lb. weight gain.  I bought the Mustela lotion as a ""might as well"" gift to myself, not really expecting anything.  I am thrilled to say that after using this cream every day on my breasts and belly during the last 6 weeks of my pregnancy, I didn't get ANY new stretchmarks anywhere.  I still can't believe it -- and I was looking closely for them just to be sure.  The lotion is quite rich, so a little goes a long way -- the tube lasted 8 weeks.  I'm completely sold on Mustela products, and use the super soft and fragrant baby wipes on my new little girl.  No diaper rash at all so far"
"B00021D10S:my_mom_had_a_lot_of_stretchmarks_and_i_didn't!__that's_proof_4_me!:hottwater_""hottwater""",B00021D10S,Mustela Stretch Marks Double Action: Beauty,beauty,6 of 6,4.0,My mom had a lot of stretchmarks and I DIDN'T!  That's proof 4 me!,"June 29, 2005","HottWater ""Hottwater""",S.F.  Bay Area,"I started using this cream during my 2nd month of pregnancy.  I think it's important to start building the elasticity of your skin early on, which could be the reason I had success with it.  While the cream is kindof expensive-- when you think about avoiding stretchmarks, no price is too high. I used about 4 tubes for the duration.  I expected to get stretchmarks because my mom had them with me, so I was happy to get anything less than hers.  Anyway, I didn't get any at all on my stomach until the last two weeks (my baby was 8lbs. 8oz.) and they are really small.  I put the cream on my breasts and abdomen every day after a shower, but because it was expensive I skipped my sides (love handle area) and did get stretchmarks there which were darker than the ones on my stomach. Since my stomach has gone down, the ones on my stomach are very light and will probably go away enough to satisfy my ego.  I highly recommend giving the Mustela cream a chance"
B000E467BI:seasonal_wear:amanda_swales,B000E467BI,JUST ME For Women By PARIS HILTON eau de parfum: Beauty: Paris Hilton,beauty,1 of 1,4.0,Seasonal wear,"July 2, 2006",Amanda Swales,United Kingdom,"I first tried this when my Mum bought a bottle during her holiday in November. The weather was cold, wet & dark at home. When I sprayed some on my wrists I wasn't impressed.

Come June & sunny, hot & bright days, I found myself trying `Just Me' in the shops & buying a bottle (which I'm quickly making my way through).

Lighter & easier to wear then `Paris Hilton', I'm using it all the time. Scent wise; the strongest note for me is the pink peppercorn - sharp & tangy. It contrasts nicely with the floral notes, so neither individual note overpowers me.

Overall `Just Me' can be worn anywhere during the day; work, shopping or lunch.
For evening and autumn/winter look elsewhere."
B000H6KXHM:great_customer_relations:edward_demetrak,B000H6KXHM,philosophy falling in love luxurious bubble bath: Beauty,beauty,0 of 1,5.0,Great Customer Relations,"March 8, 2007",Edward Demetrak,"Pontiac, MI USA",I experianced a small problem that was completly resolved to my satisfaction. What a great company to do buisness with
"B000A6KWWK:excellent_to_moisturize_your_eye_area_but_not_reducing_any_circle!:h._anh_""annie""",B000A6KWWK,Clinique All About Eyes: Beauty,beauty,,4.0,excellent to moisturize your eye area but not reducing any circle!,"April 19, 2007","H. Anh ""Annie""",NC,"I'm 18! Well you will think what does 18 have to do with this cream.

I don't have any wrinkle. My skin has been really good until I get into college. My eyes become really tired and I start to have a lot of dark circle plus puffiness.

After reading a recommendation from a fashion magazine, which says everybody at every age need an eye cream. Ok, fine, I will get one. I chose the one got the highest rate!

Overall quality, it is very good to moisturize my eye area. This means it is easier to apply foundation/concealer/eye makeup. But my puff is still here. I still have dark circle! No reducing! I know that I need to have a better schedule to have enough sleep but still, I expected higher on this product.

About the size, the small little teeny tiny one is good enough for you to use for months. Usually I will use it at night. When I have to apply concealer, I will apply another time."
"B000A6KWWK:ditch_the_smile_lines:silvia_bridger_""truth_about_caffeine.com""",B000A6KWWK,Clinique All About Eyes: Beauty,beauty,,5.0,Ditch the Smile Lines,"April 16, 2007","Silvia Bridger ""Truth About Caffeine.com""",SCR Books,"Don't be afraid to smile, and don't cover up those smile lines.  You can eliminate them with this amazing product from Clinique"
"B000FV69MW:cinnamon_buns..._mmmm...:martina_""retail_queen""",B000FV69MW,philosophy cinnamon buns flavored lip shine: Beauty,beauty,,4.0,Cinnamon buns... mmmm...,"February 11, 2007","Martina ""retail queen""","Tampa, FL","I received a tube of philosophy's cinnamon buns flavored lip gloss for Christmas (along with other philosophy products). I was super excited to try this because I've been told by numerous people that philosophy's products are spectacular. First, I must point out that there are sparkles in this lip gloss. Although they're very subtle on your lips, if you're the type of gal who hates sparkles and shimmer in your makeup, I'd stay away from this product. As for smell, it DOES smell like cinnamon buns. It certainly does not TASTE like it however (which is a good thing... I tend to lick off my lip gloss if it tastes good... this lip gloss does not taste good). It's very sticky and thick so you don't have to use too much. It also stays on your lips for a good amount of time. Would I suggest this product? If you're looking for a good-smelling, long lasting lip gloss, I'd definitely recommend this. However, if these two things don't matter to you I'd suggest you skip this ($10 for a tube of lip gloss isn't cheap after all) and go for a drugstore brand lip gloss"
B000MKMXJ4:the_most_wonderful_product_ever!!!!:c._griffith,B000MKMXJ4,ERA FACE Spray On Foundation: Beauty,beauty,2 of 2,5.0,The most wonderful product ever!!!!,"April 17, 2007",C. Griffith,"Anchorage, AK","I was pretty wary of buying this because of the price, but it really is worth it. The can has lasted me almost a year, and it's not even empty! It's wonderful! I have very oily, acne prone skin with rosacea, and this stuff makes me look like I have a flawless, beautiful complexion. And I'm not exaggerating. It feels like I'm not wearing makeup. I just can't say enough about it. This is the one thing that I couldn't live without. You need to try it!!!"
B000H77THI:the_first_scent_i_love:sydney_nelson,B000H77THI,philosophy amazing grace best sellers 4 piece collection: Beauty,beauty,1 of 1,5.0,The first scent I LOVE,"January 10, 2007",Sydney Nelson,"Saint Joseph, MO","I have been looking high and low for a fragrance that wasn't strong.  I have tried so many perfumes and body sprays it is ridiculous.  I have finally found the one I will use for more than a week.  I love it!  

The smell is so clean and simple.  The first day I wore it I had 3 seperate people tell me I smelled good.  I have NEVER had even one person tell me that, let alone 3.  I was amazed.  Also, I noticed that they told me I smelled good.  They didn't say your perfume smells good.  

I am not sure how to describe the smell.  It reminds me of that out-of-the-shower fresh smell that we wish we could have all day.  I will never use any other fragrances but Philosophy fragrances.  I plan on trying all their other wonderful scents as well"
B0006NF894:great_color_and_performance:rebecca_l._paskind,B0006NF894,Mirenesse Secret Weapon Mascara: Beauty,beauty,,4.0,Great color and performance,"March 11, 2007",Rebecca L. Paskind,"Longmont, CO","I have very sensitive skin and this product does not irritate by the end of the as other products have.  Also my coloring is very fair, red hair and blue eyes, even with brown/black mascara I always looked a little off-matched.  The brown in this line is a beautiful color and looks more natural than any I have ever used.  The ease of removal is the icing on the cake"
"B0006NF894:a_different_kind_of_mascara:doberquest_""pet_advocate_in_the_pnw""",B0006NF894,Mirenesse Secret Weapon Mascara: Beauty,beauty,1 of 1,5.0,A Different Kind of Mascara,"December 26, 2006","Doberquest ""Pet advocate In the PNW""","Sequim, WA USA","Most waterproof mascaras are designed to come off with an oil-based remover.  Stupid idea;   our skin has oil in it.  After a couple hours we end up with ""racoon"" eyes.""  DOH, who needs that?  Mirenesse mascara only comes off with soap AND water, in combination.  Better living through chemistry!  Since I happen to be one of those people with a little extra oil in their skin in adulthood, I especially appreciate this fact, plus they make it in Brown/black  I'm a redhead, and am so sick of   searching for something other than black-black mascara!  It is simply too dark if you are not a brunette or blonde.  I need something with some brown in it, and this mascara fits the bill, perfectly.  For those who find it too clumpy, well, learn how to apply mascara--tweens!  This mascara goes on best with one coat, so make your first application count.  You don't need a second coat.  It won't look good, so do one coat, period.  If you can't get it right the first time, you need some practice and a mirror with a higher magnification.  If you think you need more mascara than that, think again.  Unless you are walking Sunset"
B00092OYAG:so_great:,B00092OYAG,Calvin Klein Eternity Summer: Beauty,beauty,,5.0,So Great,"November 3, 2006",,,It is my first time to buy fagarance....The smell is so refreshing.... enhance my feminine~ and it do cheer me up~ i like it v.......much~~ and will use this fagarance in the rest of the life..........
