unique_id,asin,product_name,product_type,helpful,rating,title,date,reviewer,reviewer_location,review_text
"B0006B4BVC:great_product:_for_first_2_months_only!:carrie_in_tacoma,_wa",B0006B4BVC,"Kiddopotamus & Co Swaddleme® Adjustable Infant Wrap Microfleece Small, Yellow: Baby",baby,1 of 1,4.0,Great product: for first 2 months only!,"December 28, 2005","Carrie in Tacoma, WA",,"I loved having this easy-swaddleme wrap!  It was so much easier than getting a blanket and swaddling where it might come apart.  The velcro worked really well as it gave ""room to grow.""  Swaddling our daughter only lasted for about a month or two, she just totally outgrew this.  It was great while it lasted and it's a fantastic shower gift"
B00005BPK5:don't_give_up!:nomad_family,B00005BPK5,JJ Cole New Edition Premaxx Baby Carrier Red Orange: Baby,baby,2 of 2,5.0,Don't give up!,"September 11, 2006",nomad_family,,"I love this sling!  But I'd like to stress as other people have done that you have to practice with it to find what works for you.  It may be too big for your newborn.  I started using it when my son was 4 weeks, but he was a large baby.  

I've found the key is wear it high!  The instructions say the you and your baby will be more comfortable with baby at chest height.  It's true!  If you try to wear it with the baby hanging a little lower near your stomach it's going to hurt your back and shoulder and wear you out and he/she's going to squirm and be uncomfortable.  

I used it every day of my sons 3rd month when we were in hotels between moving.  Now I used it every time I grocery shop because as soon as he's in it he falls asleep, no matter the time of day.  If I try to push him through the whole store sitting in the cart in his carseat he'll start screaming but if I put him in my sling I won't hear a peep out of him the whole trip.

And you have to admit it's so cute and stylish!  Several people have stopped to ask me where I got it and I love directing them to Amazon! "
"B00005BPK5:a_lifesaver_for_us,_but_one_strong_reservation...:marie_stone",B00005BPK5,JJ Cole New Edition Premaxx Baby Carrier Red Orange: Baby,baby,14 of 14,4.0,"A lifesaver for us, but one strong reservation...","March 24, 2006",Marie Stone,Northern California,"First, I must say that this sling was an absolute LIFESAVER when my (somewhat colicky) son was a newborn.  No matter how fretful his mewling, when we swaddled him and placed him in this sling, he would fall asleep. Because he otherwise rarely slept in those early weeks, he spent a good deal of time in it.  Three aspects of the design are great: 1. The bottom is padded so you can lay baby on a hard surface and use sling as a changing pad; 2. The sides are high and have drawstrings that allow the sling to be opened up almost flat; 3. It grows with your baby--my tiny baby hated the front-type Bjorn carriers, but loved this and still likes it.  One aspect of the design is, to me, dreadful--the shoulder strap! It should be wider and padded.  I tried repositioning it every which way and no matter what I did, the strap dug into my shoulder.  In the end I just put a thick mitten under the strap on my shoulder.  Good use for a mitten that's lost it's mate, but I would rather have a better strap"
B00005BPK5:wonderful:jessica_s.,B00005BPK5,JJ Cole New Edition Premaxx Baby Carrier Red Orange: Baby,baby,5 of 5,5.0,wonderful,"December 9, 2005",jessica s.,,I am 5'5 with a large bust size and had a 7lbs 7 oz baby.  It took a couple times to find the most comfortable way for me to wear it but after that I have had no problems with it.  My son will get in there and go straight to sleep and I have never felt he was going to suffocate.  The pockets are a major plus and now since it is cold and flu time of the year I like it because all the touchy and coughing people can not touch him with any germs they may have since he is completly covered up.  He is still laying down in it so I don't know how it will work with him sitting up.   
B0000E2DIE:kidsafe_banister_guard_-_a_great_solution_for_us:jc,B0000E2DIE,15' Kidsafe Banister Guard: Baby,baby,2 of 2,5.0,Kidsafe Banister Guard - a great solution for us,"August 29, 2006",JC,"Oakland, CA","We have a very irregular iron banister with different sized spaces and bars.  This was the perfect solution because you can place the tie-down holes wherever you need to and the ties it comes with are really long, so they will fit around large or small bars.  We had to use a drill to make some holes further from the edge of the plastic because the hole punch it comes with wouldn't reach, but it was very easy to do.  I also like this product because it doesn't take away from the look of the banister or obscure vision"
"B0000E2DIE:great_safety_product:michele_beach_""msbeach""",B0000E2DIE,15' Kidsafe Banister Guard: Baby,baby,1 of 1,5.0,Great Safety Product,"August 12, 2005","Michele Beach ""msbeach""","Denver, CO","We were very pleased with how easy this was to install, despite the fact that we have rather unusual banisters.  Ours is actually a half wall and half banister, but the plastic was just flexible enough to bend over the ledge.  The directions weren't great, but it was fairly self explanatory.  We feel much more comfortable letting our one-year old play upstairs in the loft now"
B0000E2DIE:i_love_it:,B0000E2DIE,15' Kidsafe Banister Guard: Baby,baby,20 of 20,5.0,I love it,"April 29, 2004",,,This product has really worked well for me!  My daughter used to love pushing her Barbie dolls in between the posts on our loft to see them crash onto the table below!  Now we don't have to worry about this anymore.  She can't reach her arm through these posts anymore either.  I use window cleaner to clean the smudge
B000BFKHCU:bargain_booster_seat:s._weatherly,B000BFKHCU,Safety 1st Grow with Me Portable Booster Seat: Baby,baby,,5.0,Bargain Booster Seat,"March 8, 2007",S. Weatherly,Indianapolis,"I had checked out booster seats on the Internet and in stores and this was by far the least expensive.  It's a bargain -- well made and easy to use.  My grandkids seem to like it better than a high chair.  The seat arrived minus the safety straps used to attach it to a chair.  When I wrote customer service about the problem, they sent a whole new booster seat"
B000BFKHCU:good_travel_companion:judith_miller,B000BFKHCU,Safety 1st Grow with Me Portable Booster Seat: Baby,baby,2 of 2,5.0,Good Travel Companion,"January 19, 2007",Judith Miller,"Stockport, England (UK","Excellent value for money. Our 8-month old enthusiastically used this seat as a travelling feeding chair as well as a floor chair and we wouldn't have managed the holidays without it!  This seat is strong and stable, yet easily assembled/dis-assembled.  It folded flat to fit in our suitcase and has become a valuable travel companion with our young family.  We purchased this on 19 Dec and it was delivered prior to Christmas - well done Amazon"
"B0000669AJ:happy_shopper:princess_""happy_shopper""",B0000669AJ,Mini Orchestra: Baby,baby,1 of 1,5.0,happy shopper,"January 5, 2007","PRINCESS ""Happy Shopper""","New York, USA","Seeing a 1 year old little girl playing these instruments is hysterical!  My niece absolutely loved them.  She had such an easy time handling them because they are her size, which is unusual.  All other instrument toys are so much larger and it's hard for them to hold on to them while trying to play them! The smiles and giggles are worth everything"
B0000669AJ:great_toy!:lynnie,B0000669AJ,Mini Orchestra: Baby,baby,11 of 11,5.0,great toy!,"August 3, 2004",Lynnie,Martha's Vineyard,"My eight-month-old daughter really loves these instruments! We bought them when she was about four months old, but when she picked them up she'd often clunk her head with them when she tried to wave them around.  I brought them back out when she was six months old and had a lot more arm control.  Now she really goes wild with them, especially the bells!"
B0000669AJ:brings_lots_of_smiles:lcl,B0000669AJ,Mini Orchestra: Baby,baby,7 of 7,5.0,brings lots of smiles,"July 30, 2004",lcl,,My daughter plays with this toy at Grandma's house. Theses &quot;instruments&quot; are usually the first toys she pulls out to play with. The bright colors and different noises definitely interest her. She loves to shake them and make noise. They are great little toys to throw in the diaper bag when you're on the go
B0000669AJ:great_for_children_of_all_ages!:,B0000669AJ,Mini Orchestra: Baby,baby,5 of 5,5.0,great for children of all ages!,"July 5, 2004",,,"My daughter received these instruments as a gift last Christmas and took to them right away.  She was six months old at the time and they were easy for her to hold and shake to create the sounds.  We have lots of toys that make noise but these were some of her favorites, just the right colors, size and shape with just the right sounds!  She has turned one now and still gets lots of enjoyment from these toys.  They really encourage musical creativity in even the youngest of children"
"B000BU4CHQ:great_twin_umbrella_stroller_for_travel!:latifa_rothrock_""2bdboysandmytwins""",B000BU4CHQ,Kolcraft Wrangler Twin Sport All-Weather: Baby,baby,,5.0,Great twin umbrella stroller for travel!,"March 17, 2007","Latifa Rothrock ""2bdboysandmytwins""","Golden, Co United States","Perfect for traveling or packing in the motorhome.  For the price, it has alot to offer.  It has bags on both sides of the stroller for snacks, moveable sunshades to really keep the sun out of their eyes.  It's not the plushest stroller, however, for travel or quick errands it's perfect for us"
"B000BU4CHQ:wrangler_stroller:a._welch_""weary_shopper""",B000BU4CHQ,Kolcraft Wrangler Twin Sport All-Weather: Baby,baby,0 of 2,5.0,Wrangler Stroller,"January 18, 2007","A. Welch ""Weary Shopper""",Midwest,I gave this stroller as a gift. So far there have been no problems.
B000BU4CHQ:great_umbrella_stroller:r._franklin,B000BU4CHQ,Kolcraft Wrangler Twin Sport All-Weather: Baby,baby,4 of 5,5.0,Great umbrella stroller,"December 9, 2006",R. Franklin,"Salt Lake City, UT","I was looking for a double stroller that I could get in and out of my sedan easily. I didn't like the tandems because they not only take up tons of space, but they are also very heavy. This stroller is light, and I can take it in and out of my trunk with one hand. Plus, because my kids are heavy enough to push, I am not pushing an extra 25+ pounds in stroller. Because it is side-by-side, it can be a tight fit going through some doors, but I have never been unable to get through a door.  

My husband thinks that some of the parts are cheap and look like they can break easily, but with 6 months of lots of use, we have had no problems. The sun visors have bent at an angle when storing, but I can still use them fine and I like that they rotate down, so you can angle them with the sun. I am so glad that I bought this rather than a larger, more expensive, heavier tandem stroller"
B000GKWA66:sleep_sheep_is_the_best!:r._mubeen,B000GKWA66,Cloud b Sleep Sheep - Four Soothing Sounds From Nature: Baby,baby,,5.0,Sleep Sheep is the Best!,"March 24, 2007",R. Mubeen,,"My daughter loves to cuddle with the soft sleep sheep and I love this product because it puts her right to sleep with the calm soothing sounds! I love the rain! even I fall asleep listening to it.
I had originally bought the sleep sheep because my neighbors upstairs have squeaky floors and they are walking around late at night and wake up my daughter. So I block out their squeaky noises by turning up the sleep sheep noise blocker :)  I am happy and so is my daughter who is sleeping like a baby!!!!!!!"
B000GKWA66:sleep_sheep:d._gorham,B000GKWA66,Cloud b Sleep Sheep - Four Soothing Sounds From Nature: Baby,baby,0 of 1,5.0,sleep sheep,"March 13, 2007",D. Gorham,,"I think this product is fantastic, the adjustable volume works well and the sounds are very soothing. The timer is also a nice feature. This is a great present for anyone in your life that is having a baby. The sheep is cute and  surprisingly cuddly in spite of the digital box in it's tummy."
B000GKWA66:adorable.:bb_mke,B000GKWA66,Cloud b Sleep Sheep - Four Soothing Sounds From Nature: Baby,baby,,4.0,Adorable.,"February 28, 2007",BB_MKE,"Milwaukee, WI, USA","A good friend has this for her daughter. I fell in love with it when I saw it. Completely adorable and works like a charm. 

Bought one as a baby gift as well, but I'd kinda like one myself..."
B000CSCIRS:babybjorn_is_the_best:jerome_w._breslin,B000CSCIRS,BABYBJÖRN Safe Step - Green: Baby,baby,,5.0,babybjorn is the best,"April 9, 2007",Jerome W. Breslin,"Rancho Cordova, CA",It's very safe because of the non-slip rubber. Our son uses it when he brushes his teeth or when he goes to the potty. Nice color too. Highly recommended!!
B000JOQMO0:come_scented_too:cam,B000JOQMO0,Soothie Pacifier 0-3 Months 2 Pack: Baby,baby,0 of 1,4.0,Come Scented Too,"January 7, 2007",cam,"Lexington, KY USA","Other parents told us about these, specifically the vanilla scented ones.

Baby #1 was bottle fed and took to an Advent pacifier right away.  We used the scented soothies whenever we couldn't get a bottle ready fast enough for her likes.  Not sure if it was the shape of the soothie pacifier or the scent, but she always calmed down wihle we'd finish getting the bottle ready.

Baby #2 was also bottle fed, but did not take to any pacifier right away.  We tried these regular soothies as well as the vanilla ones and the Advent ones too.  She eventually took to the Advent.

It really is up to each baby what they will like.  But these are definately worth trying.  In addition to the regular and vanilla ones, there are also various sizes, including preemie, pacifiers attached to small stuffed, plush animals that are easier for babies to find and put into their mouth...and also easier for Mom & Dad to in the back of the car, the darkened bedroom, etc"
B000056J2D:cooshie_booster:april_l._neal,B000056J2D,Baby Smart Cooshie Booster Seat - Blue: Baby,baby,3 of 4,5.0,Cooshie Booster,"March 20, 2006",April L. Neal,,"The booster works great, does not slip on a chair, and is easy for my 2 year old to move around on her own.  I highly recommend this product"
B0008JIM7Q:finally_pink!:monica_krauth,B0008JIM7Q,SnugRide2 Infant Car Seat - Lindsey: Baby,baby,,5.0,Finally PINK!,"June 30, 2006",Monica Krauth,Utah,"Finally a cute pink car seat.  It is duralble and easy to lift around. I wish they had this cute color for my other daughter.  Ihave not deliverd yet so I don't know how she will fit in it,  But I also have the stroller and everyone who sees the matching combo tells me how cute it is.  There is not any other pink combo out there.  I just hope it works as well as it shows off"
"B0008JIM7Q:not_perfect,_but_pretty_close!:stephanie",B0008JIM7Q,SnugRide2 Infant Car Seat - Lindsey: Baby,baby,3 of 3,4.0,"Not perfect, but pretty close!","May 31, 2006",Stephanie,"Colorado, USA","I am not wild about the colors and design, but it's not too bad.  The fabric is easy to clean (machine-washable) and the sun canopy is GREAT! With an adapter, I can easily snap it into my Bugaboo stroller for ultimate convenience.  It's just a great car seat, although I wish there were cuter girly designs. "
"B000AMECSE:i_couldnt_ask_for_abetter_stroller:loretta_wall_""loretta""",B000AMECSE,Kolcraft Jeep Liberty Limited Urban Terrain Stroller: Baby,baby,,5.0,i couldnt ask for abetter stroller,"April 26, 2007","Loretta Wall ""Loretta""",texas,"we bought this when my daughter was newborn, and we were surprised that her peg perego car seat fit into it so well, now shes a year and a half and even if were at home she climbs into it and plays with the steering wheel. She has always loved it, in the snow and on the ground and on picnics, its great, a lot better than plastic wheels, the front tire swivels and also has a little switch so that it becomes more like a jogging stroller and the front wheel doesnt move. Weve really liked it so far, except for the harness not fitting a very tiny baby, its GREAT. the only thing is now i have 2 kids and i cant use it cause i need a double on"
B000AMECSE:excellent_replacement_for_my_old_graco!:r._bullock,B000AMECSE,Kolcraft Jeep Liberty Limited Urban Terrain Stroller: Baby,baby,1 of 1,5.0,Excellent replacement for my old Graco!,"March 10, 2007",R. Bullock,"Phila, PA","We received a Graco travel system from our registry, and got some good use out of it. However, we are in a big city, and the stroller just couldn't stand up to the bad sidewalks and roads. Not to mention it was so rickety I'm positive we could be heard a mile away. I broke down and ordered the Jeep Liberty Limited Urban Terrain jogger, and I LOVE it. 

1. It was simple to assemble.
2. It is easier on my hands and wrists to steer.
3. The air-filled tires provide a much smoother ride for my daughter.
4. The toy steering wheel? She FREAKS out over it, in a good way. She *beeped* her horn about 30 consecutive times in the grocery store. Since that distracted her from pulling boxes off the shelves, I am ultra pleased. 
5. The price is wonderful.

We don't use the Music On The Move feature, so I can't really comment on it. I fill the tires right before we leave the house every time, and it's not hard to do, so I have no complaints there. 

It is a bulky item, so transporting it and carrying it is a bit tricky. However, the pros all outweigh the cons for me. I am extremely pleased with it"
"B000056HLX:son_figured_it_out_at_age_27_months:skrapbooker_""skrapbooker""",B000056HLX,Cozy Crib Tent: Baby,baby,4 of 4,5.0,Son figured it out at age 27 months,"July 5, 2006","skrapbooker ""skrapbooker""",,"The crib tent is great!  We originally got it to keep our cats out, but then it served the purpose of keeping our son in too.  :)  UNTIL...  at 27 months, he learned how to reach through the crib slats & undo the zipper!!!!  :-o  So now we're in a hurry to get a toddler bed this week!  

It is hard to change sheets with the crib tent, but just get the ""ultimate crib sheet"" & it's a piece of cake!  :)  Also, it is *possible* to put down the side rail of the crib, but this does lower the tent too & can bop you in the head.  ;"
B0007OD91G:awesome_chair:rkbuffy,B0007OD91G,Chicco Polly Highchair - Pacifica: Baby,baby,2 of 2,5.0,Awesome chair,"November 11, 2006",rkbuffy,Washington,"This is such a versatile chair - love the way you can fold it down compactly, yet it's incredibly sturdy with the wide base when being used.
The tray stores on the back legs when not in use - nice touch.
For the reviewer who complained that the ""thing that separates the legs"" is attached to the tray - you can use the harness system to keep your child in place while removing the tray...  Plus it's easy to remove the top part of the tray and leave the base to keep the child secure while you clean up.
My 6 month old loves to sit with us at the table with some toys on the tray - terrific product to keep babies happy and parents sane during mealtime"
B000CEBHBU:cute_book:a._auz,B000CEBHBU,Lamaze This Little Piggy: Baby,baby,,4.0,Cute book,"January 14, 2007",A. Auz,Houston,"Book looks exactly like the picture and the colors are vivid and nice.  The only thing is the puppet holes are really small meant for small fingers, so you as a parent might not be able to show your child how to use the puppet feature. I like this line of books better the the Bright starts and Baby Einstein books"
B00005C2IT:on_the_go:elayna's_mommy,B00005C2IT,Sassy E-Z Grip Feeding Bowl: Baby,baby,,5.0,On the go,"August 31, 2006",Elayna's Mommy,Michigan,"Surprisingly, its been hard to find a two compartment dish for baby food.  This one works great and comes with a nice spoon that fits on top of the dish for storage.  It is a great size and lightweight for taking in the diaper bag for eating out too"
B0002CRS9M:a_definite_for_babies!:andrew's_mom,B0002CRS9M,Floppy Seat Cover Original with Whimsical Pattern: Baby,baby,,5.0,A definite for babies!,"January 9, 2007",Andrew's Mom,"Asbury, NJ","I think everyone should one of these, especially for when their kids are young.   My 8mo. old tries to eat everything.   I don't want him chewing on the handlebars of grocery cars (yuck!) and it makes it much cleaner when you put him in a highchair at restaurants (which are sometimes disgusting).   The best part it fits over extra large shopping carts at club stores, like [...], unlike other types"
"B0002CRS9M:i_love_this_product:s._stropas_""stropas""",B0002CRS9M,Floppy Seat Cover Original with Whimsical Pattern: Baby,baby,2 of 2,5.0,I love this product,"July 8, 2006","S. Stropas ""Stropas""",Pennsylvania,"I didnt know these things exsisted with my first child, now that I found them I use it constantly! This floppy seat is much better then others you can get for a little cheaper, but in the long run this is the best for your money! I have washed it at least half a dozen times, and its washes great! I also am so glad to have one seat the works for the cart as well as the highchair. THe other products I saw you had to buy one for each item. It was almost double the cost.
It does take a few minutes to get it hooked up, but its worth it for the quiet and GERM free shopping experience, and my son is so ccomfy in it! I have had lots of people ask me where we got it.
I love the added extras of having a cup holder pocket and some places to hook up some toys.
It is very plush and made of great fabric, it is not cheap in anyway.
THis is one item I dont intend to live without, I also think this is a great shower gift for anyone expecting!
I cant say enough about this product"
B0002CRS9M:i_love_it!:mom,B0002CRS9M,Floppy Seat Cover Original with Whimsical Pattern: Baby,baby,5 of 5,5.0,I love it!,"May 25, 2006",Mom,Pennsylvania,The Floppy Seat is a great item... No more worrying about baby's hands and mouth touching filthy shopping carts and restaurant highchairs.  I recommend this to all new moms and give it an A++
B0002CRS9M:definate_must-have:i_love_being_an_at-home_mom!,B0002CRS9M,Floppy Seat Cover Original with Whimsical Pattern: Baby,baby,4 of 5,5.0,Definate Must-have,"May 24, 2006",I Love being an at-home Mom!,"Pac NW, USA","I cannot go shopping without my floppy seat!  I don't know what I am going to do when my infant outgrows either the front pack or car seat as my toddler rides with the floppy.  I reccommend this to everyone who comments on it, to purchase for themselves or as a gift.  I have seen another seat with a large pillow in front for kids to sleep on, or as one mom with a little girl who has siezures could use as protection, but I can't remember where (babycenter.com, $60?). As other reviewers mentioned, I also used mine for the restaurants too, when my toddler was too small to fit comfortably in the seats (not to mention the gunk in the chairs!).  Buy this product - you won't be dissapointed"
"B0002CRS9M:the_floppy_rules!:christine_mcgee_""t.j.'s_mommy""",B0002CRS9M,Floppy Seat Cover Original with Whimsical Pattern: Baby,baby,4 of 4,5.0,The Floppy Rules!,"May 22, 2006","Christine McGee ""T.J.'s Mommy""","Monterey, CA United States","We bought our Floppy Seat when our baby boy was about 6 months old.  Even though he was still a little ""floppy"" himself when it came to sitting up, the Floppy Seat supported him. He's now 18 months old, and it's still going strong!  Although, now he wears ""real"" shoes, and the leg openings tend to get caught on then. It took a little practice to get the hang of the threading the belt through the cart, but now it's SO fast!  

We also use it EVERY time we go out to eat.  As a matter of fact, the one (and ONLY) time we forgot to bring it along, our son started to choke while sitting in a restaurant highchair.  The belt buckle on the old restaurant chair became stuck, and would NOT open, after multiple attempts!  We were forced to turn the whole chair sideways in order to proceed to clear his airway. He was fine, but we were all shaken up! If we'd had our (familiar) floppy Seat cover, we would have been able to help our son a few moments faster. Every second counts!"
B000CSCIG4:potty:jennifer_s._koscinski,B000CSCIG4,BABYBJÖRN Potty Chair - Yellow: Baby,baby,,5.0,potty,"April 4, 2007",Jennifer S. Koscinski,,I am very happy with this potty.  It has a high guard which works well for a little boy. 
"B000CSCIG4:very_simple,_stylish:reddevil",B000CSCIG4,BABYBJÖRN Potty Chair - Yellow: Baby,baby,,5.0,"Very simple, stylish","March 24, 2007",RedDevil,"Seattle, WA","My son is not actually anywhere close to understanding the concept of this, but my impression is that it is VERY simple to clean up (which I LOVE the idea of).  It seems comfy, he sits in it often and plays with it sometimes :"
"B00094JP44:awesome!:j._penninger_""txparents""",B00094JP44,Kissaluvs Fitted Diaper: Size 1 (13-28 lbs): Baby,baby,6 of 6,5.0,Awesome!,"May 28, 2006","J. Penninger ""TXparents""",Texas,Kissaluvs are the best! They keep baby dry while being incredibly breathable.  Baby's skin doesn't get red like it does with disposable diapers.  Also great for keeping in those wonderful breastmilk poops.
