unique_id,asin,product_name,product_type,helpful,rating,title,date,reviewer,reviewer_location,review_text
"B0001WAOA8:satisfied:dante_v._de_jesus_""amazondj""",B0001WAOA8,Tan 2 StageSeat Saver: Baby,baby,12 of 12,4.0,Satisfied,"May 8, 2005","Dante V. de Jesus ""amazonDJ""","Montgomery, AL United States","This seatsaver is one of the few wide enough and tall enough for SUVs.  In contrast to one of the other reviews (and I am NOT affiliated with the seat manufacturer), this seat does the job adequately, and one should not post a poor rating without researching the specs, measurements, fit, etc., IMHO.  There is no &quot;universal&quot; seat saver or, for that matter, car seat, that will fit every car.  This one manages to catch most of the itty-bitty things that kids manage to somehow accumulate and is sturdy enough for the car seat not to make indentations on the actual seat, and hence, serves its purpose well"
B0009OLSY4:nice_toddler_step:l._mazzolini,B0009OLSY4,BABYBJÖRN Safe Step - White: Baby,baby,1 of 1,4.0,Nice toddler step,"March 5, 2007",L. Mazzolini,"Willoughby, OH USA",I like this because it is a nice construction.  I bought the white and it blends in nicely.  I just wish it was a little higher.  We have a newer construction home and the bathroom counters are high so it is still too low for her to wash hands by herself for now. 
B0009OLSY4:works_great_but_a_bit_pricey..:minh_do,B0009OLSY4,BABYBJÖRN Safe Step - White: Baby,baby,,4.0,Works great but a bit pricey..,"January 5, 2007",Minh Do,USA,My 3 yr. old son use it everyday to brush his teeth and comb his hair.  He doesn't tip over and fall anymore like he did on the other step chair.  The babybjorn is a bit expensive.  I found a similar chair at Ikea for a fraction of the cost. 
B0009OLSY4:gotta_get_one!:c._pintner,B0009OLSY4,BABYBJÖRN Safe Step - White: Baby,baby,1 of 1,5.0,Gotta Get One!,"March 7, 2006",C. Pintner,"Fairfield, CA","If you're going to get the Baby Bjorn potty chair, you've got to get a matching stool!  I love how the stool has a rubbery-grip top to prevent slipping.  My son also uses the stool to read his books on while sitting in his matching potty chair.  You've gotta get one now"
B0009OLSY4:great_step_stays_in_place:schoenfelder,B0009OLSY4,BABYBJÖRN Safe Step - White: Baby,baby,1 of 1,4.0,great step stays in place,"March 2, 2006",Schoenfelder,"Austin, TX United States","I really like how this step was designed to stay in place.  We have a cheaper plastic stool in another bathroom that tends to scoot too easily as our son climbs up on it.  This one stays put!  The only reason this stool didn't get 5 stars from me is because of the textured top.  It is a little difficult to clean.  Since this is a potty step stool, it has gotten some messes on it that I wish would have been easier to get rid of"
"B000BNQC58:actually_works:music_guy_""music_guy""",B000BNQC58,Cloud b Twilight Turtle - Constellation Night Light: Baby,baby,,5.0,actually works,"April 14, 2007","music guy ""Music guy""",,"I bought this thinking it was a gimic. Worse case was my daughter would get a night light on her bed. Turns out this actually works. Her bedroom is filled with stars. She uses it every night and I use it to check on her. It is still using the original batteries, 30+ days. The amber color does not work so good but her walls are pink. On white it might work better. Get it for something diffrent that works"
B000BNQC58:nice_product:b._chi,B000BNQC58,Cloud b Twilight Turtle - Constellation Night Light: Baby,baby,,4.0,Nice product,"April 10, 2007",B. Chi,,"This is a great light - shines stars all over the room.  Constellations aren't quite right, but they're close.  The different color options are great.  For the price, it's a great deal"
"B000BXHPEU:tricky_at_first,_but_overall_very_good.:j._means",B000BXHPEU,PRIMO Folding Potty with Handles (White granite color): Baby,baby,8 of 8,4.0,"Tricky at first, but overall very good.","July 14, 2006",J. Means,"Sterling, VA USA","I've had this seat for some time and I saw all of the negative reviews. It took a bit to figure out the quirks, but once I did, it was fine. The seat has to go on the very front of the public toilet, not the back or in the middle like mine at home. You have to make sure that it is on securely with the lip in the front against the front of the seat. Otherwise it will fold, which is probably what happened to the other reviewer. It will slid off as you come off if you're not careful. My five year old uses it by herself and I use it with my 2 year old. It is so compact that I can stick it in my purse (I carry in in a zippy bag) and very easy to clean. There aren't too many of this type of product out there, but for me, it works just fine"
"B0009T2CB2:great_product.:carolyn_brown_""lulu""",B0009T2CB2,Fisher-Price Sounds 'N Lights Monitor: Baby,baby,1 of 4,4.0,Great Product.,"January 18, 2007","Carolyn Brown ""lulu""",NYC,My sister has a small one bedroon apt and this product was perfect
B00078RVT8:best_bathtub_by_far!:first_time_mom,B00078RVT8,PRIMO EuroBath (Pearl Mint Green): Baby,baby,1 of 1,5.0,Best Bathtub By Far!,"December 5, 2006",First Time Mom,"Redding, CA","After using a smaller plastic tub and a blow up tub, this one is the best!  I only wish I would've just bought this one to begin with.  My little guy is 6 months old, 24 pounds but can't sit up yet.  He still uses the side that lays him down in the water, and he loves it!  Don't waste your money on other tubs, this one is the best.  This one will grow with your child while saving water too"
B0000W3TX8:i_love_this_pack!!:erynn_b.,B0000W3TX8,Evenflo Snugli® Cross Terrain Carrier Silver/Charcoal: Baby,baby,1 of 1,5.0,I love this pack!!,"April 5, 2007",Erynn B.,Washington state,"I ordered this pack after my friend's baby shower, she received this as a gift and I was amazed at how nice it was.  It fit both her and her husband very well, so I ordered one to carry our 7 month old daughter in.  WE love it.  It is easily adjustable and fits my husband and myself great.  Our daughter squeals in delight whenever she is in it, it has made our walks more enjoyable, I have free hands to hold our dogs' leashes and she likes being up to see everything.  I only have one complaint and that is the pocket on the belt is almost impossible to access when wearing the pack, but it is so minute of a complaint I still give it 5 stars.  Oh yeah the price is amazing for the pack you get, I cannot wait to go on a day hike.  I had been pricing other packs and they were close to $200, this was$90 w/ free shipping, a huge price break, plus I got it in about 3 days, thanks Amazon"
B0000W3TX8:great_baby_backpack:e._martinez,B0000W3TX8,Evenflo Snugli® Cross Terrain Carrier Silver/Charcoal: Baby,baby,,5.0,GREAT baby backpack,"April 2, 2007",E. Martinez,"Denver, CO","I bought this backpack after reading several of the other reviews and I am glad I did! I did some shopping around at local stores and all of the other backpacks I found were either MUCH more expensive or were the same price but had fewer features.  
My 7 month old daughter loves this backpack.  In addition, we don't need the diaper bag because it has so many pockets. I did not have any trouble putting on the sun visor and the backpack is very easy to store and use.  I originally bought this backpack to take abroad in place of a stroller but I can see that it is going to be handy in places like the zoo and grocery shopping as well. I don't know how it would do for serious campers, but for every day use it has been GREAT. "
B0000W3TX8:excellent_carrier:s._mcdonald,B0000W3TX8,Evenflo Snugli® Cross Terrain Carrier Silver/Charcoal: Baby,baby,1 of 1,5.0,Excellent Carrier,"January 22, 2007",S. McDonald,Texas,"I bought this carrier for a recent trip my family took and I am so glad I had it!  I used it for my 8 month old to carry her around instead of using a stroller.  There are many pockets which have plenty of room to store all your needed items and the stand works well to set down on the ground when not wearing it.  My daughter seemed to be quite comfortable in it and at one point even fell asleep.  She loved being able to see everything around her at our level.  I am 5'3"" and my husband is 6'1"" and we both wore it comfortably.  I would recommend this item to anyone needing something smaller than a stroller"
"B0000W3TX8:this_is_the_right_carrier:adrienne_reisinger_""happy_mom""",B0000W3TX8,Evenflo Snugli® Cross Terrain Carrier Silver/Charcoal: Baby,baby,1 of 1,5.0,This is the right carrier,"January 8, 2007","Adrienne Reisinger ""happy mom""","Rancho Mirage, CA","AWESOME, AWESOME, AWESOME! My hubby is an enginner and extremely picky about quality, design, and function about products and he loves this carrier. I liked the price and my son loves to be at the same level as everyone else. He tolerates being in this more than his stroller. This was my first choice based on all the feedback. Thanks"
B0006512K6:very_happy_with_these_sheets:a._m._mann,B0006512K6,Mini White Co-Sleeper Sheet: Baby,baby,8 of 8,4.0,Very happy with these sheets,"February 7, 2006",A. M. Mann,"Hoopeston, IL USA","I bought these sheets online since I couldn't find any in the local Babies R' Us store and did so with hesitation.  But when I received them I couldn't be happier with them.  The best thing about these sheets, besides that they fit perfectly, is the velcro strips on the bottom of the sheets to insure they stay snug"
B00007L5WU:wonderful!:grass_tiger,B00007L5WU,Microfleece SleepSack &#150; Blue &#40;L&#41;: Baby,baby,11 of 11,5.0,Wonderful!,"January 17, 2006",Grass Tiger,"Wadsworth, IL United States","These are wonderful! My baby was getting uncomfortable being swaddled at about three months, so we decided to make the switch to sleep sacks. We were worried that with her arms free that she might have a hard time falling and/or staying asleep. This was true at first so we started by only putting her in these during the daytime - in a light cotton one. After about a week she was not waking early from her naps anymore and after two weeks we tried her in it at night - and she slept straight through the night (as she did when she was swaddled). So the transition was painless and she seemed a much happier baby to be able to reach her hands and move her arms.

While I didn't notice shrinkage I did notice that the zipper does bunch up a bit, but this hasn't been a problem. Sometimes my daughter sucks on it if it gets close to her mouth, but she has to reach for it - it doesn't cover her face at all or trap air that she could rebreathe. 

I didn't like that these don't have sleeves so I tried Carter's sleep sacks and found the sleeves to be too short and hard to get on my daughter. Those sacks only come in one size which my daughter has already outgrown at four months (14 lbs, 24 inches). She has also outgrown the small size sleep sack, but the medium size fits her perfectly with some room to grow.

I didn't want to use fleece at first since it is polyester. I wanted to use cotton. But we've found that she sleeps longer and seems to prefer he heavier fabric of the fleece one.

Also, we only bought these in blue even though we have a girl because the color is calming to our easily overstimulated baby. 

We've washed these many times and they look just as good and hold together just as well as they did originally. 

We've also found you can put your baby into the next larger size without it being so big that they can get their arms out or that it bunches up around their face. So after everything we've tried we've loved these sleep sacks from day one"
"B00007L5WU:a_definite_must!:sahm_""sahm""",B00007L5WU,Microfleece SleepSack &#150; Blue &#40;L&#41;: Baby,baby,4 of 4,5.0,a definite must!,"February 26, 2005","SAHM ""SAHM""",,"my baby is now 5 months old, and we've been using the Halo sleep sac since she started moving around more.  I was always worried with the regular blanket because more than a few times she would wake up crying because she had kicked her regular blanket onto her face!  Now, I never worry that she will soffocate or that she will be cold in the middle of the night.  This product really gives me peace of mind and I'll be sure to give this to any new parent friends"
"B000B7CJKQ:my_wife_is_very_happy:david_c._morphis_""dave""",B000B7CJKQ,Basic Comfort Main Squeeze: Baby,baby,,5.0,My wife is Very happy,"March 23, 2007","David C. Morphis ""DAVE""","Ontario, CA United States","This particular pillow is wonderful because it is not cumbersome or too large to manage yet does everything my wife needs it to do.  I hardly know this pillow is in bed with us, and when I do notice it I can't help but to think of how nice and soft it is.  A great thing about the main squeeze is it is so versatile.  The pillow can be twisted and bent into any desired position.  This is a great product and I highly recommend it to all who are looking for something that will support all legs, pregnant belly, and face and hands.  One nice thing I forgot to mention is because it is sleek my wife has no problem turning with it when she feels the need to be on her other side. "
B00065H55W:good_product:twinstersgrama,B00065H55W,Medela New Pump In Style Original Breast Pump: Baby,baby,2 of 2,4.0,Good product,"March 18, 2007",twinstersgrama,Ohio,"My daughter recently had her second child, and spends alot of time breastfeeding. This product allows her to pump at her convenience. She can have others hold and feed the baby while she spends some time with her other child. The product works very well. She said it takes a little bit of experimenting and adjusting to get it set to work best for her, but it is an excellent product. She previously had a less expensive product by another manufacturer, and heard how good the Medela brand was from a friend. This brand is a pleasure to work with after using the less productive, noisier pump she had before. We would highly recommend this product, and the product is well worth the price paid"
B00065H55W:definitely_worth_the_money:heid_embley,B00065H55W,Medela New Pump In Style Original Breast Pump: Baby,baby,3 of 4,5.0,Definitely worth the money,"January 9, 2007",Heid Embley,Alaska,It's expensive but worth it. It's nice to take to work because it looks professional (many people didn't even know what it was) and it comes with a cooler so I didn't have to put my milk in the fridge next to everyone's lunch. A friend also bought one around the same time and says she got it much cheaper on eBay for a brand new one.
B00065H55W:a_must_for_breastfeeding_moms!:s._sagona,B00065H55W,Medela New Pump In Style Original Breast Pump: Baby,baby,4 of 4,5.0,A must for breastfeeding moms!,"November 28, 2006",S. Sagona,Louisiana,"I LOVE this pump!

If you're going to breastfeed, you NEED this pump.  It's expensive, but worth the investment.  I pump at least 10 times a week and it's just so much easier than the manual pump I tried."
B00065H55W:great_pump!!!_watch_for_different_size_flanges.:san_jose_mom,B00065H55W,Medela New Pump In Style Original Breast Pump: Baby,baby,20 of 20,5.0,Great pump!!! Watch for different size flanges.,"September 18, 2006",San Jose Mom,"San Jose, CA United States","I got this pump as a hand-me-down from my friend. It worked great even after many years... I eventually purchased the Pump In Style Advanced Limited Edition where the pump can be separated from the bag. It takes up less desk space (no extra space required for the bag). Also, it's more portable if all you need is the pump. I pump all over the house (study, bedroom, living room while watching TV with my husband).

Just a note to some people having problems getting milk out with the Medelas... It may not be the pump itself but the size of the flanges. Every woman's breast and nipples are different sizes. Initially, I was using the standard 24mm flanges (suction cup things that go over your breasts). It was painful to pump and my milk would not come out even though I was engorged with plenty of milk. It would take me 2 hours just to get 2 oz of milk! I went to see a lactation consultant who suggested I try the next size up flanges (27mm). She got me one to try and it made a world of difference. I could immediately pump 2oz in under 5 mins. Now, I pump daily to stock up and can get 4 oz from both breasts in under 10 mins (estimate since I don't really time it cause it's so fast).

I am now planning to pump to donate my milk to a milk bank. This pump made a world of difference.  I think Medela makes flanges in 3 different sizes. The standard 24mm that comes with all their pumps, the 27mm and a 30mm."
"B000CBUQSS:so_much_better_than_potty_chairs!:jaclyn_russell_""jaclyn_rich_(russell_is_my_maiden_name)""",B000CBUQSS,Flip N Flush Potty Seat: Baby,baby,,5.0,So much better than potty chairs!,"April 5, 2007","Jaclyn Russell ""Jaclyn Rich (Russell is my maiden name)""",Indiana,"This is so much better than any potty chair, and it is never in the way! Very easy to put on and my daughter loves it! She ahs been potty trained for a year but my nephew who is just now potty training loves it also!!"
B000CBUQSS:great_seat!:sunny_in_so._cal.,B000CBUQSS,Flip N Flush Potty Seat: Baby,baby,1 of 1,5.0,Great seat!,"October 20, 2006",Sunny in So. Cal.,So. Cal.,This potty seat is the only toilet training item I have bought. I highly recomend it! My daughter thinks she is a big girl on the big potty. You need a step stool for them to get up on their own. I like that the seat is sturdy enough to withstand a 30 lb. 3 ft. 2 yro. climbing up & situating her self with out my help because ultimatly that is the goal & this product I feel helps get to that goal.
"B0009RG8WS:warm_sleepsack:sam_""yogahead""",B0009RG8WS,JJ Cole Urban Bundleme Ice: Baby,baby,,5.0,warm sleepsack,"March 23, 2007","sam ""yogahead""","san francisco, ca","This sleepsack keeps our little bundle warm & toasty on those cold san francisco nights.  it is really easy to use & to move from the carset to the stroller.  i do wish it zipped up just a little higher on the sides, but it's the best thing around we've seen. "
B0009RG8WS:toasty_is_right:star_michele,B0009RG8WS,JJ Cole Urban Bundleme Ice: Baby,baby,1 of 1,5.0,Toasty is right,"March 5, 2007",Star Michele,Central Oregon,"This fit very easily into my daughter's Graco infant car seat.  As the other reviewers said, it is very convenient and keeps my daughter nice and warm.  Wind has not seemed to be a problem, but then I only carry her between the car and my destination in it.  I would recommend this to a friend"
B0009RG8WS:we_love_it:k_crichton,B0009RG8WS,JJ Cole Urban Bundleme Ice: Baby,baby,1 of 1,5.0,We love it,"January 3, 2007",K Crichton,"Chicago, IL","Our baby was born in early October and we put the Bundleme on her carrier immediately.  We live in Chicago and have had warm weather (75 degrees) and cold weather (10 below) since then.  We love this cover.  The top easily zips off for those rare warm days or if we are strolling though the mall. It also has kept her very warm and toasty on cold windy days. The day when it was 10 below freezing, she was zipped up in the cover with only a winter hat on and your typical outfit.  I was concerned for her warmth, but when we unzipped her she was as toasty warm as could be.  We have not had to buy a winter jacket.  It has also kept her dry through a couple of rain storms. 
I have gotten numerous compliments on this cover (almost every time we take her out) and it still looks like new, even though many things have gotten spilled on it.  I would highly recommend this product"
B0000AY9XY:love_these_bottles!:mdub,B0000AY9XY,Avent Newborn Starter Set: Baby,baby,1 of 1,5.0,Love these bottles!,"January 30, 2007",MDub,,"I love how wide they are.  This makes them much easier to clean and to handle.  Since they are shorter I can fit them on short shelves in my fridge when I use the stopper caps on them.  I can also fit them in my milk cooler in my breast pump because they are short.  My baby is able to hold them with ease since they are wider than other bottles.  Her arms don't have to stretch as far.  

I haven't had any real problems with these bottles.  I was weary to use them after a friend complained about the leaking problem.  I went ahead with them because my sisters said they didn't have any problems with them.  They have leaked twice but only because I didn't screw the lid on all the way because my hands were wet.  Any bottle will leak if you don't screw the lid on sufficiently.  I have used plenty of other brands that has worse leaking issues when I watched my twin cousins.  We tried three different brands and weren't ever really happy with any of them"
"B0009QYT3E:very_cute_baby_seat,_but_not_a_rocker.:k._scott",B0009QYT3E,Kids II Baby Einstein Discovering Water Rocker Seat: Baby,baby,,4.0,"Very cute baby seat, but not a rocker.","January 14, 2007",K. Scott,,"I wouldn't call this a ""rocker seat"" The kick-stand on it makes it look like a rocker, if you put the stand down..the legs almost touch the floor. You can make it move a little if you have wood floors, but not enough to call it a rocker. If you have a very mellow baby, this chair is perfect. My baby likes to sit and stare at the toys. But if you need any type of movement for your baby to stay calm, I wouldn't recommend this chair.

The music/sounds on it is very nice, not annoying at all. I don't use the vibration on it yet, until my baby can itch his cheeks if needed. The only reason I say 4 stars and not 5 is because it is falsely advertised as a ""rocker"", other than that, it is very cute, and my baby enjoys it alot!"
"B0009QYT3E:get_over_the_price_and_just_buy_it_-_it's_worth_every_penny:l._gentile_""lgentile8""",B0009QYT3E,Kids II Baby Einstein Discovering Water Rocker Seat: Baby,baby,1 of 1,5.0,Get over the price and just buy it - It's worth every penny,"December 22, 2006","L. Gentile ""lgentile8""",Whitmore Lake MI,I wish I would have bought this bouncer when I first found it.  My son was heavier and quickly outgrew his other bouncer. This one holds up to 40 pounds.  I didn't buy it right away as it was a bit pricey for me.  So I tried to get it on ebay but was always outbid at the last minute. Then I realized that if those people could get $35+; then I could too when I was done with it. So I finally ordered it when my son was 6 months old and 19 pounds.  He loves it. I love it.  It's made very well. If I had bought it when I first found it I would have gotten 4 more months of use out of it. So don't hesitate. You won't be sorry. 
"B000BMBU7O:overall_fantastic,_one_big_con_and_a_few_small_ones:a._thompson",B000BMBU7O,Baby Trend Baby Trend Flex Loc Infant Car Seat - Chatham: Baby,baby,,4.0,"Overall fantastic, one big con and a few small ones","April 9, 2007",A. Thompson,"Salt Lake City, Utah","I have had two kids use my Evenflo carseat.  I HATED it. It was like they never even tried it out to see how well its features worked.  I finally got so sick of it when my 2nd child was 4 months old that I ordered a Babytrend Flexloc.  At first I was seduced by the high safety ratings, but even after that Consumer Reports article was rescinded, I still liked a lot of the features.

Pros:
-very comfy seat, good padding 
-the canopy is twice as long as my Evenflo so it can cover baby almost completely
- the canopy stays in place; it doesn't fall forward or backward behind the seat
- the tightening mechanism under the baby's feet is easy to reach and VERY easy to adjust to make the straps tighter or looser depending on what baby is wearing
- the harness mechanism is very easy to adjust (the shoulder strap height). My Evenflo had to be rethreaded every few months and even my mechanically inclined husband said it was horrible.  The Flexloc is just a dial on the back that you turn--it's a breeze.
- The seat can be transfered between cars without the base.  It can be strapped directly to the car by using a seat belt on the car seat or by using the LATCH system if your car has it.
- the triangular handle has a nice grip and is easy to hold in any position
- this carseat is lighter than my Evenflo
- The cloth is very wipeable, not as absorbant of spills and stains as my Evenflo


Cons:
I found a few minor cons that definitely would not deter me from buying this carseat, and one that might (depending on how I can resolve it once I contact Babytrend).
- The release button to take the seat off its base is at the toes under the seat.  It's a little harder to reach than the ones behind the head if the carseat is backward facing.
- As others have said, the buttons to move the handle are a bit stiff, but not horribly so.  I was prepared for them to be way worse.
- The handle is thinner and doesn't FEEL as sturdy as my Evenflo when carrying baby around, but it hasn't had any problems
-This is the one BIG one that I have to check with Babytrend on:  Twice when I have turned a corner sharply, the carseat has tipped to a 45 degree angle!  I have tightened down the seatbelt as much as I could, putting my full weight on it and using the seatbelt retracting mechanism.  But maybe I'm still not doing it right.  The base is narrower than my Evenflo's was, so maybe that's why?  So I need to contact Babytrend and see if they have any suggestions.  Until then, I guess I'll take the corners slower!

Overall, I have felt like this seat was a MAJOR improvement over my Evenflo and even over the Graco Snugrides I checked out at the store.  It was intelligently designed to be easy to use and adjust as baby grows. I would recommend it for sure.  Just make sure you strap it in tightly or use the LATCH system if you have it"
