unique_id,asin,product_name,product_type,helpful,rating,title,date,reviewer,reviewer_location,review_text
B0009VRRTM:worth_every_penny!:katrina_vojacsek,B0009VRRTM,JJ Cole Urban Bundleme Wasabi: Baby,baby,6 of 6,5.0,Worth every penny!,"March 30, 2006",Katrina Vojacsek,"Newark, DE United States","I also own the Bundle me w/fluffy heavy winter liner & we could not have lived without it! I was excited to see this trendy,light-weight, weather resistant version for spring. I'll admit I would not have purchased this had it not been on the wrong shelf at $39.99. My $59.99 dismay soon evaporated-it is so sleek and functional!  No more struggling with bulky snowsuits, jackets and sweaters (which never seem to fit baby anyway)  Easily unzips so as not to overheat.  LOVE the little pocket for binky.  Velcro back openings make it easy to switch to stroller (No need to buy two!)   
 "
"B0009VRRTM:love_it,_but_some_problems_with_newest_peg_perego.:lucky_dog",B0009VRRTM,JJ Cole Urban Bundleme Wasabi: Baby,baby,6 of 6,4.0,"Love it, but some problems with newest Peg Perego.","March 5, 2006",Lucky Dog,"Salt Lake City, UT United States","I love this item.  It really works well in February winter weather.  I bought 4 snowsuits and I haven't used one for our newborn because snowsuits are tedious.  I am able to put her in her car seat, put a blanket inside and put a hat on her.  Forget the suits and mittens.  I cover her with the cover and she sleeps in the dark and warmth soundly.  Also, it prevents people from touching her all of the time because they can't see her when I cover her up.  The only problem is that this item didn't fit well with the newest Peg Perego infant car seats.  I made it work, but it doesn't fit perfectly.  It worked with the old Peg Perego car seat, but not the newest one.  I loved this item so much that I've made it work, though.  It isn't perfect, but it works.  It actually is so much better than Peg Perego's cover, which came with the car seat.  This cover has made my life pretty easy.  I found it easy to put on the Peg Perego.  I love the color.  It zips up easily.  It is soft.  Isabella seems to like to snuggle in it.  It is comfy for her.  Be aware, though, I live in Salt Lake City, UT.  Our winters are mild. If you have colder winters, you may want to add a snowsuit.  Still, it is worth the money!  I am glad I bought it."
"B000G82HWU:love_it_already!:shannon_daly_""alexis'_mom""",B000G82HWU,JJ Cole Esssentials Travel Pods-Chocolate/Pink: Baby,baby,,5.0,Love it already!,"August 23, 2006","Shannon Daly ""Alexis' mom""",,I just received my travel set today and I already love it! The bottle pod is more than big enough for the biggest bottle I have. The pacifier pod holds my daughters pacifier perfectly and the diapers and wipes pod is just too perfect for quick trips to the store or a friends house. I highly recommend it
"B000GEA1IG:great_dog_mattress:t._baysden_""terbay""",B000GEA1IG,"DaVinci 6"" Deluxe Baby Crib Mattress: Baby",baby,4 of 11,5.0,Great dog mattress,"January 4, 2007","T. Baysden ""terbay""","Bethel, OH United States","Well, I'm sure this is probably a novel use for this product, but we bought this for our great dane to sleep on.  He's giant and old and needed more support that the traditional dog bed, but orthopedic giant dog beds STARTED at over $200.  We got the idea to try a baby crib mattress, and ordered it.  Very soon thereafter I arrived home from work and was puzzled to find no dog blocking my way into the door waiting for a head pat; it seemed the mattress had arrived and he was simply immovable.  He loves it.  

It is well crafted and everything the ad said.  Our use is quite unconventional but it works well and we could highly recommnend this for anybody with a large dog"
B000AOEWP0:great_high_chair:wonderland,B000AOEWP0,Peg Perego Prima Pappa Multiposition Highchair &#45; Tan Marble: Baby,baby,1 of 2,4.0,great high chair,"July 6, 2006",Wonderland,Illinois,"We haven't had any problems cleaning this chair--occasionally we need to use the crevice tool on the vacuum, but that is simple enough.  Most of the time, we simple take a wet paper towel or wet wipe and run it around the seat sides.  (We'd do that with any high chair.) The tray doesn't fit in our dishwasher, but that too has been easy to clean in the sink.  

We love the neutral and plain color of the oatmeal vinyl.  Our daughter is very happy in her chair.  She is only 16 months, but very big for her age she has no problems fitting in this seat at all.  

Our only complaint is that we have to push the tray release handle in when we put the tray on in order to lock it into place or else our daughter can push the tray almost out.  that may be a defect on ours rather than a design flaw--we just live with it since it isn't that big a deal. "
"B000AOEWP0:superb_quality:r._porter_""az_mom""",B000AOEWP0,Peg Perego Prima Pappa Multiposition Highchair &#45; Tan Marble: Baby,baby,1 of 3,5.0,Superb Quality,"June 22, 2006","R. Porter ""AZ Mom""","Cave Creek, AZ","This is the BMW of all highchairs.  It's super-sturdy and the Italian leather seat is easy to care for.  Ignore the reviews about being a ""pain to clean.""  You need to clean EVERY highchair- nooks, crannies, and all. "
"B000B5HELW:great_looking,_functional_bag:c.e.c.",B000B5HELW,Combi Urban Sling Diaper Bag Black: Baby,baby,,5.0,"Great looking, functional bag","April 26, 2007",C.E.C.,"California, USA","This diaper bag is a great urban carrier for baby items and can easily pass off as a regular messenger bag for every day use. 

*	It's functional and has multiple organizers, including a place for your cell phone, keys, and a zippered insulated compartment for baby's bottle or a toddler's drink.

*	For parents, there are two inside pockets with zippers that are perfect for wallets and other small items. The interior has easy stash pockets for storing diapers, wipes, and other baby essentials. 

*	Overall, it's a stylish looking bag that moms or dads could use. The design is trendy without having an appearance that will become easily outdated.

*	After nearly two years of daily use, it's still in good condition and shows little signs of wear. 

*	It's also a very convenient on-the-go type bag that stays put when you're out and about"
B000B5HELW:diaper_bag_for_dads_too:harry_hood,B000B5HELW,Combi Urban Sling Diaper Bag Black: Baby,baby,2 of 2,5.0,Diaper Bag for dads too,"February 11, 2007",Harry Hood,"All Over, USA","It was nice of my ""ninth month wife"" to agree upon a diaper bag that I wasn't too embarrassed to carry. Now that the baby's here, I've found it to be functional as well as comfortable; it easily holds enough clothes, diapers and stuff, and doesn't feel like you're carrying an elephant. No complaints at all, it's a great bag"
"B000JVPR7G:great_gift_idea:danielle_nabozny_""dani""",B000JVPR7G,Twilight Turtle by Cloud B - Constellation Night Light & Lullaby Favorites CD: Baby,baby,,5.0,Great gift idea,"January 9, 2007","Danielle Nabozny ""Dani""",CA,"Unfortunately - the baby I bought this for already had one! But I got to see it in action, and listen to the parents rave about it! It is really neat - almsot to the point I wish I had kept it for myself!!"
"B0007OD8SU:don't_know_how_we_did_without_it!:lorna_doone_""sleepy2002""",B0007OD8SU,"Day & Night Handheld Color Video Monitor 1.8"" Screen: Baby",baby,,5.0,Don't know how we did without it!,"March 14, 2007","Lorna Doone ""Sleepy2002""","Maine, USA","We have had this monitor for about 7 months now and we love it! The peace of mind in being able to see that your little one is okay is priceless. I used to have to run up and down the stairs constantly, and I do not miss that. I can cook dinner or watch a TV show in a relaxed state without worry. It has always worked well, and it something happened to this one we would replace it immediately. The picture is clear, the sound is excellent. You do have to keep charging it if you do not keep it plugged in, but the cords are all generous in length.
We would go nuts without it"
B0007OD8SU:works_better_than_expected:k._harjo,B0007OD8SU,"Day & Night Handheld Color Video Monitor 1.8"" Screen: Baby",baby,,4.0,works better than expected,"March 8, 2007",K. harjo,,I just got this item for my two story house.  I was able to see the crib from the upstairs nursery throughout my house and even outside. The monitor is not in color so that is misleading but the picture looks grea
"B0007OD8SU:we_love_love_love_this_monitor!!:alissa_n._jordan_""new_mom""",B0007OD8SU,"Day & Night Handheld Color Video Monitor 1.8"" Screen: Baby",baby,,5.0,We love love love this monitor!!,"February 22, 2007","Alissa N. Jordan ""New Mom""","Dallas, Tx","It works fantastically for the purposes we purchased it!!  Sometimes there is a little interference, but if you just move the monitor (sometimes moving it even just a couple of inches to the left or right will make a difference) it will work great!  We have had no problems whatsoever and we would definitely buy this monitor again!!  The night vision works great, even in our son's dark room.  The color is great as long as there is sufficient light. "
"B0007OD8SU:must_have:sholly_""shololy""",B0007OD8SU,"Day & Night Handheld Color Video Monitor 1.8"" Screen: Baby",baby,,5.0,must have,"January 29, 2007","sholly ""shololy""",new york,this item is worth more than the cost...it is a most have at home with a new born baby.....expecially 1st time parent like me.....I can get to do other things once my baby is asleep...and i can even hear my baby's heart beat when am somewhere else in the house.....worth more than trhe cos
B0007OD8SU:for_peace_of_mind:elda_munguia,B0007OD8SU,"Day & Night Handheld Color Video Monitor 1.8"" Screen: Baby",baby,1 of 1,5.0,For Peace of Mind,"November 14, 2006",Elda Munguia,"Nuevo Leon, Mexico","My baby had very bad reflux and pediatrician told us not to move her to her room, my fear was that she would get use to sleep in our bedroom and moving her became a nightmare. When reflux got better at month 4 We finally got to move her and for us this monitor became a very useful tool, it has rechargeable batteries, image and sound are clear enough, night vision works perfect, monitor is not bulky at all (no color at all though), and we managed to tie camera to the crib's headboard and worked great for us."
B000BVKPQ2:perfect_entertainment_for_active_babies!:vermilion27,B000BVKPQ2,Kolcraft Sesame Beginnings Walker: Baby,baby,3 of 4,4.0,Perfect entertainment for active babies!,"April 21, 2006",Vermilion27,,"I have a 6 month old who absoutely loves this walker.  We started using this when he was only 4 months old and being the wiggly, active baby he is, he loved being able to push himself around. Now, along with his ""walking"", he loves to push the buttons to hear the music and see the lights.  Along with that, he likes to pull and pet the plush toys on the side while ""chatting"" with them.  This is a great walker; just always remember to keep an eye on baby at all times! I highly recommend this for those babies who love to move around on their own.  It also provides mom and dad with about 25+ minutes of catch-up-with-to-do-list time!!"
"B000BVKPQ2:great_walker!:d._edwards_""mom_of_one_daughter""",B000BVKPQ2,Kolcraft Sesame Beginnings Walker: Baby,baby,4 of 5,4.0,Great Walker!,"February 28, 2006","D. Edwards ""mom of one daughter""","Baltimore, Maryland","I purchased the Sesame Beginnings Walker and my daughter loves it. There is a mirror in the middle of the toy bar and she loves to look at herself. It also has big bird and cookie monster figures on each end and she loves to play with them. This walker makes noise and lights up.

There isn't any paint on her walker and I don't know what the other writer was referring to but this walker is very safe and enjoyable for my daughter"
B0006BAJK4:great_solution_for_messy_eaters:amy_s._pederson,B0006BAJK4,TinyDiner® Portable Placemat Blue Hey Diddle Diddle design: Baby,baby,,5.0,great solution for messy eaters,"November 9, 2006",Amy S. Pederson,,"This mat works great kids can't throw it on the floor, it catches food, I love it!!"
B0006BAJK4:my_new_favorite_baby_gift:lisa_bennett,B0006BAJK4,TinyDiner® Portable Placemat Blue Hey Diddle Diddle design: Baby,baby,3 of 3,5.0,My New Favorite Baby Gift,"December 13, 2005",Lisa Bennett,"Moultrie, GA United States","I bought this for my second son who is a year old.  I love it.  It's compact and fits easily in the diaper bag.  After he eats, I take it to the restroom and it rinses right off.  I've started using it at home too because the little tray in the front catches food really well (and saves my floors!).  I recommend anyone who hates to see their child rub their food all over the germy table buy this!!"
B00019S7RS:i_love_it!!!:,B00019S7RS,Dex Products Ultimate Baby Organizer: Baby,baby,,4.0,I love it!!!,"September 5, 2004",,,"I was really nervous about this product after reading the reviews, but once I put the organizer up it was great. I use the top four slots for thing like mittens and cotton balls and the next two for wipes and larger lotion and bath items. The bottom is really good for several diapers. I love it!!!"
B000BD6M1M:why_aren't_all_bibs_like_this?:b._heilesen,B000BD6M1M,BABYBJ&#214;RN Soft Bib &#45; Red: Baby,baby,,5.0,Why aren't all bibs like this?,"November 3, 2006",B. Heilesen,"Tacoma, Washington USA","I love the Baby Bjorn bib- it is excellent for protecting my 1 year old son's clothes as he learns to feed himself.  It is great for car rides too - I can place Cheerios in the pocket and he can feed himself a little snack.  

The only drawback is that with my son being small, the highchair tray and the pocket are the same height.  However, as he grows taller, they won't interfere with each other"
B0009Z3IBO:amazing:ash_bond,B0009Z3IBO,Gerber Soothing Gel Patches: Baby,baby,1 of 1,5.0,Amazing,"March 30, 2007",Ash Bond,"Columbus, Ga","I gave birth to a premature infant that had to spend a week in the NICU.  Because of that I was forced to establish my milk supply w/ a breastpump.  The morning after I gave birth my husband went Walmart to pick up some of things that we hadn't purchased.  I called him crying and told him that he had to find something for my sore nipples.  Well this is what he brought back.  The relief was instantaneous. I bought a couple more boxes as my daughter ""learned"" to breastfeed.  I use another of their nipple creams for everyday use(they're too expensive to use everday), but I make sure that there is always a box of these in my cabinet! "
"B0001XDOYK:great_monitor:patricia_keller_""mom_of_4""",B0001XDOYK,Evenflo Whisper Connect & 900Mhz Nursery Monitor: Baby,baby,1 of 1,4.0,Great monitor,"August 29, 2006","Patricia Keller ""mom of 4""","Arlington, TX","I received this monitor as a gift and it has been a life saver. How nice that I can monitor my baby's every move and sound without being in the same room every minute!  The are two different channels, so this usually cuts out the extra static or the alarm going off. Sometiems it's also just a matter or re-positioning the monitor to resolve the noise. 
We were suprised one evening when we picked up what sounded like a phone conversation between two girls, but switching to channel B solved that. 
I've used the Evenflo Whisper Connect for about 3 months now and am quite satisfied"
"B0001XDOYK:a_good_monitor_but_it_is_not_worth_the_money:cookie_""cookie""",B0001XDOYK,Evenflo Whisper Connect & 900Mhz Nursery Monitor: Baby,baby,0 of 1,4.0,a good monitor but it is not worth the money,"March 3, 2006","cookie ""cookie""","omaha,ne",i have this monitor now and i'm thinking about return it back cause  although i have the volume on high but still my baby's voice still not clear but other than than it is a good monitor i did not have any problem with the battaries or stati
"B000E0P290:nice_comfy_seat_-_keeps_seatbelt_in_place:patricia_snyder_""snyderfour""",B000E0P290,Graco Turbo Booster Youth Booster Seat: Baby,baby,9 of 11,4.0,Nice comfy seat - keeps seatbelt in place,"December 18, 2006","Patricia Snyder ""snyderfour""","Chicago, IL USA","I own this seat for my son who is age 6. It is the law in my state that children must in a booster or car seat until age 8. The seat material is high quality and the cushioning is very comfotable. The headrest is perfect for long trips since my son can fall asleep without an annoying crick in his neck. The price is decent too.

The only issue I have with this seat is the cupholders. If you have a regular sedan and want to fit others in your car, the cupholders aren't very usable. Additionally, the cupholders don't slide out very well when the child is sitting in the seat. Personally, I leave the cupholders pushed in. I have another carseat for a young infant in my sedan and must fit my 10-year old in the back seat. 

I wish carseat and booster seat makers would instead make a mesh bag pocket hang right off the botton front for kid toys and such. Furthermore, with booster seats in general, I think they are very impractical for families who need to fit 3 kids across the backseat. My son has a very hard time buckling his seat belt because he must reach to the side where space is at a premium.

I would love a forward-facing booster seat with a 5-point harness that would lock into the LATCH loops for the older child. Not only is a 5-point seat harness safer but it is much easier for a child to buckle themselves instead of reaching around to the side.

As far as the options available for a child who has outgrown a convertible seat but is too small for a regular seat belt, this is a nice option."
"B000B4SVME:love_this_highchair:marisa_tenaglia_""mltc01""",B000B4SVME,Fisher-Price Space Saver High Chair- Green: Baby,baby,,5.0,Love this Highchair,"November 27, 2006","Marisa Tenaglia ""MLTC01""","Daytona Beach, Florida","As most of the other reviewers, I live in a small townhome.  This chair is wonderful.  It takes up very little space and is so easy to clean.  I remove the straps and throw them in the wash and they come out so clean.  The rest of the chair is very easy to wipe clean and the tray just gets put in the dishwasher.  Despite carrots, prunes, etc. being mashed into it, the tray hasn't stained at all.  I recommend this chair to all my pregnant friends"
"B000B4SVME:ellie's_favorite_chair!:blanca_duarte_""ellie's_mum""",B000B4SVME,Fisher-Price Space Saver High Chair- Green: Baby,baby,1 of 1,5.0,Ellie's favorite chair!,"November 14, 2006","Blanca Duarte ""Ellie's Mum""","LA, Ca",We have a small home and decided to opt for this type of high chair instead of a stand alone. We just love it and so does our 6 month old
B000B4SVME:my_daughter_loves_this_chair!!!:a._walker,B000B4SVME,Fisher-Price Space Saver High Chair- Green: Baby,baby,,5.0,My Daughter Loves This Chair!!!,"November 9, 2006",A. Walker,"Kingsley, MI USA","I purchased your ""Space Saver Highchair"" for my 9 month old daughter who is severely disabled. Finding equipment for the very young disabled child is very difficult.  This chair works for everything!  This chair is so comforatable for my daughter and allows her to sit up and play with her toys as she gets very bored laying on her back all day.  She also has a very difficult time playing with her toys as her grasp is not well controlled and she is constantly dropping toys on her face or off to the side and cannot get them back in her hand. I love this chair for its size, the way the whole seat tilts (not just the back), and the 5 point harness.  The chair is also small so it holds her very nicely.  My daughter loves nothing more than to sit in this chair all the time"
"B000BZ6BAW:so_far,_so_good:aegina_barnes",B000BZ6BAW,Maclaren Volo Salmon Pink Stroller: Baby,baby,,5.0,"So far, so good","March 8, 2007",Aegina Barnes,New York,"I received this stroller about a week ago, and so far, we love it.  The ride is smooth, it's very light, and I love the salmon color.  The shade comes in handy, too.  It has all the features I'd want while still remaining ight and streamlined.  It's a little awkward to close, but I'm a bit of a klutz, so I assume others might not have this problem.  The handles are great, though, and they're very comfortable for my husband (6 feet) and me (5'7"".)"
B000BZ6BAW:excellent_stroller:yahave,B000BZ6BAW,Maclaren Volo Salmon Pink Stroller: Baby,baby,1 of 1,5.0,Excellent Stroller,"June 22, 2006",yahave,"NY, USA","Lightweight, high-quality construction. We are very pleased with it, and our 1.5yr girl just loves it.  The carrying strap is a very convenient addition. Don't waste your money on a $20 umbrella stroller, spend a little more and enjoy the high quality of this excellent stroller"
B000096PAY:great_feeding_plates:a._ackley,B000096PAY,Sassy Stackable Feeding Plates: Baby,baby,,4.0,Great feeding plates,"March 19, 2007",A. Ackley,,"I was looking for a decent sized, sectioned plate for my 1 year old to have at the dinner table and these were perfect.  I have not used them to travel with but I do not think the lids would stay on the plates very well in that type of setting.  They do work great for her leftovers though when I put them in the fridge.  They are nice and slim and fit well into long skinny areas. "
"B000CQ75DM:great_quality:neill_glancy_""nglan""",B000CQ75DM,Disney Cars Wall Stickers: Baby,baby,,5.0,Great Quality,"March 31, 2007","Neill Glancy ""Nglan""",USA,"These stickers are great. My toddler has a small white table that about every 3 months we decorate with new stuff. This quarter its ""Cars"" he loves them. They are very durable, vibrant and colorful. Highly recommended"
"B0002TEG9U:fantastic:p._johnson_""seahaggy""",B0002TEG9U,Safety 1st Grip 'N Go Walker: Baby,baby,1 of 1,5.0,fantastic,"March 13, 2007","P. Johnson ""Seahaggy""",New Jersey,my granddaughter is one year old. she absolutly loves her new walker. she is small for her age so the adjustable height is perfect
"B0002TEG9U:safety_1st_grip_n'_go_walker:spoiled_rotten_""stacey""",B0002TEG9U,Safety 1st Grip 'N Go Walker: Baby,baby,1 of 1,5.0,Safety 1st Grip N' Go Walker,"March 8, 2007","Spoiled Rotten ""Stacey""","Fort Washington, MD",I brought this walker for my grandson and he loves it. He alway's playing with the objects and is actually walking now. This wallker was easy to assemble also.
B0007D91C8:warm_and_comfy:yee-ming_siu,B0007D91C8,Snuggle Bub Lamb&#146;s Wool Stroller Wrap &#45; Black &#40;Large&#41;: Baby,baby,,4.0,Warm and comfy,"March 8, 2007",Yee-ming Siu,"NY, NY",I had my doubts when we first used it b/c it closes with just some toggle-like buttons and i was worried that the wind would slip through.  But my baby comes out of this stroller-sleeping-bag/wrap warm every time.  And we've had a few days this winter here in the Northeast that have been way below freezing with a wind chill strong enough to sting your face. 
"B000CEGY04:lots_of_fun_in_the_tub:c._leone_""ava's_mommy""",B000CEGY04,Tub Tunes Water Zylophone: Baby,baby,1 of 1,4.0,Lots of fun in the tub,"January 11, 2007","C. Leone ""Ava's mommy""","Reading, PA  USA","I actually had put this on my daughter's wish list and then broke down and bought it myself for her because I just couldn't wait to see if she'd get it for her 1st birthday.  I always take tubbies with my daughter so I like to have fun toys in the tubby that I enjoy too.  My daughter loves her out-of-water xylophone and thinks this one is pretty neat too - I have to admit I play with it more than she does at this point.  She's only 9-1/2 months right now so I think as she gets a bit older she'll enjoy it more.  My only complaint, and the reason I didn't give it 5 stars, it should come with more play sheets and they are NOT waterproof.  Other than that, a fun toy.  After I got this, I did find it at Target for the same price it's listed here with no s&h charges but still don't regret getting it. "
B000CEGY04:interesting_toy:b._e_jackson,B000CEGY04,Tub Tunes Water Zylophone: Baby,baby,1 of 1,4.0,interesting toy,"October 29, 2006",B. E Jackson,Pennsylvania,"This is one interesting toy!  I love the way it creates music when it floats on top of the water!  You can even create music for it, which is something I've never thought would be possible.  Kids today have it made! "
B000I2MRHE:i_want_one!!:sarah_a._martini,B000I2MRHE,Lamaze  Spin & Explore Garden Gym: Baby,baby,,5.0,I want one!!,"March 26, 2007",Sarah A. Martini,North Carolina,"If they made one of these things for adults, I'd get one!!  My daughter LOVES this thing.  It's got that crinkle-sounding paper that babies seem to love, and spins really easily. The colors are really bright and everything is easily accessable for little arms and hands.  I have already told my pregnant friends that they need to get one of these"
B000EMZAZO:changing_pad:leslie_lankford,B000EMZAZO,Tiddliwinks Contoured Changing Pad &#45; White: Baby,baby,,4.0,Changing pad,"February 27, 2007",Leslie Lankford,"Fort Worth, Texas United States","This seems to be a decent changing pad with the exception of it not being easy to clean. I am having a real hard time cleaning it and never had this problem with other changing pads. It's almost porous! If you get this changing pad, plan on having a cover on it at all times to keep it clean."
"B000056OWT:good_quality_for_good_price:nadejda_poznanskaya_""nadejda""",B000056OWT,Safety 1st Monitor &#45; 49230C: Baby,baby,,5.0,good quality for good price,"March 12, 2007","Nadejda Poznanskaya ""Nadejda""",USA,"It works great for me. I have 2 floor + 2 kids + 2 cats and before I didn't know what going on in my house. Now I can hear any sound - guests coming, kids playing/watching TV and even when cats jump on dining table to steel some food.
It makes some fone sound on max volume, but I don't care - I just reduse volume or change unit position. I strongly recomend this Monitor"
